id,description,category,price,receiver,date,party,gifter,gift
374,"Ontvangen voor het houden van een lezing voor Calvijnschool, Ederveen (ouderavond) €200,-.",cadeaubonnen en geldbedragen,200.0,"Bisschop, R. (Roelof)",2018-04-16,SGP,een lezing,
375,"Ontvangen voor het houden van een lezing voor COGG een boek ter waarde van ca. €80,-.",boeken,80.0,"Bisschop, R. (Roelof)",2017-03-29,SGP,een lezing,voor het houden van een lezing voor COGG een boek ter waarde van
376,"Ontvangen voor het houden van een lezing bij Van Lodensteincollege €90,-.",cadeaubonnen en geldbedragen,90.0,"Bisschop, R. (Roelof)",2017-02-23,SGP,nan,
377,"Ontvangen in het kader van Valentijn een stofzuiger ter waarde van €205,- van Klop Innovations. De stofzuiger wordt geveild voor het goede doel.",overig,205.0,"Bisschop, R. (Roelof)",2017-02-14,SGP,Valentijn,het kader van Valentijn een stofzuiger ter waarde van
378,"Ontvangen voor het houden van een lezing bij Jeugdvereniging GGiN Barneveld €100,-.",cadeaubonnen en geldbedragen,100.0,"Bisschop, R. (Roelof)",2017-01-28,SGP,nan,
379,"Ontvangen voor het houden van lezingen voor Stichting Studie Nadere Reformatie €250,-.",cadeaubonnen en geldbedragen,250.0,"Bisschop, R. (Roelof)",2017-01-21,SGP,lezingen,
380,"Ontvangen voor het houden van een lezing bij Driestar Educatief €200,-.",cadeaubonnen en geldbedragen,200.0,"Bisschop, R. (Roelof)",2016-10-21,SGP,nan,
381,"Ontvangen voor het houden van een lezing bij de Inspectiekring in Utrecht €75,-.",cadeaubonnen en geldbedragen,75.0,"Bisschop, R. (Roelof)",2015-11-23,SGP,een lezing bij,
382,"Ontvangen voor het houden van een lezing voor Stichting Studie Nadere Reformatie €100,-.",cadeaubonnen en geldbedragen,100.0,"Bisschop, R. (Roelof)",2015-09-26,SGP,een lezing,
383,"Ontvangen voor het verzorgen van een lezing tijdens de jaaropening Eben Haëzerschool te Drachten €200,-.",cadeaubonnen en geldbedragen,200.0,"Bisschop, R. (Roelof)",2015-08-19,SGP,een lezing,
384,"Ontvangen voor het verzorgen van een lezing voor Vereniging voor het verstrekken van basisonderwijs op gereformeerde grondslag te Ermelo €125,-",cadeaubonnen en geldbedragen,125.0,"Bisschop, R. (Roelof)",2015-06-29,SGP,een lezing,
385,"Ontvangen voor het verzorgen van een lezing voor een conferentie Reformatorisch Samenwerkingsverband Voortgezet Onderwijs, Hoornbeeck, Samenwerking Christelijke Jeugdzorg e.a., Amersfoort €200,-.",cadeaubonnen en geldbedragen,200.0,"Bisschop, R. (Roelof)",2015-02-13,SGP,een lezing,
386,"Ontvangen voor het houden van een spreekbeurt voor de SGP in Ridderkerk €150,-",cadeaubonnen en geldbedragen,150.0,"Bisschop, R. (Roelof)",2014-10-06,SGP,een spreekbeurt,
387,"Ontvangen voor het houden van een lezing bij de Jaarvergadering Van Lodensteincollege, Amersfoort €100,-.",cadeaubonnen en geldbedragen,100.0,"Bisschop, R. (Roelof)",2014-06-10,SGP,een lezing bij,
388,"Ontvangen voor het houden van een lezing tijdens de studiedag Antisemitisme GG €100,-.",cadeaubonnen en geldbedragen,100.0,"Bisschop, R. (Roelof)",2014-05-30,SGP,een lezing,
389,"Ontvangen voor het houden van een lezing bij de Jaarvergadering Jhr. W. Versluijsschool, Aagtekerke €225,- (incl. reis- en verblijfskosten)",cadeaubonnen en geldbedragen,225.0,"Bisschop, R. (Roelof)",2014-04-14,SGP,een lezing bij,
390,"Ontvangen voor het houden van een spreekbeurt voor de SGP Kampen €100,-",cadeaubonnen en geldbedragen,100.0,"Bisschop, R. (Roelof)",2014-03-03,SGP,een spreekbeurt,
391,"Ontvangen voor het houden van een spreekbeurt voor de SGP Apeldoorn €100,-.",cadeaubonnen en geldbedragen,100.0,"Bisschop, R. (Roelof)",2014-02-25,SGP,een spreekbeurt,
392,"Ontvangen voor het houden van een spreekbeurt voor de SGP Twenterand €160,-.",cadeaubonnen en geldbedragen,160.0,"Bisschop, R. (Roelof)",2014-02-21,SGP,een spreekbeurt,
393,"Ontvangen voor het houden van een spreekbeurt voor de SGP Geldermalsen € 100,-.",cadeaubonnen en geldbedragen,100.0,"Bisschop, R. (Roelof)",2014-02-10,SGP,een spreekbeurt,
394,Ontvangen van de KNVB kaarten voor een Europese wedstrijd van AZ Alkmaar inclusief drankjes en promo-materiaal en tevens werkbezoek over stadionveiligheid. De waarde is onbekend.,uitnodigingen en tickets,,"Boulakjar, F. (Faissal)",2022-11-03,D66,de KNVB kaarten,de KNVB kaarten voor een Europese wedstrijd van AZ Alkmaar inclusief drankjes en promo-materiaal en tevens werkbezoek over stadionveiligheid. De waarde is onbekend
395,"Ontvangen van Uitgeverij Noordhoff de 56e editie van De Grote Bosatlas ter waarde van €69,95.",boeken,69.95,"Boulakjar, F. (Faissal)",2022-04-06,D66,Uitgeverij Noordhoff,de 56e editie van De Grote Bosatlas ter waarde van
396,"Ontvangen van de Atlantische Commissie, het boek “Poverty by America”. De waarde is €24,-.",boeken,24.0,"Brekelmans, R.P. (Ruben)",2023-10-30,VVD,"de Atlantische Commissie,",
397,"Ontvangen van de Jonge Atlantici, het boek “A Woman’s Place - US counterterrorism since 9/11”. De waarde is €34,34 in de boekhandel.",boeken,34.34,"Brekelmans, R.P. (Ruben)",2023-10-23,VVD,"de Jonge Atlantici,",
398,"Ontvangen van de JOVD Breda, een fles wijn. De waarde is onbekend.",etenswaren en dranken,,"Brekelmans, R.P. (Ruben)",2023-10-19,VVD,"de JOVD Breda,"," de JOVD Breda, een fles wijn. De waarde is onbekend"
399,Ontvangen van de vertegenwoordiger van Taiwan een doosje thee en een doosje met koekjes. De waarde is onbekend.,etenswaren en dranken,,"Brekelmans, R.P. (Ruben)",2023-09-25,VVD,de vertegenwoordiger van Taiwan,de vertegenwoordiger van Taiwan een doosje thee en een doosje met koekjes. De waarde is onbekend
400,Ontvangen van de vertegenwoordiger van Taiwan een bos bloemen. De waarde is onbekend.,bloemen,,"Brekelmans, R.P. (Ruben)",2023-07-21,VVD,de vertegenwoordiger van Taiwan,de vertegenwoordiger van Taiwan een bos bloemen. De waarde is onbekend
401,"Ontvangen van de delegatie van de Koreaanse Nationale Assemblee, een decoratief doosje, met een geschatte waarde van €42,-.",overig,42.0,"Brekelmans, R.P. (Ruben)",2023-07-03,VVD,de delegatie van,
402,Ontvangen van VVD Westfriesland twee Westfriese krentenmikken als dank voor een gegeven lezing. De waarde is onbekend.,etenswaren en dranken,,"Brekelmans, R.P. (Ruben)",2023-07-01,VVD,VVD Westfriesland,twee Westfriese krentenmikken als dank voor een gegeven lezing. De waarde is onbekend
403,Ontvangen van de ambassade van Canada ter gelegenheid van Canada Day een “Canada in a Box” doos met Canadese patisserie. De waarde is onbekend.,overig,,"Brekelmans, R.P. (Ruben)",2023-06-29,VVD,de ambassade van Canada ter,de ambassade van Canada ter gelegenheid van Canada Day een “Canada in a Box” doos met Canadese patisserie. De waarde is onbekend
404,Ontvangen van de vertegenwoordiger van Taiwan een speldje met de vlaggen van Nederland en Taiwan. De waarde is onbekend.,overig,,"Brekelmans, R.P. (Ruben)",2023-06-29,VVD,de vertegenwoordiger van Taiwan,de vertegenwoordiger van Taiwan een speldje met de vlaggen van Nederland en Taiwan. De waarde is onbekend
405,"Ontvangen het boek “Politieke polarisatie in Nederland” van Paul Dekker ter waarde van €19,90.",boeken,19.9,"Brekelmans, R.P. (Ruben)",2023-06-29,VVD,nan,het boek “Politieke polarisatie in Nederland” van Paul Dekker ter waarde van
406,Ontvangen van de VVD Maastricht twee mokken als dank voor een gegeven lezing. De waarde is onbekend.,overig,,"Brekelmans, R.P. (Ruben)",2023-06-23,VVD,de VVD Maastricht,de VVD Maastricht twee mokken als dank voor een gegeven lezing. De waarde is onbekend
407,"Ontvangen van Dhr. Barreveld het boek “Pieter Stuyvesant – Het brein achter onze rol in de slavenhandel” van Dirk-Jan Barreveld met een geschatte waarde van €23,99.",boeken,23.99,"Brekelmans, R.P. (Ruben)",2023-06-20,VVD,Dhr. Barreveld,
408,Ontvangen van de vertegenwoordiger van Taiwan een doosje thee en een doosje chocolade. De waarde is onbekend.,etenswaren en dranken,,"Brekelmans, R.P. (Ruben)",2023-03-29,VVD,de vertegenwoordiger van Taiwan,de vertegenwoordiger van Taiwan een doosje thee en een doosje chocolade. De waarde is onbekend
409,"Ontvangen het boek “Worst Bank Scenario” van Hester Bias en Wink Sabée met een geschatte waarde van €25,-.",boeken,25.0,"Brekelmans, R.P. (Ruben)",2023-03-14,VVD,Hester Bias en Wink Sabée met,
410,"Ontvangen van de ambassadeur van Moldavië een fles rode wijn met een geschatte waarde van €8,-.",etenswaren en dranken,8.0,"Brekelmans, R.P. (Ruben)",2023-03-09,VVD,de ambassadeur van Moldavië,
411,"Ontvangen van de JOVD Amsterdam als dank voor een gegeven lezing, het boek “From Russia with Blood” van Heidi Blake. De waarde is onbekend.",boeken,,"Brekelmans, R.P. (Ruben)",2023-03-09,VVD,de JOVD Amsterdam als dank," de JOVD Amsterdam als dank voor een gegeven lezing, het boek “From Russia with Blood” van Heidi Blake. De waarde is onbekend"
412,"Ontvangen van de ambassadeur van Bulgarije een fles rode wijn met een geschatte waarde van €12,50.",etenswaren en dranken,12.5,"Brekelmans, R.P. (Ruben)",2023-03-07,VVD,de ambassadeur van Bulgarije,
413,"Ontvangen van de Ambassadeur van India het boek “The India Way” van S. Jaishankar met een geschatte waarde van €30,- en het boek “India, exotic destination” van Tarun Chopra met een geschatte waarde van €25,-.",boeken,30.0,"Brekelmans, R.P. (Ruben)",2023-02-22,VVD,de Ambassadeur van India,
414,Ontvangen van de Thorbecke tafel van sociëteit de Witte een fles witte wijn als dank voor een gegeven lezing. De waarde is onbekend.,etenswaren en dranken,,"Brekelmans, R.P. (Ruben)",2023-02-22,VVD,de Thorbecke tafel van sociëteit,de Thorbecke tafel van sociëteit de Witte een fles witte wijn als dank voor een gegeven lezing. De waarde is onbekend
415,Ontvangen van de delegatie van ANTS NGO kleine gedenkwaardige cadeaus uit Oekraïne. De waarde is onbekend.,overig,,"Brekelmans, R.P. (Ruben)",2023-02-21,VVD,nan,de delegatie van ANTS NGO kleine gedenkwaardige cadeaus uit Oekraïne. De waarde is onbekend
416,"Ontvangen van VNO NCW Brabant Zeeland als dank voor een gegeven lezing, een fles wijn. De waarde is onbekend.",etenswaren en dranken,,"Brekelmans, R.P. (Ruben)",2023-01-20,VVD,VNO NCW Brabant Zeeland als dank," voor een gegeven lezing, een fles wijn. De waarde is onbekend"
417,"Ontvangen van de vertegenwoordiger van Taiwan een agenda van onbekende waarde en een fles whisky ter waarde van €42,95.",etenswaren en dranken,42.95,"Brekelmans, R.P. (Ruben)",2023-01-17,VVD,de vertegenwoordiger van Taiwan,de vertegenwoordiger van Taiwan een agenda van onbekende waarde en een fles whisky ter waarde van
418,Ontvangen van de ambassadeur van Bangladesh een agenda. De waarde is onbekend.,overig,,"Brekelmans, R.P. (Ruben)",2023-01-17,VVD,de ambassadeur van Bangladesh,de ambassadeur van Bangladesh een agenda. De waarde is onbekend
419,Ontvangen van de ambassadeur van Japan een kalender. De waarde is onbekend.,overig,,"Brekelmans, R.P. (Ruben)",2023-01-17,VVD,de ambassadeur van Japan,de ambassadeur van Japan een kalender. De waarde is onbekend
420,"Ontvangen van de ambassadeur van Griekenland een fles Mastiha likeur ter waarde van €20,95.",etenswaren en dranken,20.95,"Brekelmans, R.P. (Ruben)",2022-12-22,VVD,de ambassadeur van Griekenland,de ambassadeur van Griekenland een fles Mastiha likeur ter waarde van
421,Ontvangen van Mevr. Bergkamp twee waxinelichtjeshouders. De waarde is onbekend.,overig,,"Brekelmans, R.P. (Ruben)",2022-12-22,VVD,Mevr. Bergkamp,twee waxinelichtjeshouders. De waarde is onbekend
422,"Ontvangen van de ambassade van Armenië een fles witte wijn ter waarde van €9,95.",etenswaren en dranken,9.95,"Brekelmans, R.P. (Ruben)",2022-12-20,VVD,de ambassade van Armenië,de ambassade van Armenië een fles witte wijn ter waarde van
423,Ontvangen van Aqua Minerals een flesje bier. De waarde is onbekend.,etenswaren en dranken,,"Brekelmans, R.P. (Ruben)",2022-12-20,VVD,Aqua Minerals,een flesje bier. De waarde is onbekend
424,"Ontvangen het boek ‘Handboek Minister’ van uitgeverij Elsevier Boeken ter waarde €14,95.",boeken,14.95,"Brekelmans, R.P. (Ruben)",2022-12-13,VVD,nan,
425,Ontvangen van de Ambassadeur van Bangladesh twee doosjes thee. De waarde is onbekend.,etenswaren en dranken,,"Brekelmans, R.P. (Ruben)",2022-11-30,VVD,de Ambassadeur van Bangladesh,de Ambassadeur van Bangladesh twee doosjes thee. De waarde is onbekend
426,"Ontvangen van de JOVD Baronie van Breda en het Cadettenkorps als dank voor een gegeven lezing, een fles wijn en manchetknopen. De waarde is onbekend.",etenswaren en dranken,,"Brekelmans, R.P. (Ruben)",2022-11-22,VVD,de JOVD Baronie van Breda en," de JOVD Baronie van Breda en het Cadettenkorps als dank voor een gegeven lezing, een fles wijn en manchetknopen. De waarde is onbekend"
427,"Ontvangen van de Ambassadeur van Bangladesh het boek ""De Onvoltooide Memoires"" van Sheikh Mujibur Rahman met een geschatte waarde van €22,- en het boek ""Bangladesh and the Netherlands, The water story: celebrating 50 years of",boeken,22.0,"Brekelmans, R.P. (Ruben)",2022-09-28,VVD,de Ambassadeur van Bangladesh,
428,"Ontvangen van Dhr. G. Wilders, het boek ""The Satanic Verses"" van Salman Rushdie met een geschatte waarde van €13,-.",boeken,13.0,"Brekelmans, R.P. (Ruben)",2022-09-21,VVD,"Dhr. G. Wilders,",
429,"Ontvangen van de VVD Den Haag als dank voor een gegeven lezing een flesje Jenever met een geschatte waarde van €10,-.",etenswaren en dranken,10.0,"Brekelmans, R.P. (Ruben)",2022-09-08,VVD,de VVD Den Haag als dank,
430,"Ontvangen van de vertegenwoordiger van Taiwan, een doosje thee. De waarde is onbekend.",etenswaren en dranken,,"Brekelmans, R.P. (Ruben)",2022-08-30,VVD,"de vertegenwoordiger van Taiwan,"," de vertegenwoordiger van Taiwan, een doosje thee. De waarde is onbekend"
431,"Ontvangen van de Werkgroep Europa van het VVD Thematisch Netwerk Internationaal als dank voor een gegeven lezing het boek 'De Churchill Factor' van Boris Johnson met een geschatte waarde van €10,-.",boeken,10.0,"Brekelmans, R.P. (Ruben)",2022-08-23,VVD,de Werkgroep Europa van,
432,"Ontvangen van de vertegenwoordiger van Taiwan, een bos bloemen. De waarde is onbekend.",bloemen,,"Brekelmans, R.P. (Ruben)",2022-07-16,VVD,"de vertegenwoordiger van Taiwan,"," de vertegenwoordiger van Taiwan, een bos bloemen. De waarde is onbekend"
433,"Ontvangen van de Raad voor Bestuur het boek ‘Wetenschap en Overheidsbeleid - een spanningsvolle relatie’ met een geschatte waarde van €25,-.",boeken,25.0,"Brekelmans, R.P. (Ruben)",2022-07-12,VVD,de Raad,
434,Ontvangen van de Ambassadeur van Frankrijk een mand met Franse specialiteiten. De waarde is onbekend.,overig,,"Brekelmans, R.P. (Ruben)",2022-07-12,VVD,de Ambassadeur van Frankrijk,de Ambassadeur van Frankrijk een mand met Franse specialiteiten. De waarde is onbekend
435,"Ontvangen van de Ambassadeur van Nieuw Zeeland een fles wijn met een geschatte waarde van €10,-.",etenswaren en dranken,10.0,"Brekelmans, R.P. (Ruben)",2022-07-07,VVD,de Ambassadeur van Nieuw Zeeland,
436,Ontvangen van Uitgeverij Noordhoff de zesenvijftigste editie van de Grote Bosatlas. De waarde is onbekend.,boeken,69.95,"Brekelmans, R.P. (Ruben)",2022-03-30,VVD,Uitgeverij Noordhoff,de zesenvijftigste editie van de Grote Bosatlas. De waarde is onbekend
437,"Ontvangen van de Ambassadeur van de Republiek Noord Macedonië een fles wijn ter waarde van ongeveer €10,-.",etenswaren en dranken,10.0,"Brekelmans, R.P. (Ruben)",2022-02-09,VVD,de Ambassadeur van,de Ambassadeur van de Republiek Noord Macedonië een fles wijn ter waarde van
438,Ontvangen van de ambassade van de Volksrepubliek China een kalender voor 2022. De waarde is onbekend.,overig,,"Brekelmans, R.P. (Ruben)",2022-01-20,VVD,de ambassade van,de ambassade van de Volksrepubliek China een kalender voor 2022. De waarde is onbekend
439,"Ontvangen het boek ""Moraal"" van Jonathan Sacks met een geschatte waarde van €27,50.",boeken,27.5,"Brekelmans, R.P. (Ruben)",2022-01-20,VVD,Jonathan Sacks met,
440,Ontvangen van de Ambassadeur van de Republiek Moldavië een fles wijn. De waarde is onbekend.,etenswaren en dranken,,"Brekelmans, R.P. (Ruben)",2022-01-19,VVD,de Ambassadeur van,de Ambassadeur van de Republiek Moldavië een fles wijn. De waarde is onbekend
441,"Ontvangen van de vertegenwoordiger van Taiwan een plant van onbekende waarde, een agenda van onbekende waarde en een fles whisky ter waarde van €48,50.",etenswaren en dranken,48.5,"Brekelmans, R.P. (Ruben)",2022-01-11,VVD,de vertegenwoordiger van Taiwan," de vertegenwoordiger van Taiwan een plant van onbekende waarde, een agenda van onbekende waarde en een fles whisky ter waarde van"
442,"Ontvangen van de ambassade van Armenië een fles witte wijn ter waarde van €9,95.",etenswaren en dranken,9.95,"Brekelmans, R.P. (Ruben)",2022-01-11,VVD,de ambassade van Armenië,de ambassade van Armenië een fles witte wijn ter waarde van
443,Ontvangen van de ambassadeur van Bangladesh een agenda. De waarde is onbekend.,overig,,"Brekelmans, R.P. (Ruben)",2022-01-11,VVD,de ambassadeur van Bangladesh,de ambassadeur van Bangladesh een agenda. De waarde is onbekend
444,"Ontvangen van het Sloveense voorzitterschap van de Raad van de EU een receptenboekje, twee potjes zout, een reep chocolade en bloemzaadjes. De waarde is onbekend.",etenswaren en dranken,,"Brekelmans, R.P. (Ruben)",2022-01-11,VVD,het Sloveense voorzitterschap van," het Sloveense voorzitterschap van de Raad van de EU een receptenboekje, twee potjes zout, een reep chocolade en bloemzaadjes. De waarde is onbekend"
445,Ontvangen van Dhr. Tseng een Taiwanees porseleinen bordje. De waarde is onbekend.,overig,,"Brekelmans, R.P. (Ruben)",2021-12-09,VVD,Dhr. Tseng,een Taiwanees porseleinen bordje. De waarde is onbekend
446,Ontvangen van de Ambassadeur van België een doosje Belgische chocolade t.g.v. Koningsdag in België. De waarde is onbekend.,etenswaren en dranken,,"Brekelmans, R.P. (Ruben)",2021-11-15,VVD,de Ambassadeur van België,de Ambassadeur van België een doosje Belgische chocolade t.g.v. Koningsdag in België. De waarde is onbekend
447,"Ontvangen van de vertegenwoordiger van Taiwan een doosje thee met onbekende waarde, een agenda voor 2022 met onbekende waarde en het boek “Formosa, voorgoed verloren” van Joyce Bergvelt ter waarde van €29,99.",boeken,29.99,"Brekelmans, R.P. (Ruben)",2021-11-08,VVD,de vertegenwoordiger van Taiwan," de vertegenwoordiger van Taiwan een doosje thee met onbekende waarde, een agenda voor 2022 met onbekende waarde en het boek “Formosa, voorgoed verloren” van Joyce Bergvelt ter waarde van"
448,Ontvangen van de Ambassadeur van Nieuw Zeeland een leren visitekaartjeshouder. De waarde is onbekend.,uitnodigingen en tickets,,"Brekelmans, R.P. (Ruben)",2021-11-08,VVD,de Ambassadeur van Nieuw Zeeland,de Ambassadeur van Nieuw Zeeland een leren visitekaartjeshouder. De waarde is onbekend
449,"Ontvangen van de Ambassadeur van de Volksrepubliek China een doosje ""Mooncakes"". De waarde is onbekend.",etenswaren en dranken,,"Brekelmans, R.P. (Ruben)",2021-09-29,VVD,de Ambassadeur van," de Ambassadeur van de Volksrepubliek China een doosje ""Mooncakes"". De waarde is onbekend"
450,Ontvangen van de Ambassadeur van de Republiek Indonesië een sjaal en een kookboek. De waarde is onbekend.,boeken,,"Brekelmans, R.P. (Ruben)",2021-08-13,VVD,de Ambassadeur van,de Ambassadeur van de Republiek Indonesië een sjaal en een kookboek. De waarde is onbekend
451,Ontvangen van de Ambassadeur van de Republiek Korea een doosje thee. De waarde is onbekend.,etenswaren en dranken,,"Brekelmans, R.P. (Ruben)",2021-08-11,VVD,de Ambassadeur van,de Ambassadeur van de Republiek Korea een doosje thee. De waarde is onbekend
452,"Ontvangen het boek ""Stress is een keuze"" met een geschatte waarde van €25,-.",boeken,25.0,"Brekelmans, R.P. (Ruben)",2021-07-01,VVD,nan,
453,"Ontvangen van de Ambassadeur van de Republiek Azerbaijan, een potje granaatappelconfituur en een flesje granaatappelsaus. De waarde is onbekend.",etenswaren en dranken,,"Brekelmans, R.P. (Ruben)",2021-06-23,VVD,de Ambassadeur van," de Ambassadeur van de Republiek Azerbaijan, een potje granaatappelconfituur en een flesje granaatappelsaus. De waarde is onbekend"
454,"Ontvangen van Vewin een Dopper waterfles met een geschatte waarde van €15,-.",etenswaren en dranken,15.0,"Brekelmans, R.P. (Ruben)",2021-04-22,VVD,Vewin,
455,Ontvangen van het Interprovinciaal Overleg (IPO) een vogelhuisje en Tony’s Chocolonely’s chocolade eitjes. De waarde is onbekend.,etenswaren en dranken,,"Brekelmans, R.P. (Ruben)",2021-04-22,VVD,het Interprovinciaal Overleg (IPO),het Interprovinciaal Overleg (IPO) een vogelhuisje en Tony’s Chocolonely’s chocolade eitjes. De waarde is onbekend
456,Ontvangen van de Nederlandse bierbrouwers een bierpakket. De waarde is onbekend.,etenswaren en dranken,,"Brekelmans, R.P. (Ruben)",2021-04-22,VVD,de Nederlandse bierbrouwers,de Nederlandse bierbrouwers een bierpakket. De waarde is onbekend
457,Ontvangen van de Provincie Groningen een draadloze telefoonoplader en telefoonhouder. De waarde is onbekend.,overig,,"Brekelmans, R.P. (Ruben)",2021-04-22,VVD,de Provincie Groningen,de Provincie Groningen een draadloze telefoonoplader en telefoonhouder. De waarde is onbekend
458,"Ontvangen van Pieter Omtzigt het boek ""Een nieuw sociaal contract"" met een geschatte waarde van €20,-.",boeken,20.0,"Brekelmans, R.P. (Ruben)",2021-04-22,VVD,Pieter Omtzigt,
459,"Ontvangen van de UvA i.v.m. gastspreker tijdens de Opening Academisch Jaar Afdeling Neerlandistiek een boekenbon ter waarde van €50,-.",boeken,50.0,"Bromet, L. (Laura)",2022-09-16,GL-PvdA,de UvA i.v.m. gastspreker,de UvA i.v.m. gastspreker tijdens de Opening Academisch Jaar Afdeling Neerlandistiek een boekenbon ter waarde van
460,"Ontvangen tijdens een werkbezoek met de vaste commissie voor Binnenlandse Zaken aan Wenen het boek 'Architecture in Austria in the 20th and 21st centuries' ter waarde van €68,-.",uitnodigingen en tickets,68.0,"Bromet, L. (Laura)",2022-09-09,GL-PvdA,nan,een werkbezoek met de vaste commissie voor Binnenlandse Zaken aan Wenen het boek 'Architecture in Austria in the 20th and 21st centuries' ter waarde van
461,"Ontvangen van Diervriendelijk Nederland en Vegan Today een doos met vriendelijke, plantaardige levensmiddelen. De waarde is onbekend.",overig,,"Bromet, L. (Laura)",2022-09-06,GL-PvdA,Diervriendelijk Nederland en Vegan Today," een doos met vriendelijke, plantaardige levensmiddelen. De waarde is onbekend"
462,"Ontvangen van Noordhoff uitgevers de zesenvijftigste editie van de Grote Bosatlas ter waarde van € 69,95.",boeken,69.95,"Bromet, L. (Laura)",2022-04-01,GL-PvdA,Noordhoff uitgevers,de zesenvijftigste editie van de Grote Bosatlas ter waarde van
463,"Ontvangen een jaarlidmaatschap en een diner van De Kring ter waarde van € 400,-.",overig,400.0,"Bromet, L. (Laura)",2019-11-05,GL-PvdA,De Kring ter waarde van €,een jaarlidmaatschap en een diner van De Kring ter waarde van
464,"Ontvangen van Jean-Marc van Tol het boek 'Musch' ter waarde van € 29,95.",boeken,29.95,"Bromet, L. (Laura)",2019-10-02,GL-PvdA,Jean-Marc van Tol,het boek 'Musch' ter waarde van
465,"Ontvangen van de Provincie Noord-Holland als dank voor haar werkzaamheden als (in)formateur tijdens de formatie een weekendje weg voor twee personen ter waarde van €400,-.",cadeaubonnen en geldbedragen,400.0,"Bromet, L. (Laura)",2019-06-12,GL-PvdA,de Provincie Noord-Holland als dank,de Provincie Noord-Holland als dank voor haar werkzaamheden als (in)formateur tijdens de formatie een weekendje weg voor twee personen ter waarde van
466,"Ontvangen een afscheidsetentje (waarde onbekend) van de Raad van Toezicht van Landschap Noord-Holland en een weekendje weg ter waarde van €500,-.",cadeaubonnen en geldbedragen,500.0,"Bromet, L. (Laura)",2018-12-19,GL-PvdA,Toezicht van Landschap Noord-Holland en,een afscheidsetentje (waarde onbekend) van de Raad van Toezicht van Landschap Noord-Holland en een weekendje weg ter waarde van
467,Ontvangen van FNLI twee symbolische bomen. De waarde is onbekend.,overig,,"Bushoff, T.J. (Julian)",2023-10-26,GL-PvdA,nan,twee symbolische bomen. De waarde is onbekend
468,Ontvangen van Natuurmonumenten een houten borrelplank. De waarde is onbekend.,overig,,"Bushoff, T.J. (Julian)",2023-10-10,GL-PvdA,Natuurmonumenten,een houten borrelplank. De waarde is onbekend
469,Ontvangen van de Graanrepubliek een fles jonge jenever. De waarde is onbekend.,etenswaren en dranken,,"Bushoff, T.J. (Julian)",2023-06-23,GL-PvdA,de Graanrepubliek,de Graanrepubliek een fles jonge jenever. De waarde is onbekend
470,Ontvangen van de Graanrepubliek een tasje met lokaal geproduceerde producten. De waarde is onbekend.,overig,,"Bushoff, T.J. (Julian)",2023-06-23,GL-PvdA,de Graanrepubliek,de Graanrepubliek een tasje met lokaal geproduceerde producten. De waarde is onbekend
471,Ontvangen van Royal Avebe een tasje met producten. De waarde is onbekend.,overig,,"Bushoff, T.J. (Julian)",2023-06-23,GL-PvdA,Royal Avebe,een tasje met producten. De waarde is onbekend
472,"Ontvangen van Nationale Parken Bureau het boek ‘van Nature’ van Marcel van Ool en Marieke Schatteleijn, ter waarde van € 40,-.",boeken,40.0,"Bushoff, T.J. (Julian)",2022-12-14,GL-PvdA,Nationale Parken Bureau," het boek ‘van Nature’ van Marcel van Ool en Marieke Schatteleijn, ter waarde van"
473,Ontvangen van Uitgeverij Noordhoff de zesenvijftigste editie van de Grote Bosatlas. De waarde is onbekend.,boeken,69.95,"Bushoff, T.J. (Julian)",2022-03-30,GL-PvdA,Uitgeverij Noordhoff,de zesenvijftigste editie van de Grote Bosatlas. De waarde is onbekend
474,Ontvangen van de LTO Academie een beeldje van Cow Parade. De waarde is onbekend.,overig,,"Bushoff, T.J. (Julian)",2021-11-11,GL-PvdA,de LTO Academie,de LTO Academie een beeldje van Cow Parade. De waarde is onbekend
