id,description,category,price,receiver,date,party,gifter,gift
1260,"Ontvangen van NOC NSF in het kader van de sportieve opening van het parlementaire jaar een Voetbalshirt, voetbalbroek en voetbalsokken. De waarde is onbekend en voor eigen gebruik gehouden.",overig,,"Mohandis, M. (Mohammed)",2013-10-24,GL-PvdA,NOC NSF in," het kader van de sportieve opening van het parlementaire jaar een Voetbalshirt, voetbalbroek en voetbalsokken. De waarde is onbekend"
1261,"Ontvangen van Stichting lezen en schrijven in het kader van de voorleesestafette het spel ""Woordzoeker"" ter waarde €27,99. Voor eigen gebruik gehouden.",overig,27.99,"Mohandis, M. (Mohammed)",2013-10-24,GL-PvdA,Stichting lezen en schrijven in,
1262,"Ontvangen van Buma-Stemra de CD ""Summer edition 2013"" van de Kids Top 20 ter waarde van €15,99. Voor eigen gebruik gehouden.",overig,15.99,"Mohandis, M. (Mohammed)",2013-10-24,GL-PvdA,Buma-Stemra," de CD ""Summer edition 2013"" van de Kids Top 20 ter waarde van"
1263,"Ontvangen van uitgeverij Luitingh-Sijthoff het boek ""Een broze waarheid"" van auteur John le Carré in het kader van de politieke achtergrond van het boek. De waarde is €19,95 en voor eigen gebruik gehouden.",boeken,19.95,"Mohandis, M. (Mohammed)",2013-05-22,GL-PvdA,uitgeverij Luitingh-Sijthoff,
1264,"Aanwezig kennismaking Amsterdam Dance Event, dagkaart ter waarde van €95,- (alleen gebruik gemaakt van de borrel). Ontvangen een tas ter waarde van €69,95. Voor eigen gebruik gehouden.",uitnodigingen en tickets,95.0,"Mohandis, M. (Mohammed)",2012-10-17,GL-PvdA,"€95,- (alleen gebruik gemaakt van",de borrel). Ontvangen een tas ter waarde van
1265,"Ontvangen 12 zakjes bloembollen met een totale waarde van €60,-.",bloemen,60.0,"Mulder, E. (Edgar)",2022-10-20,PVV,nan,
1266,Ontvangen van Noordhoff uitgevers de zesenvijftigste editie van de Grote Bosatlas. De waarde is onbekend.,boeken,69.95,"Mulder, E. (Edgar)",2022-04-05,PVV,Noordhoff uitgevers,de zesenvijftigste editie van de Grote Bosatlas. De waarde is onbekend
1267,"Ontvangen van de burgemeester van Alkmaar in het kader van gesprekken met burgemeesters, politie en OvJ over jonge doorgroeiers in de criminaliteit een diner en een kaart voor een voetbalwedstrijd. De waarde is onbekend. Voor eigen",uitnodigingen en tickets,,"Mutluer, S. (Songül)",2023-02-07,GL-PvdA,de burgemeester van Alkmaar in," de burgemeester van Alkmaar in het kader van gesprekken met burgemeesters, politie en OvJ over jonge doorgroeiers in de criminaliteit een diner en een kaart voor een voetbalwedstrijd. De waarde is onbekend"
1268,Ontvangen foto’s n.a.v. fotoreportage voor een interview voor de Academie voor de rechtspraktijk. De waarde onbekend.,overig,,"Mutluer, S. (Songül)",2022-12-16,GL-PvdA,nan,
1269,"Ontvangen van Martin Bosma als cadeau bij de beëdiging het boek 'Schijn-Elite Van De Valsemunters' ter waarde van €89,-. Aan derden geschonken.",boeken,89.0,"Mutluer, S. (Songül)",2022-02-17,GL-PvdA,Martin Bosma als cadeau bij,de beëdiging het boek 'Schijn-Elite Van De Valsemunters' ter waarde van
1270,"Ontvangen van de gemeente Het Hogeland een diner en toegang tot de voorstelling 'Ripperda' van Zummerbuhne voor 2 personen a €75,- per persoon. Voor eigen gebruik.",uitnodigingen en tickets,75.0,"Nijboer, H. (Henk)",2023-10-19,GL-PvdA,de gemeente Het Hogeland,
1271,"Ontvangen van BUWOG (Oostenrijk) een serie brochures en boeken over woningbouw in Wenen. Een van deze boeken, het boek over 'Woningbouw in Wenen' heeft een geschatte waarde van €68,-. Van de overige geschenken is de waarde",boeken,68.0,"Nijboer, H. (Henk)",2022-09-09,GL-PvdA,BUWOG (Oostenrijk),
1272,"Ontvangen van de Koninklijke Boekverkopersbond het boek ""Nederland"" van Charlotte Dematons ter waarde van €24,50.",boeken,24.5,"Nijboer, H. (Henk)",2013-11-14,GL-PvdA,de Koninklijke Boekverkopersbond," de Koninklijke Boekverkopersbond het boek ""Nederland"" van Charlotte Dematons ter waarde van"
1273,"Ontvangen van de Koninklijke Boekverkopersbond het boek ""Weird Things Customers Say in Bookshops"" van Jen Campbell ter waarde van €10,49.",boeken,10.49,"Nijboer, H. (Henk)",2013-11-14,GL-PvdA,de Koninklijke Boekverkopersbond," de Koninklijke Boekverkopersbond het boek ""Weird Things Customers Say in Bookshops"" van Jen Campbell ter waarde van"
1274,"Ontvangen een boekenbon ter waarde van €20,- van het Ministerie van Financiën, als dank voor een ontvangst en rondleiding. Voor eigen gebruik gehouden.",boeken,20.0,"Nijboer, H. (Henk)",2012-11-01,GL-PvdA,"€20,- van",een boekenbon ter waarde van
1275,"Ontvangen van Kees Verhoeven het boek “De democratie crasht” ter waarde van €22,99.",boeken,22.99,"Nijboer, H. (Henk)",2023-07-04,GL-PvdA,Kees Verhoeven,het boek “De democratie crasht” ter waarde van
1276,"Ontvangen van de de auteur Saskia Wolters het boek ‘What the f#ck. Hoe het falen van instanties leidde tot de moord op mijn broer Joost’, ter waarde van €24,95.",boeken,24.95,"Nijboer, H. (Henk)",2023-06-27,GL-PvdA,de de auteur Saskia Wolters," de de auteur Saskia Wolters het boek ‘What the f#ck. Hoe het falen van instanties leidde tot de moord op mijn broer Joost’, ter waarde van"
1277,"Ontvangen van MOS (Maatschappelijke Organisaties in de Sport) bokshandschoenen ter waarde van €28,69.",overig,28.69,"Nijboer, H. (Henk)",2023-05-24,GL-PvdA,MOS (Maatschappelijke Organisaties in,de Sport) bokshandschoenen ter waarde van
1278,"Ontvangen van de NVSA (Nederlandse Vereniging voor Strafrecht Advocaten) de NVSA-Anker en Anker prijs, een bronzen beeldje. De waarde is onbekend.",overig,,"Nijboer, H. (Henk)",2022-11-09,GL-PvdA,de NVSA (Nederlandse Vereniging," de NVSA (Nederlandse Vereniging voor Strafrecht Advocaten) de NVSA-Anker en Anker prijs, een bronzen beeldje. De waarde is onbekend"
1279,"Ontvangen van Thialf BV het boek ""Langebaan. ‘Het Nederlandse schaatsen in 75 legendarische ritten"" ter waarde van €45,-.",boeken,45.0,"Nijboer, H. (Henk)",2022-01-17,GL-PvdA,Thialf BV," het boek ""Langebaan. ‘Het Nederlandse schaatsen in 75 legendarische ritten"" ter waarde van"
1280,"Ontvangen van het Verbond voor opheffing van het cannabisverbod het boek 'Weed of Wonder' ter waarde van €49,95.",boeken,49.95,"Nijboer, H. (Henk)",2021-06-30,GL-PvdA,het Verbond,het Verbond voor opheffing van het cannabisverbod het boek 'Weed of Wonder' ter waarde van
1281,"Ontvangen van Daan Groenewoud het boek ‘Het stopzetten van KEI nader bezien. Een gordiaanse knoop?’ ter waarde van €39,50.",boeken,39.5,"Nijboer, H. (Henk)",2021-05-18,GL-PvdA,Daan Groenewoud,het boek ‘Het stopzetten van KEI nader bezien. Een gordiaanse knoop?’ ter waarde van
1282,"Ontvangen van Tobias van Gent het boek ‘Slag om de Schelde’ ter waarde van €49,95.",boeken,49.95,"Nijboer, H. (Henk)",2021-02-11,GL-PvdA,Tobias van Gent,het boek ‘Slag om de Schelde’ ter waarde van
1283,"Ontvangen het boek 'Een kleine biografie van het straffen. Essays over herwaardering van schuld en boete' van Rinus Otte ter waarde van € 23,-.",boeken,23.0,"Nijboer, H. (Henk)",2020-02-12,GL-PvdA,nan,het boek 'Een kleine biografie van het straffen. Essays over herwaardering van schuld en boete' van Rinus Otte ter waarde van
1284,"Ontvangen het boek 'Postpakketjes van overzee. Gelegaliseerde kinderhandel in adoptie van kinderen uit Indonesië’ van Dewi Deijle ter waarde van € 18,50.",boeken,18.5,"Nijboer, H. (Henk)",2020-02-12,GL-PvdA,nan,het boek 'Postpakketjes van overzee. Gelegaliseerde kinderhandel in adoptie van kinderen uit Indonesië’ van Dewi Deijle ter waarde van
1285,"Ontvangen het boek van de auteur Irma Kokx: ‘ZVVEM, de paradox van een zwemdiploma. Bijna alles over leren zwemmen’ ter waarde van €23,95.",boeken,23.95,"Nijboer, H. (Henk)",2019-08-28,GL-PvdA,"de auteur Irma Kokx: ‘ZVVEM,"," het boek van de auteur Irma Kokx: ‘ZVVEM, de paradox van een zwemdiploma. Bijna alles over leren zwemmen’ ter waarde van"
1286,"Ontvangen van de Vrije Universiteit Amsterdam voor het geven van een gastcollege aan studenten over de reclassering een boekenbon ter waarde van €50,-.",boeken,50.0,"Nijboer, H. (Henk)",2018-12-12,GL-PvdA,de Vrije Universiteit Amsterdam,de Vrije Universiteit Amsterdam voor het geven van een gastcollege aan studenten over de reclassering een boekenbon ter waarde van
1287,"Ontvangen een boekenbon ter waarde van €75,- van Speeltuin Elckerlyc voor deelname aan en het houden van een toespraak op het symposium ter ere van het 25-jarig bestaan van Speeltuin Elckerlyc in Oss.",boeken,75.0,"Nijboer, H. (Henk)",2018-05-25,GL-PvdA,"€75,- van Speeltuin Elckerlyc",een boekenbon ter waarde van
1288,"Ontvangen een mini-tafeltennistafel aangeboden door NOC*NSF en de NTTB (Nederlandse Tafeltennisbond) ter waarde van €115,-.",overig,115.0,"Nijboer, H. (Henk)",2017-06-21,GL-PvdA,nan,een mini-tafeltennistafel aangeboden door NOC*NSF en de NTTB (Nederlandse Tafeltennisbond) ter waarde van
1289,"Ontvangen na een presentatie over de initiatiefwet bewegingsonderwijs op het congres van de KVLO (Koninklijke Vereniging voor Lichamelijke Opvoeding) een VVV-cadeaubon ter waarde van €50, alsmede een schaal, handgemaakt, door",cadeaubonnen en geldbedragen,,"Nijboer, H. (Henk)",2016-05-20,GL-PvdA,de KVLO (Koninklijke Vereniging,een presentatie over de initiatiefwet bewegingsonderwijs op het congres van de KVLO (Koninklijke Vereniging voor Lichamelijke Opvoeding) een VVV-cadeaubon ter waarde van
1290,"Ontvangen van het ANP een foto van verkenner Ollongren, die met haar dossier onder de arm, waarop open aantekeningen staan, in de auto stapt. De waarde is onbekend.",overig,,"Omtzigt, P.H. (Pieter)",2022-09-30,Omtzigt,het ANP," het ANP een foto van verkenner Ollongren, die met haar dossier onder de arm, waarop open aantekeningen staan, in de auto stapt. De waarde is onbekend"
1291,Ontvangen van Esther Kokmeijer een kunstwerk bestaande uit vier kapotte porseleinen platen met de grondwet erop. De waarde is onbekend.,overig,,"Omtzigt, P.H. (Pieter)",2022-09-30,Omtzigt,Esther Kokmeijer,een kunstwerk bestaande uit vier kapotte porseleinen platen met de grondwet erop. De waarde is onbekend
1292,Ontvangen 2 t-shirts en 2 hoodies van GeenStijl bij een optreden in het GeenStijl-café.,overig,,"Omtzigt, P.H. (Pieter)",2020-04-24,Omtzigt,GeenStijl bij,
1293,"Ontvangen van de organisatoren van de Jansbeek lezing in Arnhem een boekenbon ter waarde van €80,- en avondeten.",boeken,80.0,"Omtzigt, P.H. (Pieter)",2020-02-10,Omtzigt,de organisatoren van,de organisatoren van de Jansbeek lezing in Arnhem een boekenbon ter waarde van
1294,"Ontvangen VVV-bon ter waarde van €75,-- van de Nederlandse Bond voor Pensioenbelangen voor deelname aan een forum.",cadeaubonnen en geldbedragen,75.0,"Omtzigt, P.H. (Pieter)",2009-05-12,Omtzigt,"€75,-- van",
1295,"Ontvangen van Boom uitgevers Amsterdam drie boeken: Montesquieu, over de geest van de wetten (waarde €64,50); Mill over de vrijheid (waarde €18,50) en Pascal Bruckner, Tirannie van het berouw (€23,90), Totale waarde €106,90.",boeken,64.5,"Omtzigt, P.H. (Pieter)",2008-09-30,Omtzigt,"de wetten (waarde €64,50); Mill over",
1296,"Ontvangen van de Diervriendelijke Parlementaire BBQ een vegan levensmiddelenpakket met een geschatte waarde van €50,-.",overig,50.0,"Ouwehand, E. (Esther)",2022-09-06,PvdD,de Diervriendelijke Parlementaire BBQ,
1297,"Ontvangen van Noordhoff Uitgever ""De Grote Bosatlas 56e editie"""" ter waarde van € 69,95.",boeken,69.95,"Ouwehand, E. (Esther)",2022-03-29,PvdD,nan,
1298,"Ontvangen een Amerikaans bankbiljet van 20 dollar en een Engels bankbiljet van 20 pounds (waarschijnlijk nep). En drie singeltjes met een totale waarde van € 25,-.",overig,25.0,"Ouwehand, E. (Esther)",2020-11-11,PvdD,20 dollar en,
1299,"Ontvangen 4 toegangskaarten voor de opening van de tentoonstelling ""Hollanders van de Gouden Eeuw"" in de Hermitage Amsterdam. De kaarten zijn ter waarde van € 15,-- per stuk.",uitnodigingen en tickets,15.0,"Ouwehand, E. (Esther)",2014-11-27,PvdD,"de tentoonstelling ""Hollanders van"," 4 toegangskaarten voor de opening van de tentoonstelling ""Hollanders van de Gouden Eeuw"" in de Hermitage Amsterdam. De kaarten zijn ter waarde van"
1300,"Ontvangen een doos met asperges. De geschatte waarde is €15,--.",etenswaren en dranken,15.0,"Ouwehand, E. (Esther)",2007-04-25,PvdD,nan,
1301,"Ontvangen van het Programma Kassa een fles wijn ter waarde van €7,50.",etenswaren en dranken,7.5,"Ouwehand, E. (Esther)",2007-04-21,PvdD,het Programma Kassa,het Programma Kassa een fles wijn ter waarde van
1302,"Ontvangen van ""De Berenkuil"" een bonbondoosje met een geschatte waarde van €10,--.",etenswaren en dranken,10.0,"Ouwehand, E. (Esther)",2007-03-29,PvdD,"""De Berenkuil""",
1303,"Ontvangen van Het Samenwerkingsverband Noord-Nederland een digitale klok met een geschatte waarde van €10,--.",overig,10.0,"Ouwehand, E. (Esther)",2007-03-27,PvdD,Het Samenwerkingsverband Noord-Nederland,
1304,"Ontvangen van de KRO voor deelname aan het tv-programma Soeterbeeck een mp3-speler van 256 mB. Geschatte waarde is €15,--.",overig,15.0,"Ouwehand, E. (Esther)",2007-03-19,PvdD,de KRO,
1305,Ontvangen van de Aninal Science Group een kunstwerk van een beschilderde koe. Waarde is onbekend.,overig,,"Ouwehand, E. (Esther)",2007-03-08,PvdD,de Aninal Science Group,
1306,Ontvangen een Samenleesbijbel. De waarde is onbekend.,boeken,,"Palland, H.M. (Hilde)",2022-12-06,CDA,nan,een Samenleesbijbel. De waarde is onbekend
1307,"Ontvangen op uitnodiging van gedeputeerde Appelman van de provincie Flevoland twee toegangskaarten voor de Floriade Expo 2022 ter waarde van €58,-.",uitnodigingen en tickets,58.0,"Palland, H.M. (Hilde)",2022-10-08,CDA,gedeputeerde Appelman van,de provincie Flevoland twee toegangskaarten voor de Floriade Expo 2022 ter waarde van
1308,"Ontvangen van BDO Advisory B.V. een bierpakket ter waarde van € 29,-.",etenswaren en dranken,29.0,"Palland, H.M. (Hilde)",2021-04-28,CDA,BDO Advisory B.V.,een bierpakket ter waarde van
1309,"Ontvangen van Stichting Flevopenningen een goodiebag voor bezoekers van het Flevopenningen Gala, bestaande uit o.a. een handbagage reiskoffer, een bidon en een powerbank. De waarde is onbekend.",uitnodigingen en tickets,,"Palland, H.M. (Hilde)",2020-02-21,CDA,Stichting Flevopenningen," een goodiebag voor bezoekers van het Flevopenningen Gala, bestaande uit o.a. een handbagage reiskoffer, een bidon en een powerbank. De waarde is onbekend"
1310,"Ontvangen van Dammie van Geest twee kaarten voor de voorstelling ‘Margreet Dolman geeft warmte en Dominee Gremdaat wijst de weg’ ter waarde van €50,-.",uitnodigingen en tickets,50.0,"Paternotte, J.M. (Jan)",2022-12-28,D66,Dammie van Geest,twee kaarten voor de voorstelling ‘Margreet Dolman geeft warmte en Dominee Gremdaat wijst de weg’ ter waarde van
1311,"Ontvangen van Uitgeverij Noordhoff de 56e editie van De Grote Bosatlas ter waarde van €69,95.",boeken,69.95,"Paternotte, J.M. (Jan)",2022-04-06,D66,Uitgeverij Noordhoff,de 56e editie van De Grote Bosatlas ter waarde van
1312,"Ontvangen van BNNVARA voor deelname aan S.P.E.L.show een deelnemersbijdrage ter waarde van €750,-. Het bedrag is geschonken aan het Wereld Natuur Fonds. Het prijzengeld van €3200,- is automatisch geschonken aan het Jeugd",cadeaubonnen en geldbedragen,750.0,"Paternotte, J.M. (Jan)",2020-06-11,D66,BNNVARA,voor deelname aan S.P.E.L.show een deelnemersbijdrage ter waarde van
1313,"Ontvangen van dhr. William Millerson, Staten van Curaçao, een notitiehouder 'chrome plated' van El Casco. De waarde is onbekend.",overig,,"Paternotte, J.M. (Jan)",2019-06-28,D66,"dhr. William Millerson, Staten van Curaçao,",een notitiehouder 'chrome plated' van El Casco. De waarde is onbekend
1314,Ontvangen van de gemeente Sudwest Fryslan een vaartocht over het Sneekermeer op het 'Pommerantenboatsje' in het kader van de Hardzeildag. De waarde is onbekend.,overig,,"Paternotte, J.M. (Jan)",2018-08-08,D66,de gemeente Sudwest Fryslan,de gemeente Sudwest Fryslan een vaartocht over het Sneekermeer op het 'Pommerantenboatsje' in het kader van de Hardzeildag. De waarde is onbekend
1315,"Ontvangen van de Vereniging van Nederlandse Verkeersvliegers in het kader van een dag meeloopstage een ticket jumpseat: Ams-Londen-Ams ter waarde van €60,-.",uitnodigingen en tickets,60.0,"Paternotte, J.M. (Jan)",2018-08-03,D66,de Vereniging van Nederlandse Verkeersvliegers in,de Vereniging van Nederlandse Verkeersvliegers in het kader van een dag meeloopstage een ticket jumpseat: Ams-Londen-Ams ter waarde van
1316,"Ontvangen van Easy Jet een lunch en een toegangskaart voor het programma Static Display, Farnborough Air show. De waarde is onbekend.",uitnodigingen en tickets,,"Paternotte, J.M. (Jan)",2018-07-18,D66,Easy Jet," een lunch en een toegangskaart voor het programma Static Display, Farnborough Air show. De waarde is onbekend"
1317,"Ontvangen van Public Affairs bureau GKSV het lidmaatschap “Vriend van het Rijksmuseum” voor een jaar ter waarde van €50,-.",overig,50.0,"Paternotte, J.M. (Jan)",2018-03-22,D66,Public Affairs bureau GKSV,het lidmaatschap “Vriend van het Rijksmuseum” voor een jaar ter waarde van
1318,"Ontvangen een vergoeding voor het dagvoorzitterschap Nationaal Toetscongres 2017 Bureau ICE ter waarde van €500,-. Het bedrag is direct gedoneerd door Bureau ICE aan landelijke oudervereniging voor ouders van kinderen met leer en",cadeaubonnen en geldbedragen,500.0,"Paternotte, J.M. (Jan)",2017-11-10,D66,nan,een vergoeding voor het dagvoorzitterschap Nationaal Toetscongres 2017 Bureau ICE ter waarde van
1319,Ontvangen van College van B&W Eindhoven een kaart voor de voetbalwedstrijd PSV-Ajax. De waarde is onbekend.,uitnodigingen en tickets,,"Paternotte, J.M. (Jan)",2017-04-23,D66,College van B&W Eindhoven,een kaart voor de voetbalwedstrijd PSV-Ajax. De waarde is onbekend
1320,"Ontvangen van de Provincie Drenthe 2 tickets voor de TT-Assen ter waarde van €175,-.",uitnodigingen en tickets,175.0,"Paulusma, W. (Wieke)",2022-06-26,D66,de Provincie Drenthe,de Provincie Drenthe 2 tickets voor de TT-Assen ter waarde van
1321,Ontvangen van de gemeente Breda toegangskaarten voor de voetbalwedstrijd NAC-PSV van donderdag 23 januari 2020. De waarde is onbekend.,uitnodigingen en tickets,,"Peters, W.P.H.J. (René)",2020-01-14,CDA,de gemeente Breda toegangskaarten,de gemeente Breda toegangskaarten voor de voetbalwedstrijd NAC-PSV van donderdag 23 januari 2020. De waarde is onbekend
1322,Ontvangen een toegangskaart van Rammstein van de gemeente Rotterdam. De waarde is onbekend.,uitnodigingen en tickets,,"Peters, W.P.H.J. (René)",2019-06-25,CDA,Rammstein van,een toegangskaart van Rammstein van de gemeente Rotterdam. De waarde is onbekend
1323,"Ontvangen van de Taipei diplomatieke vertegenwoordiging in Nederland in het kader van een presentje voor de kerstdagen een fles Single Malt Whisky ter waarde van €49,99. Voor eigen gebruik gehouden.",etenswaren en dranken,49.99,"Piri, K.P. (Kati)",2023-01-17,GL-PvdA,een presentje,de Taipei diplomatieke vertegenwoordiging in Nederland in het kader van een presentje voor de kerstdagen een fles Single Malt Whisky ter waarde van
1324,"Ontvangen van L. van Hees, Holwerd een handgemaakte sjaal, babydeken en een sieraad met een geschatte waarde van €100,-.",overig,100.0,"Piri, K.P. (Kati)",2023-05-10,GL-PvdA,"L. van Hees, Holwerd",
1325,"Ontvangen van Danielle van Herwijnen een leren tas ter waarde van €69,-.",overig,69.0,"Piri, K.P. (Kati)",2023-03-30,GL-PvdA,Danielle van Herwijnen,een leren tas ter waarde van
1326,"Ontvangen een Boekenpakket SVDC advies in crisisbeheersing van van SVDC (Advies in crisisbeheersing) ter waarde van €65,12.",boeken,65.12,"Piri, K.P. (Kati)",2023-01-25,GL-PvdA,nan,een Boekenpakket SVDC advies in crisisbeheersing van van SVDC (Advies in crisisbeheersing) ter waarde van
1327,"Ontvangen twee kaarten voor de show Paul de Leeuw '60? We zien wel' ter waarde van €53,-.",uitnodigingen en tickets,53.0,"Piri, K.P. (Kati)",2023-01-13,GL-PvdA,nan,twee kaarten voor de show Paul de Leeuw '60? We zien wel' ter waarde van
1328,"Ontvangen cadeaubonnen van Graan Cru Primeur- De Heikamp, Ruurlo. De waarde is €50,- en weggegeven aan burgers.",cadeaubonnen en geldbedragen,50.0,"Piri, K.P. (Kati)",2021-10-02,GL-PvdA,nan,
1329,"Ontvangen vispakket van Vishandel Klooster BV, Enkhuizen. De waarde is €100,-",etenswaren en dranken,100.0,"Piri, K.P. (Kati)",2021-06-18,GL-PvdA,nan,
1330,"Ontvangen van Uitgeverij Noordhoff de 56e editie van De Grote Bosatlas ter waarde van €69,95.",boeken,69.95,"Podt, A. (Anne-Marijke)",2022-04-06,D66,Uitgeverij Noordhoff,de 56e editie van De Grote Bosatlas ter waarde van
1331,"Ontvangen van de Diervriendelijke Parlementaire BBQ een vegan levensmiddelenpakket met een geschatte waarde van €50,-.",overig,50.0,"Pouw-Verweij, N.J.F. (Nicki)",2022-09-06,BBB,de Diervriendelijke Parlementaire BBQ,
1332,"Ontvangen van Noordhoff Uitgever ""De Grote Bosatlas 56e editie"""" ter waarde van € 69,95.",boeken,69.95,"Pouw-Verweij, N.J.F. (Nicki)",2022-03-29,BBB,nan,
1333,"Ontvangen van de KNVB 2 kaarten voor de damesvoetbal wedstrijd Nederland – Duitsland inclusief toegang tot het Huis van Oranje. De waarde is €100,-.",uitnodigingen en tickets,100.0,"Raemakers, R. (Rens)",2023-04-07,D66,de KNVB,
1334,Ontvangen van de Provincie Overijssel een uitnodiging voor een Wilddiner. De waarde is onbekend.,uitnodigingen en tickets,,"Raemakers, R. (Rens)",2022-11-30,D66,de Provincie Overijssel,de Provincie Overijssel een uitnodiging voor een Wilddiner. De waarde is onbekend
1335,"Ontvangen van Uitgeverij Noordhoff de 56e editie van De Grote Bosatlas ter waarde van €69,95.",boeken,69.95,"Raemakers, R. (Rens)",2022-04-06,D66,Uitgeverij Noordhoff,de 56e editie van De Grote Bosatlas ter waarde van
1336,"Ontvangen van de Adviesraad Sociaal domein Leudal voor het houden van lezing een cadeaukaart van Podium ter waarde van €50,-.",uitnodigingen en tickets,50.0,"Raemakers, R. (Rens)",2019-10-07,D66,de Adviesraad Sociaal domein Leudal,de Adviesraad Sociaal domein Leudal voor het houden van lezing een cadeaukaart van Podium ter waarde van
1337,Ontvangen van Geelen B.V. te Neer een kaart voor de wedstrijd VVV Venlo – Ajax. De waarde is onbkend.,uitnodigingen en tickets,,"Raemakers, R. (Rens)",2019-08-17,D66,Geelen B.V. te Neer,
1338,"Ontvangen van de Gemeente Weert een VIP-accreditatie en een parkeerticket voor Bospop Weert, De waarde bedraagt €243,-.",uitnodigingen en tickets,243.0,"Raemakers, R. (Rens)",2019-07-13,D66,de Gemeente Weert,
1339,"Ontvangen van de Provincie Limburg een ticket voor Preuvenement Maastricht ter waarde van €35,-.",uitnodigingen en tickets,35.0,"Raemakers, R. (Rens)",2017-08-24,D66,de Provincie Limburg,de Provincie Limburg een ticket voor Preuvenement Maastricht ter waarde van
1340,"Ontvangen van de Gemeente Maastricht 2 kaarten voor een concert met een totale waarde van €186,80 en een walking diner voor twee personen in de hal van het stadhuis met een totale waarde van €100,-.",uitnodigingen en tickets,186.8,"Raemakers, R. (Rens)",2017-06-28,D66,de Gemeente Maastricht,
1341,Ontvangen het boek 'Worst bank scenario'. De waarde is onbekend.,boeken,,"Rahimi, H. (Hawre)",2023-03-14,VVD,nan,het boek 'Worst bank scenario'. De waarde is onbekend
1342,Ontvangen van Elsevier Weekblad het boek ‘Handboek minister’. De waarde is onbekend.,boeken,,"Rahimi, H. (Hawre)",2022-12-21,VVD,Elsevier Weekblad,het boek ‘Handboek minister’. De waarde is onbekend
1343,Ontvangen van Noordhoff uitgevers de zesenvijftigste editie van de Grote Bosatlas. De waarde is onbekend.,boeken,69.95,"Rahimi, H. (Hawre)",2022-04-05,VVD,Noordhoff uitgevers,de zesenvijftigste editie van de Grote Bosatlas. De waarde is onbekend
1344,"Ontvangen van Thorbecke Academie NHL Stenden Hogeschool een pakket met o.a. thee, pepermunt, een pen, reismok en notitieboek. De waarde is onbekend.",boeken,,"Rajkowski, Q.M. (Queeny)",2023-05-16,VVD,Thorbecke Academie NHL Stenden Hogeschool," een pakket met o.a. thee, pepermunt, een pen, reismok en notitieboek. De waarde is onbekend"
1345,"Ontvangen van Existential Risk Observatory een bos bloemen en boekenbon. De waarde is circa €45,-.",bloemen,45.0,"Rajkowski, Q.M. (Queeny)",2023-04-13,VVD,Existential Risk Observatory,
1346,Ontvangen van Schuberg Philis een fles wijn en chocolaatjes. De waarde is onbekend.,etenswaren en dranken,,"Rajkowski, Q.M. (Queeny)",2023-03-30,VVD,Schuberg Philis,een fles wijn en chocolaatjes. De waarde is onbekend
1347,Ontvangen van de organisatie twee kaartjes voor 'Nacht van de militaire muziek 2' De waarde is onbekend.,uitnodigingen en tickets,,"Rajkowski, Q.M. (Queeny)",2023-03-18,VVD,de organisatie,de organisatie twee kaartjes voor 'Nacht van de militaire muziek 2' De waarde is onbekend
1348,"Ontvangen van Elsevier Weekblad het boek ‘Handboek minister: de lang geheimgehouden instructies aan bewindslieden’, ook wel het 'blauwe boek' genoemd. De waarde is onbekend.",boeken,,"Rajkowski, Q.M. (Queeny)",2022-12-21,VVD,Elsevier Weekblad," het boek ‘Handboek minister: de lang geheimgehouden instructies aan bewindslieden’, ook wel het 'blauwe boek' genoemd. De waarde is onbekend"
1349,Ontvangen van de van de KRO-NCRV een half jaarabonnement op Quest wegens deelname aan de Slimste mens. De waarde is onbekend.,overig,,"Rajkowski, Q.M. (Queeny)",2022-12-01,VVD,de van,de van de KRO-NCRV een half jaarabonnement op Quest wegens deelname aan de Slimste mens. De waarde is onbekend
1350,Ontvangen van ESET haardhout. De waarde is onbekend.,overig,,"Rajkowski, Q.M. (Queeny)",2022-11-24,VVD,nan,
1351,Ontvangen van Mars chocolaatjes. De waarde is onbekend.,etenswaren en dranken,,"Rajkowski, Q.M. (Queeny)",2022-11-11,VVD,nan,
