id,description,category,price,receiver,date,party,gifter,gift
772,Ontvangen twee uitnodigingen van de KNVB voor de voetbalwedstrijd Nederland-Frankrijk. De waarde is onbekend.,uitnodigingen en tickets,,"Heerema, R.J. (Rudmer)",2018-11-16,VVD,de KNVB,twee uitnodigingen van de KNVB voor de voetbalwedstrijd Nederland-Frankrijk. De waarde is onbekend
773,Ontvangen een uitnodiging van de Koninklijke Nederlandse Jagersvereniging voor het wilddiner in Nieuwspoort. De waarde is onbekend.,uitnodigingen en tickets,,"Heerema, R.J. (Rudmer)",2018-11-14,VVD,de Koninklijke Nederlandse Jagersvereniging,een uitnodiging van de Koninklijke Nederlandse Jagersvereniging voor het wilddiner in Nieuwspoort. De waarde is onbekend
774,Ontvangen van de KNVB een uitnodiging voor de voetbalwedstrijd Nederland-Zwitserland (vrouwen). De waarde is onbekend.,uitnodigingen en tickets,,"Heerema, R.J. (Rudmer)",2018-11-09,VVD,de KNVB,de KNVB een uitnodiging voor de voetbalwedstrijd Nederland-Zwitserland (vrouwen). De waarde is onbekend
775,Ontvangen van de Vechtsportautoriteit een toegangskaart voor Glory 59 Amsterdam. De waarde is onbekend.,uitnodigingen en tickets,,"Heerema, R.J. (Rudmer)",2018-09-29,VVD,de Vechtsportautoriteit,de Vechtsportautoriteit een toegangskaart voor Glory 59 Amsterdam. De waarde is onbekend
776,Ontvangen van BrabantSport een toegangskaart voor FINA Swimming Worldcup. De waarde is onbekend.,uitnodigingen en tickets,,"Heerema, R.J. (Rudmer)",2018-09-28,VVD,BrabantSport,een toegangskaart voor FINA Swimming Worldcup. De waarde is onbekend
777,Ontvangen van het Nederlands Handbal Verbond een toegangskaart voor de handbalwedstrijd Japan-Nederland. De waarde is onbekend.,uitnodigingen en tickets,,"Heerema, R.J. (Rudmer)",2018-09-27,VVD,het Nederlands Handbal Verbond,het Nederlands Handbal Verbond een toegangskaart voor de handbalwedstrijd Japan-Nederland. De waarde is onbekend
778,Ontvangen van Provincie Gelderland een uitnodiging voor het Prinsjesprijsdiner. De waarde is onbekend.,uitnodigingen en tickets,,"Heerema, R.J. (Rudmer)",2018-09-13,VVD,Provincie Gelderland,een uitnodiging voor het Prinsjesprijsdiner. De waarde is onbekend
779,Ontvangen van de KNVB toegangskaarten voor de voetbalwedstrijd Nederland-Peru. De waarde is onbekend.,uitnodigingen en tickets,,"Heerema, R.J. (Rudmer)",2018-09-06,VVD,de KNVB toegangskaarten,de KNVB toegangskaarten voor de voetbalwedstrijd Nederland-Peru. De waarde is onbekend
780,Ontvangen van de Postcode Loterij een uitnodiging voor Voetballer van het Jaar Gala. De waarde is onbekend.,uitnodigingen en tickets,,"Heerema, R.J. (Rudmer)",2018-09-03,VVD,de Postcode Loterij,de Postcode Loterij een uitnodiging voor Voetballer van het Jaar Gala. De waarde is onbekend
781,Ontvangen van Golazo Sports twee toegangskaarten voor de Binckbank Tour. De waarde is onbekend.,uitnodigingen en tickets,,"Heerema, R.J. (Rudmer)",2018-08-14,VVD,Golazo Sports,twee toegangskaarten voor de Binckbank Tour. De waarde is onbekend
782,Ontvangen van de Koninklijke Nederlandse Biljartbond een toegangskaart voor het EK Poolbiljart. De waarde is onbekend.,uitnodigingen en tickets,,"Heerema, R.J. (Rudmer)",2018-07-31,VVD,de Koninklijke Nederlandse Biljartbond,de Koninklijke Nederlandse Biljartbond een toegangskaart voor het EK Poolbiljart. De waarde is onbekend
783,Ontvangen van de KNVB een toegangskaart voor het EK CP voetbal. De waarde is onbekend.,uitnodigingen en tickets,,"Heerema, R.J. (Rudmer)",2018-07-25,VVD,de KNVB,de KNVB een toegangskaart voor het EK CP voetbal. De waarde is onbekend
784,Ontvangen van Nevobo twee toegangskaarten voor het EK Beachvolleybal. De waarde is onbekend.,uitnodigingen en tickets,,"Heerema, R.J. (Rudmer)",2018-07-22,VVD,Nevobo,twee toegangskaarten voor het EK Beachvolleybal. De waarde is onbekend
785,Ontvangen van Tig Sports twee toegangskaarten voor het EK Beachvolleybal. De waarde is onbekend.,uitnodigingen en tickets,,"Heerema, R.J. (Rudmer)",2018-07-20,VVD,Tig Sports,twee toegangskaarten voor het EK Beachvolleybal. De waarde is onbekend
786,Ontvangen van de Koninklijke Nederlandse Gymnastiek Unie een toegangskaart voor Interland Turnen. De waarde is onbekend.,uitnodigingen en tickets,,"Heerema, R.J. (Rudmer)",2018-07-07,VVD,de Koninklijke Nederlandse Gymnastiek Unie,de Koninklijke Nederlandse Gymnastiek Unie een toegangskaart voor Interland Turnen. De waarde is onbekend
787,Ontvangen van de NKBV een toegangskaart voor het NK Boulder. De waarde is onbekend.,uitnodigingen en tickets,,"Heerema, R.J. (Rudmer)",2018-07-07,VVD,de NKBV,de NKBV een toegangskaart voor het NK Boulder. De waarde is onbekend
788,Ontvangen van KNHB een toegangskaart voor de Rabobank Hockey Champions Trophy. De waarde is onbekend.,uitnodigingen en tickets,,"Heerema, R.J. (Rudmer)",2018-06-30,VVD,KNHB een toegangskaart,een toegangskaart voor de Rabobank Hockey Champions Trophy. De waarde is onbekend
789,Ontvangen van NOC*NSF een toegangskaart voor de Volvo Ocean Race. De waarde is onbekend.,uitnodigingen en tickets,,"Heerema, R.J. (Rudmer)",2018-06-29,VVD,NOC*NSF,een toegangskaart voor de Volvo Ocean Race. De waarde is onbekend
790,Ontvangen van KNLTB toegangskaarten voor Libema Open. De waarde is onbekend.,uitnodigingen en tickets,,"Heerema, R.J. (Rudmer)",2018-06-15,VVD,KNLTB toegangskaarten,voor Libema Open. De waarde is onbekend
791,Ontvangen van Nevobo een toegangskaart voor de volleybalwedstrijd Nederland-Brazilië. De waarde is onbekend.,uitnodigingen en tickets,,"Heerema, R.J. (Rudmer)",2018-05-31,VVD,Nevobo,een toegangskaart voor de volleybalwedstrijd Nederland-Brazilië. De waarde is onbekend
792,Ontvangen van Circuit Zandvoort een toegangskaart voor de Max Verstappen Racedagen. De waarde is onbekend.,uitnodigingen en tickets,,"Heerema, R.J. (Rudmer)",2018-05-21,VVD,Circuit Zandvoort,een toegangskaart voor de Max Verstappen Racedagen. De waarde is onbekend
793,Ontvangen van Nevobo een toegangskaart voor de volleybalwedstrijd Nederland-Japan. De waarde is onbekend.,uitnodigingen en tickets,,"Heerema, R.J. (Rudmer)",2018-05-17,VVD,Nevobo,een toegangskaart voor de volleybalwedstrijd Nederland-Japan. De waarde is onbekend
794,Ontvangen een uitnodiging van BMX Papendal voor de BMX WorldCup. De waarde is onbekend.,uitnodigingen en tickets,,"Heerema, R.J. (Rudmer)",2018-05-05,VVD,BMX Papendal,een uitnodiging van BMX Papendal voor de BMX WorldCup. De waarde is onbekend
795,Ontvangen een uitnodiging van de KNVB voor de bekerfinale AZ-Feyenoord. De waarde is onbekend.,uitnodigingen en tickets,,"Heerema, R.J. (Rudmer)",2018-04-22,VVD,de KNVB,een uitnodiging van de KNVB voor de bekerfinale AZ-Feyenoord. De waarde is onbekend
796,Ontvangen een uitnodiging van Fonds Gehandicaptensport voor de Premier League Darts 2018. De waarde is onbekend.,uitnodigingen en tickets,,"Heerema, R.J. (Rudmer)",2018-04-19,VVD,Fonds Gehandicaptensport,een uitnodiging van Fonds Gehandicaptensport voor de Premier League Darts 2018. De waarde is onbekend
797,"Ontvangen een uitnodiging van de Provincie Limburg voor de Amstel Gold Race ter waarde van €195,-.",uitnodigingen en tickets,195.0,"Heerema, R.J. (Rudmer)",2018-04-15,VVD,de Provincie Limburg,een uitnodiging van de Provincie Limburg voor de Amstel Gold Race ter waarde van
798,Ontvangen een uitnodiging van het KNKV voor de Korfbal Leaguefinale 2018. De waarde is onbekend.,uitnodigingen en tickets,,"Heerema, R.J. (Rudmer)",2018-04-07,VVD,het KNKV,een uitnodiging van het KNKV voor de Korfbal Leaguefinale 2018. De waarde is onbekend
799,Ontvangen een uitnodiging van de KNVB voor de dames voetbalwedstrijd Nederland-Noord-Ierland. De waarde is onbekend.,uitnodigingen en tickets,,"Heerema, R.J. (Rudmer)",2018-04-06,VVD,de KNVB,een uitnodiging van de KNVB voor de dames voetbalwedstrijd Nederland-Noord-Ierland. De waarde is onbekend
800,Ontvangen een uitnodiging van het NHV voor de handbal interland Nederland-Hongarije. De waarde is onbekend.,uitnodigingen en tickets,,"Heerema, R.J. (Rudmer)",2018-03-25,VVD,het NHV,een uitnodiging van het NHV voor de handbal interland Nederland-Hongarije. De waarde is onbekend
801,Ontvangen een uitnodiging van de KNVB voor de voetbalwedstrijd Nederland-Engeland. De waarde is onbekend.,uitnodigingen en tickets,,"Heerema, R.J. (Rudmer)",2018-03-23,VVD,de KNVB,een uitnodiging van de KNVB voor de voetbalwedstrijd Nederland-Engeland. De waarde is onbekend
802,Ontvangen een uitnodiging van de Stichting Dutch Trampoline Open voor de Dutch Trampoline Open. De waarde is onbekend.,uitnodigingen en tickets,,"Heerema, R.J. (Rudmer)",2018-03-18,VVD,de Stichting Dutch Trampoline Open,een uitnodiging van de Stichting Dutch Trampoline Open voor de Dutch Trampoline Open. De waarde is onbekend
803,Ontvangen een uitnodiging van de Stichting Topsport Community voor het Topsport Community diner. De waarde is onbekend.,uitnodigingen en tickets,,"Heerema, R.J. (Rudmer)",2018-03-12,VVD,de Stichting Topsport Community,een uitnodiging van de Stichting Topsport Community voor het Topsport Community diner. De waarde is onbekend
804,Ontvangen een uitnodiging van de KNSB voor het WK Schaatsen. De waarde is onbekend.,uitnodigingen en tickets,,"Heerema, R.J. (Rudmer)",2018-03-10,VVD,de KNSB,een uitnodiging van de KNSB voor het WK Schaatsen. De waarde is onbekend
805,Ontvangen van AZ een toegangskaart voor de halve bekerfinale AZ-Twente. De waarde is onbekend.,uitnodigingen en tickets,,"Heerema, R.J. (Rudmer)",2018-02-28,VVD,AZ een toegangskaart,een toegangskaart voor de halve bekerfinale AZ-Twente. De waarde is onbekend
806,Ontvangen van de Nederlandse Tafeltennisbond een toegangskaart voor tafeltennis damesinterland. De waarde is onbekend.,uitnodigingen en tickets,,"Heerema, R.J. (Rudmer)",2018-02-27,VVD,de Nederlandse Tafeltennisbond,de Nederlandse Tafeltennisbond een toegangskaart voor tafeltennis damesinterland. De waarde is onbekend
807,Ontvangen van NOC*NSF een toegangskaart Thuiskomst TeamNL. De waarde is onbekend.,uitnodigingen en tickets,,"Heerema, R.J. (Rudmer)",2018-02-26,VVD,NOC*NSF,een toegangskaart Thuiskomst TeamNL. De waarde is onbekend
808,"Ontvangen van Guido de Wit advocaten het boek ‘De opleiding tot redenaar’ van Marcus Fabius Quintilianus ter waarde van €49,95.",boeken,49.95,"Heerema, R.J. (Rudmer)",2018-02-22,VVD,Guido,de Wit advocaten het boek ‘De opleiding tot redenaar’ van Marcus Fabius Quintilianus ter waarde van
809,Ontvangen van Vriendenloterij een toegangskaart voor het Goed Geld Gala. De waarde is onbekend.,uitnodigingen en tickets,,"Heerema, R.J. (Rudmer)",2018-02-19,VVD,Vriendenloterij,een toegangskaart voor het Goed Geld Gala. De waarde is onbekend
810,Ontvangen van KNLTB twee toegangskaarten voor het ABN AMRO World Tennis Tournament. De waarde is onbekend.,uitnodigingen en tickets,,"Heerema, R.J. (Rudmer)",2018-02-17,VVD,KNLTB,twee toegangskaarten voor het ABN AMRO World Tennis Tournament. De waarde is onbekend
811,Ontvangen van gemeente Rotterdam een toegangskaart voor het ABN AMRO World Tennis Tournament. De waarde is onbekend.,uitnodigingen en tickets,,"Heerema, R.J. (Rudmer)",2018-02-16,VVD,gemeente Rotterdam,een toegangskaart voor het ABN AMRO World Tennis Tournament. De waarde is onbekend
812,Ontvangen van Topsport Community een toegangskaart voorbeschouwing Olympische Spelen. De waarde is onbekend.,uitnodigingen en tickets,,"Heerema, R.J. (Rudmer)",2018-02-09,VVD,Topsport Community,een toegangskaart voorbeschouwing Olympische Spelen. De waarde is onbekend
813,Ontvangen van NOC*NSF & NTTB een Ipongtafel voor de VVD. De waarde is onbekend. Aan de VVD geschonken.,overig,,"Heerema, R.J. (Rudmer)",2018-01-31,VVD,NOC*NSF & NTTB,een Ipongtafel voor de VVD. De waarde is onbekend
814,Ontvangen van het Yvonne van Gennip Talent Fonds 1 vrijkaart voor Jumping Amsterdam. De waarde is onbekend.,uitnodigingen en tickets,,"Heerema, R.J. (Rudmer)",2018-01-27,VVD,het Yvonne van Gennip Talent Fonds 1,het Yvonne van Gennip Talent Fonds 1 vrijkaart voor Jumping Amsterdam. De waarde is onbekend
815,Ontvangen van Jumping Amsterdam 2 vrijkaarten voor Jumping Amsterdam. De waarde is onbekend.,uitnodigingen en tickets,,"Heerema, R.J. (Rudmer)",2018-01-26,VVD,Jumping Amsterdam,2 vrijkaarten voor Jumping Amsterdam. De waarde is onbekend
816,Ontvangen van NEVOBO 2 vrijkaarten voor Dela Beach open. De waarde is onbekend.,uitnodigingen en tickets,,"Heerema, R.J. (Rudmer)",2018-01-06,VVD,NEVOBO,2 vrijkaarten voor Dela Beach open. De waarde is onbekend
817,Ontvangen van NEVOBO 1 vrijkaart voor Dela Beach open. De waarde is onbekend.,uitnodigingen en tickets,,"Heerema, R.J. (Rudmer)",2018-01-05,VVD,NEVOBO 1,voor Dela Beach open. De waarde is onbekend
818,Ontvangen van TIG Sports 2 vrijkaarten voor Dela Beach open. De waarde is onbekend.,uitnodigingen en tickets,,"Heerema, R.J. (Rudmer)",2018-01-04,VVD,TIG Sports,2 vrijkaarten voor Dela Beach open. De waarde is onbekend
819,Ontvangen van KNSB twee toegangskaarten voor OKT Schaatsen. De waarde is onbekend.,uitnodigingen en tickets,,"Heerema, R.J. (Rudmer)",2017-12-30,VVD,KNSB twee toegangskaarten,twee toegangskaarten voor OKT Schaatsen. De waarde is onbekend
820,Ontvangen van KNGU twee toegangskaarten voor het ‘A Touch of Gold’ Turngala. De waarde is onbekend.,uitnodigingen en tickets,,"Heerema, R.J. (Rudmer)",2017-12-29,VVD,KNGU twee toegangskaarten,twee toegangskaarten voor het ‘A Touch of Gold’ Turngala. De waarde is onbekend
821,Ontvangen van NOS en NOC*NSF een toegangskaart voor het NOC*NSF Sportgala. De waarde is onbekend.,uitnodigingen en tickets,,"Heerema, R.J. (Rudmer)",2017-12-19,VVD,NOS en NOC*NSF,een toegangskaart voor het NOC*NSF Sportgala. De waarde is onbekend
822,Ontvangen van de KNLTB twee toegangskaarten voor het NK Tennis. De waarde is onbekend.,uitnodigingen en tickets,,"Heerema, R.J. (Rudmer)",2017-12-17,VVD,de KNLTB,de KNLTB twee toegangskaarten voor het NK Tennis. De waarde is onbekend
823,Ontvangen van gemeente Alkmaar twee toegangskaarten voor de Alkmaar sportgala. De waarde is onbekend.,uitnodigingen en tickets,,"Heerema, R.J. (Rudmer)",2017-12-15,VVD,gemeente Alkmaar,twee toegangskaarten voor de Alkmaar sportgala. De waarde is onbekend
824,Ontvangen van Kindred Group een tafelplaats bij de Nationaal Gala Fonds Gehandicaptensport. De waarde is onbekend.,uitnodigingen en tickets,,"Heerema, R.J. (Rudmer)",2017-11-28,VVD,Kindred Group,een tafelplaats bij de Nationaal Gala Fonds Gehandicaptensport. De waarde is onbekend
825,Ontvangen van NHV een toegangskaart voor de interland Nederland-Italië (handbal). De waarde is onbekend.,uitnodigingen en tickets,,"Heerema, R.J. (Rudmer)",2017-11-23,VVD,NHV een toegangskaart,een toegangskaart voor de interland Nederland-Italië (handbal). De waarde is onbekend
826,Ontvangen van Judobond Nederland een toegangskaart voor de World Grand Prix Judo. De waarde is onbekend.,uitnodigingen en tickets,,"Heerema, R.J. (Rudmer)",2017-11-19,VVD,Judobond Nederland,een toegangskaart voor de World Grand Prix Judo. De waarde is onbekend
827,Ontvangen van Judobond Nederland twee toegangskaarten voor de World Grand Prix Judo. De waarde is onbekend.,uitnodigingen en tickets,,"Heerema, R.J. (Rudmer)",2017-11-17,VVD,Judobond Nederland,twee toegangskaarten voor de World Grand Prix Judo. De waarde is onbekend
828,Ontvangen van de voorzitter van de Internationale Judo Federatie IJF een stropdas. De waarde is onbekend.,overig,,"Heerema, R.J. (Rudmer)",2017-11-17,VVD,de voorzitter van,de voorzitter van de Internationale Judo Federatie IJF een stropdas. De waarde is onbekend
829,Ontvangen van KNSB een toegangskaart voor de Worldcup Schaatsen. De waarde is onbekend.,uitnodigingen en tickets,,"Heerema, R.J. (Rudmer)",2017-11-12,VVD,KNSB een toegangskaart,een toegangskaart voor de Worldcup Schaatsen. De waarde is onbekend
830,Ontvangen van de KNZB één kaart voor de waterpolowedstrijd Nederland-Kroatië. De waarde is onbekend.,uitnodigingen en tickets,,"Heerema, R.J. (Rudmer)",2017-01-10,VVD,de KNZB één,de KNZB één kaart voor de waterpolowedstrijd Nederland-Kroatië. De waarde is onbekend
831,Ontvangen van de KNSB één kaart voor het EK schaatsen. De waarde is onbekend.,uitnodigingen en tickets,,"Heerema, R.J. (Rudmer)",2017-01-08,VVD,de KNSB één,de KNSB één kaart voor het EK schaatsen. De waarde is onbekend
832,Ontvangen van de KNLTB twee kaarten voor het NK tennis. De waarde is onbekend.,uitnodigingen en tickets,,"Heerema, R.J. (Rudmer)",2016-12-18,VVD,de KNLTB,de KNLTB twee kaarten voor het NK tennis. De waarde is onbekend
833,Ontvangen van AZ twee kaarten voor de voetbalwedstrijd AZ-Feyenoord. De waarde is onbekend.,uitnodigingen en tickets,,"Heerema, R.J. (Rudmer)",2016-12-11,VVD,AZ twee kaarten,twee kaarten voor de voetbalwedstrijd AZ-Feyenoord. De waarde is onbekend
834,Ontvangen van de KNGU één kaart voor het NK trampolinespringen. De waarde is onbekend.,uitnodigingen en tickets,,"Heerema, R.J. (Rudmer)",2016-12-10,VVD,de KNGU één,de KNGU één kaart voor het NK trampolinespringen. De waarde is onbekend
835,Ontvangen van de NKBV één kaart voor het NK Lead. De waarde is onbekend.,uitnodigingen en tickets,,"Heerema, R.J. (Rudmer)",2016-12-10,VVD,de NKBV één,de NKBV één kaart voor het NK Lead. De waarde is onbekend
836,Ontvangen van de Watersportverbond één kaart voor de Zeiler van het Jaargala. De waarde is onbekend.,uitnodigingen en tickets,,"Heerema, R.J. (Rudmer)",2016-11-17,VVD,de Watersportverbond één,de Watersportverbond één kaart voor de Zeiler van het Jaargala. De waarde is onbekend
837,Ontvangen van de gemeente Apeldoorn twee kaarten voor de wereldbekerwedstrijden baanwielrennen. De waarde is onbekend.,uitnodigingen en tickets,,"Heerema, R.J. (Rudmer)",2016-11-13,VVD,de gemeente Apeldoorn,de gemeente Apeldoorn twee kaarten voor de wereldbekerwedstrijden baanwielrennen. De waarde is onbekend
838,Ontvangen van Myrthe Schoot één kaart voor de volleybal wedstrijd Aachen-Dresden. De waarde is onbekend.,uitnodigingen en tickets,,"Heerema, R.J. (Rudmer)",2016-11-12,VVD,Myrthe Schoot één,één kaart voor de volleybal wedstrijd Aachen-Dresden. De waarde is onbekend
839,Ontvangen van de Korfbalverbond twee kaarten voor het EK korfbal. De waarde is onbekend.,uitnodigingen en tickets,,"Heerema, R.J. (Rudmer)",2016-10-30,VVD,de Korfbalverbond,de Korfbalverbond twee kaarten voor het EK korfbal. De waarde is onbekend
840,Ontvangen van de KNLTB één kaart voor het film festival. De waarde is onbekend.,uitnodigingen en tickets,,"Heerema, R.J. (Rudmer)",2016-10-13,VVD,de KNLTB één,de KNLTB één kaart voor het film festival. De waarde is onbekend
841,Ontvangen van het Nederlandse Handbalverbond drie kaarten voor het Handbalvierlandentoernooi. De waarde is onbekend. 06-10-2016,uitnodigingen en tickets,,"Heerema, R.J. (Rudmer)",2016-10-06,VVD,het Nederlandse Handbalverbond drie kaarten,het Nederlandse Handbalverbond drie kaarten voor het Handbalvierlandentoernooi. De waarde is onbekend
842,Ontvangen van TIG Sports één kaart voor de KLM Open. De waarde is onbekend. 08-09-2016,uitnodigingen en tickets,,"Heerema, R.J. (Rudmer)",2016-09-08,VVD,TIG Sports één,één kaart voor de KLM Open. De waarde is onbekend
843,Ontvangen van TIG Sports één kaart voor de Olympic Experience. De waarde is onbekend.,uitnodigingen en tickets,,"Heerema, R.J. (Rudmer)",2016-08-05,VVD,TIG Sports één,één kaart voor de Olympic Experience. De waarde is onbekend
844,Ontvangen van de NeVoBo twee kaarten voor de Nederland uitzwaaiwedstrijd. De waarde is onbekend. 26-07-2016,uitnodigingen en tickets,,"Heerema, R.J. (Rudmer)",2016-07-26,VVD,de NeVoBo,de NeVoBo twee kaarten voor de Nederland uitzwaaiwedstrijd. De waarde is onbekend
845,"Ontvangen van het Handbal verbond twee kaarten voor Nederland-Montenegro ter waarde van €17,50 euro per kaart.",uitnodigingen en tickets,17.5,"Heerema, R.J. (Rudmer)",2016-07-21,VVD,het Handbal verbond,het Handbal verbond twee kaarten voor Nederland-Montenegro ter waarde van
846,"Ontvangen van TIG Sports, twee kaarten voor het EK atletiek. De waarde is onbekend.",uitnodigingen en tickets,,"Heerema, R.J. (Rudmer)",2016-07-10,VVD,"TIG Sports,",twee kaarten voor het EK atletiek. De waarde is onbekend
847,"Ontvangen van TIG Sports, drie kaarten voor het EK atletiek. De waarde is onbekend.",uitnodigingen en tickets,,"Heerema, R.J. (Rudmer)",2016-07-09,VVD,"TIG Sports, drie kaarten",voor het EK atletiek. De waarde is onbekend
848,"Ontvangen van NOC NSF, vier kaarten voor het EK atletiek. De waarde is onbekend.",uitnodigingen en tickets,,"Heerema, R.J. (Rudmer)",2016-07-08,VVD,"NOC NSF, vier kaarten",voor het EK atletiek. De waarde is onbekend
849,"Ontvangen van Ondernemend Alkmaar, twee kaarten voor het Gala Ondernemend Alkmaar. De waarde is onbekend.",uitnodigingen en tickets,,"Heerema, R.J. (Rudmer)",2016-07-04,VVD,"Ondernemend Alkmaar,",twee kaarten voor het Gala Ondernemend Alkmaar. De waarde is onbekend
850,"Ontvangen van de KNMV, een kaart voor de TT in Assen. De waarde is onbekend.",uitnodigingen en tickets,,"Heerema, R.J. (Rudmer)",2016-06-26,VVD,"de KNMV,"," de KNMV, een kaart voor de TT in Assen. De waarde is onbekend"
851,"Ontvangen van het Zandvoort circuit, een entree voor de Max Verstappen familie dagen. De waarde is onbekend.",uitnodigingen en tickets,,"Heerema, R.J. (Rudmer)",2016-06-05,VVD,"het Zandvoort circuit,"," het Zandvoort circuit, een entree voor de Max Verstappen familie dagen. De waarde is onbekend"
852,"Ontvangen van het Wildlands Adventurepark, drie keer een entree ter waarde van €30,- per stuk.",uitnodigingen en tickets,90,"Heerema, R.J. (Rudmer)",2016-05-30,VVD,"het Wildlands Adventurepark, drie keer"," het Wildlands Adventurepark, drie keer een entree ter waarde van"
853,"Ontvangen van de KVLO, VVV bonnen ter waarde van €50,- en een fruitschaal waarvan de waarde onbekend is.",overig,50.0,"Heerema, R.J. (Rudmer)",2016-05-20,VVD,"de KVLO, VVV bonnen ter waarde van €50,- en"," de KVLO, VVV bonnen ter waarde van"
854,"Ontvangen van de Professional Darts Cooperation, twee kaarten voor de Premier League Darts in Ahoy. De waarde is onbekend.",uitnodigingen en tickets,,"Heerema, R.J. (Rudmer)",2016-05-12,VVD,"de Professional Darts Cooperation,"," de Professional Darts Cooperation, twee kaarten voor de Premier League Darts in Ahoy. De waarde is onbekend"
855,"Ontvangen van de NKBV, twee kaartjes voor het NK Boulder. De waarde is onbekend.",uitnodigingen en tickets,,"Heerema, R.J. (Rudmer)",2016-04-30,VVD,"de NKBV,"," de NKBV, twee kaartjes voor het NK Boulder. De waarde is onbekend"
856,"Ontvangen van de Korfbalverbond, een kaart voor de NK finale. De waarde is onbekend.",uitnodigingen en tickets,,"Heerema, R.J. (Rudmer)",2016-04-16,VVD,"de Korfbalverbond,"," de Korfbalverbond, een kaart voor de NK finale. De waarde is onbekend"
857,"Ontvangen van de KNZB, twee kaarten voor de Swimcup in Eindhoven. De waarde is onbekend.",uitnodigingen en tickets,,"Heerema, R.J. (Rudmer)",2016-04-08,VVD,"de KNZB,"," de KNZB, twee kaarten voor de Swimcup in Eindhoven. De waarde is onbekend"
858,"Ontvangen van Marjolein Bolhuis, directeur van de Stichting Spieren voor Spieren, een kaart voor het Spieren voor Spieren Gala. De waarde is onbekend.",uitnodigingen en tickets,,"Heerema, R.J. (Rudmer)",2016-04-02,VVD,"Marjolein Bolhuis, directeur van"," de Stichting Spieren voor Spieren, een kaart voor het Spieren voor Spieren Gala. De waarde is onbekend"
859,"Ontvangen van de NTTB twee kaarten voor het NK Tafeltennis ter waarde van ongeveer €20,-.",uitnodigingen en tickets,20.0,"Heerema, R.J. (Rudmer)",2016-03-20,VVD,de NTTB,de NTTB twee kaarten voor het NK Tafeltennis ter waarde van
860,"Ontvangen van de Taekwondo Bond twee kaarten voor het Dutch Open Taekwondo Championships ter waarde van €15,-.",uitnodigingen en tickets,15.0,"Heerema, R.J. (Rudmer)",2016-03-13,VVD,de Taekwondo Bond,de Taekwondo Bond twee kaarten voor het Dutch Open Taekwondo Championships ter waarde van
861,Ontvangen van de Nederlands Handbal Verbond een kaart voor Nederland-Spanje. De waarde is onbekend.,uitnodigingen en tickets,,"Heerema, R.J. (Rudmer)",2016-03-08,VVD,de Nederlands Handbal Verbond,de Nederlands Handbal Verbond een kaart voor Nederland-Spanje. De waarde is onbekend
862,Ontvangen van de organisatoren van de Jongeren Lezing Alkmaar twee VIP kaartjes voor het Alkmaar Culinair Plaza. De waarde is onbekend.,uitnodigingen en tickets,,"Heerema, R.J. (Rudmer)",2016-03-07,VVD,de organisatoren van,de organisatoren van de Jongeren Lezing Alkmaar twee VIP kaartjes voor het Alkmaar Culinair Plaza. De waarde is onbekend
863,"Ontvangen van de KNVB een kaart voor Nederland-Noorwegen ter waarde van ongeveer €30,-.",uitnodigingen en tickets,30.0,"Heerema, R.J. (Rudmer)",2016-03-05,VVD,de KNVB,de KNVB een kaart voor Nederland-Noorwegen ter waarde van
864,Ontvangen van de KNVB een kaart voor Feyenoord-AZ. De waarde is onbekend.,uitnodigingen en tickets,,"Heerema, R.J. (Rudmer)",2016-03-03,VVD,de KNVB,de KNVB een kaart voor Feyenoord-AZ. De waarde is onbekend
865,"Ontvangen van de KNVB drie kaarten voor Zwitserland-Nederland ter waarde van ongeveer €30,-.",uitnodigingen en tickets,30.0,"Heerema, R.J. (Rudmer)",2016-03-02,VVD,de KNVB drie kaarten,de KNVB drie kaarten voor Zwitserland-Nederland ter waarde van
866,Ontvangen van de Atletiek Unie twee kaarten voor het AA Drink NK indoor. De waarde is onbekend.,uitnodigingen en tickets,,"Heerema, R.J. (Rudmer)",2016-02-27,VVD,de Atletiek Unie,de Atletiek Unie twee kaarten voor het AA Drink NK indoor. De waarde is onbekend
867,"Ontvangen van het Willem Bleau een fles wijn ter waarde van €10,-.",etenswaren en dranken,10.0,"Heerema, R.J. (Rudmer)",2016-02-25,VVD,het Willem Bleau,het Willem Bleau een fles wijn ter waarde van
