"Aartsen, A.A. (Thierry) - VVD",
Geschenken,
Geschenk,Datum
"Ontvangen het boek ‘Handboek minister. De lang geheimgehouden instructies aan bewindslieden’ ter waarde van €14,95.",31-01-2023
Ontvangen van Uitgeverij Noordhoff een Grote Bosatlas. De waarde is onbekend.,05-04-2022
Ontvangen van de Stichting Ondersteuning VVD (SOV) een Stamppotdiner SOV. De waarde is onbekend.,27-09-2021
Ontvangen van de Gemeente Breda twee kaarten voor Bij Ons In Breda. De waarde is onbekend.,26-07-2021
Ontvangen van de Gemeente Rotterdam een toegangskaart voor de halve finale van de KNVB beker Feyenoord – NAC. De waarde is onbekend.,05-03-2020
Ontvangen van de Gemeente Breda een toegangskaart voor de bekerwedstrijd NAC – PSV. De waarde is onbekend.,23-01-2020
Ontvangen van KRO-NCRV 5 toegangskaarten backstage TOP2000 Café. De waarde is onbekend.,30-12-2019
Bijgewoond op uitnodiging van de provincie Limburg een concert van André Rieu. De waarde is onbekend.,11-07-2019
Aanwezig geweest bij het concert van Marco Borsato in de Kuip op uitnodiging van Public Affairs Rotterdam. De waarde is onbekend.,01-06-2019
Bijgewoond het Nieuwspoort Aspergediner op uitnodiging van Competition Support. De waarde is onbekend.,17-04-2019
Ontvangen tijdens een werkbezoek aan Swinkels Family Brewers een maaltijd en presentje (een liter bier). De waarde is onbekend.,18-02-2019
Ontvangen van ANP het fotoboek ‘Hollandse Beelden’. De waarde is onbekend.,12-02-2019
Ontvangen van Edison Pop twee kaarten inclusief diner voor de Edison Pop Awards in de Westergasfabriek te Amsterdam. De waarde is onbekend.,11-02-2019
Ontvangen van de gemeente Noordenveld een boekje over ‘Drents Big Vief’. De waarde is onbekend.,15-01-2019
Ontvangen een kaart met alle streekomroepen erop van de Stichting Nederlandse Lokale Publieke Omroepen (NLPO). De waarde is onbekend.,14-12-2018
Ontvangen twee toegangskaartjes voor het Muziekfeest van het jaar van de AVRO-TROS. De waarde is onbekend.,07-12-2018
Ontvangen van het bestuur van de Eerste Bredasche Heerenzitting 1 toegangsbewijs voor de Eerste Bredasche Heerenzitting. De waarde is onbekend.,18-11-2018
Aanwezig geweest bij het Wilddiner van de provincie Limburg in Nieuwspoort. De waarde is onbekend.,14-11-2018
"Bezoek gebracht aan het Amsterdam Dance Event, aangeboden door BUMA/Stemra. De waarde is onbekend.",23-10-2018
Ontvangen een uitnodiging van de gemeente Enschede voor een bezoek aan de Military Boekelo. De waarde is onbekend.,13-10-2018
Ontvangen van de gemeente Tilburg een kaart voor de voetbalwedstrijd Willem II-Feyenoord. De waarde is onbekend.,07-10-2018
Ontvangen één toegangskaart tot de gemeentelijke skybox in het NAC stadion bij de voetbalwedstrijd NAC-PSV op uitnodiging van de gemeente Breda. De waarde is onbekend.,29-09-2018
"Ontvangen van de VVD fractie in Breda twee kippen ter waarde van €52,-.",20-09-2018
Ontvangen van de Provincie Brabant kaartjes voor de Brabantse Stoet. De waarde is onbekend.,16-09-2018
Ontvangen van de Provincie Brabant een welkomstpakket voor zijn installatie als Kamerlid. De waarde is onbekend.,13-09-2018
"Agema, M. (Fleur) - PVV",
Geschenken,
Geschenk,Datum
"Ontvangen van Binnenklimaat Nederland een Co2-meter met een geschatte waarde van €150,-.",08-09-2022
"Ontvangen van uitgeverij Noordhoff de 56e editie van de Grote Bosatlas met een waarde van €70,-.",20-04-2022
"Ontvangen een Co2kanarie ter waarde van € 159,00",04-11-2021
"Ontvangen van Klaas Jol ter gelegenheid van de uitreiking van zijn biografie een schilderij van J. Van Munster uit 1984. De geschatte waarde is ongeveer €200,-.",07-05-2020
Ontvangen van De Landelijke Huisartsen Vereniging na een debat op 19 mei 2010 een thermometer en een bloeddrukmeter.,19-05-2010
"Ontvangen van Koninklijke Horeca Nederland na het debat in Dudok op 18 mei 2010 2 cadeaubonnen à €100,-- per stuk van Alliance Gastronomique.",18-05-2010
Geschenk,Datum
"Ontvangen van Boom uitgevers Amsterdam drie boeken: Montesquieu, over de geest van de wetten (waarde €64,50); Mill over de vrijheid (waarde €18,50) en Pascal Bruckner, Tirannie van het berouw (€23,90), Totale waarde €106,90.",30-09-2008
"Akerboom, E.S. (Eva) - PvdD",
Geschenken,
Geschenk,Datum
Geen,
"Alkaya, M.Ö. (Mahir) - SP",
Geschenken,
Geschenk,Datum
Ontvangen van de theatermakers twee vrijkaartjes voor een theatervoorstelling 'Door de bank genomen: Tien jaar later'. De waarde is onbekend.,30-05-2023
"Amhaouch, M. (Mustafa) - CDA",
Geschenken,
Geschenk,Datum
Ontvangen van het Taipei Representative Office een fles drank. De waarde is onbekend.,10-01-2023
Ontvangen van de vertegenwoordigster van Taiwan een doos bonbons naar aanleiding van een gesprek bij de Tweede Kamer. De waarde is onbekend.,12-10-2022
"Ontvangen van de gemeente Eindhoven een uitnodiging, voor twee personen, voor de voetbalwedstrijd PSV-Ajax. De waarde is onbekend.",23-09-2018
Ontvangen twee echte Limburgse Vlaaien (abrikozen/kersen) van KBO Grubbenvorst. De waarde is onbekend.,08-11-2017
"Bijgewoond op uitnodiging van de gemeente Eindhoven, met 1 persoon, de wedstrijd PSV-Ajax. De waarde is onbekend.",23-04-2017
"Azarkan, F. (Farid) - DENK",
Geschenken,
Geschenk,Datum
"Ontvangen van register belasting adviseurs het boek ‘RB VeRBeter bundel’ ter waarde van €29,95 .",24-10-2023
"Ontvangen het boek ‘Zo, nu ben je wees’ van Jojanneke van den Bosch ter waarde van €39,90.",17-10-2023
"Ontvangen van SIB Leiden een cadeaupakket met SIB merchandise ter waarde van €33,85",13-09-2023
"Ontvangen van de evaluatiecommissie van Balen het boek ‘Het vertrouwen zoek, de kabinetsformatie 2021/2022 geëvalueerd’ ter waarde van €29,90.",04-07-2023
"Ontvangen het boek ‘politieke polarisatie in Nederland’ ter waarde van €19,90.",04-07-2023
"Ontvangen van het Voedingscentrum het boek ‘Schijf van vijf kookboek’, ter waarde van €19,95.",14-06-2023
"Ontvangen het boek ‘Verstikkende bureaucratie met wortel en tak uitroeien’ van Guus Berkhout ter waarde van €12,95.",09-06-2023
"Ontvangen het boek ‘Gelijk goed beginnen’ van Tessa Roseboom ter waarde van €31,50.",01-06-2023
"Ontvangen het boek ‘De eerste 1000 dagen’ van Tessa Roseboom ter waarde van €29,95.",01-06-2023
"Ontvangen van SaBais B.V. het boek ‘Worst bank scenario’ ter waarde van €25,-.",15-03-2023
"Ontvangen van de Haagse Hogeschool een VVV-bon ter waarde van €50,-.",23-02-2023
"Ontvangen van Rozemarijn van ’t Einde het boek ‘Rebelleren voor het leven’ van Rozemarijn van ’t Einde ter waarde van €20,99.",20-02-2023
"Ontvangen van Martijn Aslander het boek 'Ons werk is stuk' ter waarde van € 24,95.",30-01-2023
"Ontvangen van de RAI Vereniging een fietspomp ter waarde van € 17,95.",26-01-2023
"Ontvangen van De Correspondent Uitgevers het boek ‘Sander en de brug, vijf voorstellen voor een eerlijker Nederland’ ter waarde van € 15,-.",23-01-2023
"Ontvangen via de post het boek: ‘Naar een nieuw tijdperk met een zakenkabinet’ ter waarde van €16,95.",16-01-2023
"Ontvangen van Karin Blankenstein het boek: ‘Ze lullen maar een die eind weg’ van John Blankenstein ter waarde van €12,89.",02-01-2023
"Ontvangen van ProDemos een chocoladereep van Tony Chocolonely ter waarde van €3,29.",22-12-2022
"Ontvangen van Elsevier het boek: 'Handboek Minister: De Lang geheimgehouden instructies aan bewindslieden' ook wel het ‘blauwe boek’ genoemd’ van Joppe Gloerich ter waarde van €14,95.",19-12-2022
"Ontvangen van een burger een horloge van het merk Seiko ter waarde van €280,-. Bedrag gedoneerd aan een goed doel.",16-12-2022
Geschenk,Datum
"Ontvangen van een burger een doos Italiaanse koekjes ter waarde van €11,85.",16-12-2022
"Ontvangen van Paul Hassels Mönning het boek ‘Palmen op de Noodpool, het grote verhaal van klimaatverandering’ ter waarde €25,-.",17-11-2022
"Ontvangen van een scholier: een geschenkdoos Ferrero Collection chocolade ter waarde van €7,50.",14-11-2022
"Ontvangen van het bestuur van de NPO het boek 'Het verhaal van Nederland, onze geschiedenis van de prehistorie tot nu' ter waarde van €15,-.",04-11-2022
"Ontvangen van IMPAKT het kaartspel 'Turning Tables- fair tech card game' ter waarde van €12,50",28-10-2022
"Ontvangen van het Mendelcollege het boek ‘De zeven vinkjes’ van Joris Luyendijk ter waarde van €21,99.",03-10-2022
"Ontvangen het boek ‘Kafka in de Rechtsstaat De gevolgen van een leesfout: de toeslagenaffaire ontleed’ van Ellen Pasman ter waarde van €20,-.",31-08-2022
"Ontvangen vanwege het behalen van de 8e plaats in de Nationale Politieke Index een exemplaar van HP de Tijd, uitgave september 2022, ter waarde van €8,95.",30-08-2022
"Ontvangen van uitgeverij Atlas Contact het boek ‘Achtervolgd door de staatsmaffia’ van Bill Browder ter waarde van €24,95.",07-07-2022
"Ontvangen van de Raad voor het Openbaar Bestuur het boek ‘Wetenschap en overheidsbeleid, een spanningsvolle relatie’ ter waarde van €24,90.",07-07-2022
"Ontvangen van de Bestuurskundige Interfacultaire Vereniging Leiden een waardebon van €30,- en een bos bloemen. De waarde is onbekend",19-04-2022
"Ontvangen het boek ‘Ze moeten altijd mij hebben’ van Anja Diender ter waarde van €21,80",04-04-2022
"Ontvangen van Noordhoff uitgevers de zesenvijftigste editie van de Grote Bosatlas ter waarde van € 69,95.",31-03-2022
Ontvangen een autoritje. De waarde is onbekend.,11-03-2022
"Ontvangen couscous ter waarde van €14,75.",11-03-2022
"Ontvangen een visschotel ter waarde van €24,95.",11-03-2022
"Ontvangen van een Haagse ondernemer 2 kilo kersen ter waarde van €16,-.",11-03-2022
"Ontvangen van Nizaar Makdoembaks het boek ‘Racisme in de Bijlmer’ ter waarde van €55,-.",10-12-2021
"Ontvangen van Google drie Titan Security Keys ter waarde van €35,- per stuk (€105,- in totaal).",10-12-2021
Ontvangen van Groene Metropoolregio Nijmegen Arnhem een vogelhuisje. De waarde is onbekend.,14-04-2021
Ontvangen van een burger op straat tijdens campagne een bos bloemen. De waarde is onbekend.,14-04-2021
Ontvangen een draadloze telefoonlader. De waarde is onbekend.,14-04-2021
"Ontvangen het boek ""Zo hadden we het niet bedoeld- De tragedie achter de toeslagenaffaire"" van Jesse Frederik meet een geschatte waarde van €22,50.",14-04-2021
Ontvangen een doos chocolade. De waarde is onbekend.,14-04-2021
Ontvangen van een burger (ondernemer) op straat tijdens campagne in Bergen op Zoom een fleecedeken. De waarde is onbekend.,17-03-2021
ontvangen van Aya Laghzaoui een doos bonbons. De waarde is onbekend.,17-03-2021
Ontvangen van een burger op straat tijdens campagne een bos bloemen. De waarde is onbekend.,17-03-2021
Ontvangen van een burger op straat tijdens campagne een doos dadels. De waarde is onbekend.,17-03-2021
Ontvangen van een burger op straat tijdens campagne een bos bloemen. De waarde is onbekend.,16-03-2021
"Ontvangen van Ruud de Wild i.v.m. het programma ""ingelijst"" een schilderij ter waarde van €1500,-.",25-02-2021
Ontvangen van Ronald van Klaveren een patatje. De waarde is onbekend.,04-01-2021
"Baarle, S.R.T. (Stephan) van - DENK",
Geschenken,
Geschenk,Datum
"Ontvangen van Noordhoff uitgevers de zesenvijftigste editie van de Grote Bosatlas ter waarde van € 69,95.",31-03-2022
"Baudet, T.H.P. (Thierry) - FVD",
Geschenken,
Geschenk,Datum
Geen,
"Becker, B. (Bente) - VVD",
Geschenken,
Geschenk,Datum
Deelgenomen aan een buffet aangeboden door de Stichting Ondersteuning VVD (SOV). De waarde is onbekend.,28-08-2023
"Ontvangen het boek 'Naar een nieuw tijdperk met een zakenkabinet' van Guus Berkhout ter waarde van €16,95,-.",19-01-2023
Ontvangen van Uitgeverij Noordhoff de zesenvijftigste editie van de Grote Bosatlas. De waarde is onbekend.,30-03-2022
Ontvangen van de Stichting Ondersteuning VVD (SOV) een Stamppotdiner SOV. De waarde is onbekend.,02-11-2021
"Ontvangen van het College van Gedeputeerde Staten van Limburg en de Regio Venlo een uitnodiging voor het Aspergediner in Nieuwspoort ter waarde van €97,50.",17-04-2019
"Ontvangen het boek ‘Negotiating Peace’ van Sven Koopmans ter waarde van €133,-.",12-02-2019
"Deelname aan Red Carpet Event op uitnodiging van NRCommunicatie in Kurhaus Scheveningen ter waarde van €150,- euro.",17-03-2018
Bijgewoond het Goed Geld Gala op uitnodiging van de Nationale Postcodeloterij te Amsterdam. De waarde is onbekend.,15-02-2018
"Deelgenomen aan het Aspergediner in Nieuwspoort, aangeboden door EVO-Fenedex. De waarde is onbekend.",19-04-2017
"Beckerman, S.M. (Sandra) - SP",
Geschenken,
Geschenk,Datum
"Ontvangen van kunstenaar Eddy Roos het boek 'Verstilde beweging' van Eddy Roos ter waarde van €80,20.",29-04-2023
"Ontvangen tijdens een werkbezoek met de vaste commissie Binnenlandse Zaken aan Buwog een serie brochures en boeken over woningbouw in Wenen. Een van deze boeken, het boek over 'Woningbouw in Wenen' heeft een geschatte",09-09-2022
"waarde van €68,-. Van de overige geschenken is de waarde onbekend.",
"Ontvangen een serie van 4 gebonden boeken getiteld: “Opgravingen aan de Grote Markt Oostzijde (Raap rapport 3300)” van Marten Verbruggen, directeur RAAP. De waarde is onbekend omdat de boeken nooit zijn verkocht.",13-01-2020
Ontvangen een schilderij van kunstenaar Hilda de Vries (artiestennaam Lotje). De waarde is onbekend.,07-05-2019
Ontvangen van de provincie Noord-Holland het boek ‘Wereldvondsten uit een Hollands schip’. De waarde is onbekend.,13-03-2019
"Ontvangen een cheque van €250 voor een goed doel, voor deelname aan de collegetour van openbare scholengemeenschap Winkler Prins in Veendam. Het geld is gedoneerd aan het Stut en Steun.",19-03-2018
"Beertema, H.J. (Harm) - PVV",
Geschenken,
Geschenk,Datum
"Ontvangen van uitgeverij Noordhoff de 56e editie van de Grote Bosatlas met een waarde van €70,-.",20-04-2022
"Belhaj, S. (Salima) - D66",
Geschenken,
Geschenk,Datum
Ontvangen van het college van B&W van Rotterdam een kaartje voor het North Sea jazz. De waarde is onbekend.,07-07-2023
"Ontvangen van Kees Verhoeven het boek “De democratie crasht” ter waarde van €22,99.",04-07-2023
Bijgewoond op uitnodiging van de organisatie Black Achievement Month The Black Achievement Awards. De waarde is onbekend.,31-10-2022
Ontvangen van de Gemeente Rotterdam een toegangskaart voor het North Sea Jazz Festival te Rotterdam. De waarde is onbekend.,08-07-2022
Ontvangen van Rotterdam Festivals een Rotterdampas en een schaal. De waarde is onbekend.,08-07-2022
Ontvangen van de KNVB toegangskaarten voor de wedstrijd Nederland - Polen. De waarde is onbekend.,10-06-2022
"Ontvangen van Uitgeverij Noordhoff de 56e editie van De Grote Bosatlas ter waarde van €69,95.",06-04-2022
Ontvangen van het College van B&W Rotterdam twee tickets voor de finale van het Songfestival. De waarde is onbekend.,22-05-2021
"Ontvangen van het Elsevier Defensie Verkiezingsdebat 2 flessen wijn & boeken ter waarde van €155,-",27-02-2021
"Deelgenomen aan een debat, op uitnodiging van SIB-Groningen, ter waarde van € 99,- (hotel, diner en ontbijt).",29-10-2020
"Bijgewoond de Diwan awards Gala voor het uitreiken van een prijs aan een van de genomineerden, gala en diner ter waarde van €300,-.",30-11-2019
"Ontvangen van de Gemeente Rotterdam 2 kaarten voor North Sea Jazz ter waarde van €190,-.",13-06-2019
"Ontvangen van de Provincie Limburg twee kaarten voor de Tefaf ter waarde van €80,-.",22-03-2019
"Ontvangen van gemeente Groningen een kaart voor Eurosonic Noorderslag op 17, 18 en 19 januari 2019 met een totale waarde van €167,-.",17-01-2019
"Ontvangen van Netherlands Maritime Technology een kaart voor de Maritime Gala awards ter waarde van €125,-.",12-11-2018
Ontvangen gala kaarten voor het Martiem Gala 2017 van Nederland Martiemland. De waarde is onbekend.,12-11-2017
Geschenk,Datum
Ontvangen een Chinees Paper-cut boek van Chinese delegatie Juridische commissie Parlement van China. De waarde is onbekend.,27-09-2017
Ontvangen van NOCNSF twee kaarten voor een voetbalwedstrijd van het Nederlandse vrouwen voetbalteam. De waarde is onbekend.,20-07-2017
Ontvangen van gemeente Rotterdam twee kaarten voor het North Sea Jazz festival. De waarde is onbekend.,08-07-2017
"Ontvangen van Elsevier het boek ""Te Wapen in het kielzog van een krimpende krijgsmacht"" van Eric Vrijsen ter waarde van €14,95.",03-04-2016
"Ontvangen van Elsevier het boek ""Enkele reis Nederland hoe massa-immigratie ons land veranderde"" van Gertjan van Schoonhoven ter waarde van €14,95.",03-04-2016
"Ontvangen van Elsevier het boek ""Anatomie van de macht"" van Eric Vrijsen ter waarde van €14,95.",03-04-2016
"Ontvangen van Elsevier het boek ""Zonder Koningin"" van Paul Bovend'Eert ter waarde van €14,95.",03-04-2016
"Ontvangen van Elsevier het boek ""Heimweeland reportages over de strijd van Nederlanders tegen verandering"" van Jelte Wiersma ter waarde van €14,95.",03-04-2016
"Ontvangen van Elsevier het boek ""De executie van oom Koen en 24 andere historische reportages over de Tweede Wereldoorlog"" van Lennaert Lubberding ter waarde van €14,95.",03-04-2016
"Ontvangen van Elsevier het boek ""Republiek van vrije burgers het onbehagen in de democratie"" van H.J. Schoo ter waarde van €14,95.",03-04-2016
"Ontvangen van Elsevier het boek ""Einddoel Witte Huis hoe de Amerikanen hun president kiezen"" van Koen Petersen ter waarde van €14,95.",03-04-2016
"Ontvangen van Elsevier het boek ""Alle 18 presidenten van De Nederlandsche Bank"" van Paul de Hen ter waarde van €19,95.",03-04-2016
"Ontvangen een kaart voor het gala Rotterdams Philharmonisch orkest, betaald door gemeente Rotterdam. De waarde is onbekend.",19-03-2016
"Ontvangen een kaart voor de Paardenconcours Brabanthallen, betaald door Nicole van Doorn. De waarde is onbekend.",12-03-2016
Deelgenomen aan een diner ten behoeve van een kennismaking met de onderafdeling Brabant D66. De waarde is onbekend.,11-03-2016
"Berg, J.A.M.J. (Joba) van den - CDA",
Geschenken,
Geschenk,Datum
"Ontvangen vanwege deelname aan een panel bij congres van Pandemic Disaster and Preparedness Center een bon ""Een boompje cadeau"" ter waarde van €29,90.",30-10-2023
Ontvangen van provincie Zeeland een pakket met diverse Zeeuws lekkernijen. De waarde is onbekend.,26-10-2023
Ontvangen notitie blokjes na het geven van twee gastlessen bij Zuidwesthoek School in Goes. De waarde is onbekend.,16-10-2023
"Ontvangen van NAPA vanwege deelname in panel, een boeket gemengde rozen plus glazenvaas met Zeeuws knoopje. De waarde is onbekend.",16-10-2023
"Ontvangen vanwege deelname aan een uitzending van Pointer radio, een fles rode wijn. De waarde is onbekend.",15-10-2023
Ontvangen van Maghalie van der Bunt-George het boek 'Oro is goud'. De waarde is onbekend.,12-10-2023
Ontvangen van de Gemeente Zundert (Burgemeester en ambtenaren) een geborduurde theedoek. De waarde is onbekend.,12-10-2023
Ontvangen na een optreden bij Radar een Dopper met Radar logo. De waarde is onbekend.,09-10-2023
Ontvangen een mand Zeeuwse producten naar aanleiding van een bijeenkomst over de zorg in Heinkenszand georganiseerd door CDA senioren Zeeland en CDA vrouwen Zeeland. De waarde is onbekend.,29-09-2023
"Ontvangen voor een bijdrage aan het congres Medical PHIT een fles witte wijn (de waarde is onbekend), Bolcom bon van €100,- en een Multi Cable met Medical PHIT logo (de waarde is onbekend).",22-09-2023
"Ontvangen een fles rode wijn vanwege deelname aan een panel, georganiseerd door CDJA, Jongeren Wetenschappelijk Bureau GroenLinks en de Jong Wiardi Beckman Stichting. De waarde is onbekend.",14-09-2023
"Ontvangen tijdens een werkbezoek aan de apotheek Hoge Zijde in Alphen aan de Rijn, een fles olijfolie, een zakje van 350 gram met gemengde noten en een Parker balpen met logo van de Vereniging van Jonge Apothekers (VJA). De waarde",24-08-2023
is onbekend.,
Ontvangen van CDA Kapelle bij werkbezoek een fles rode wijn en twee zakjes zoutjes. De waarde is onbekend.,14-07-2023
"Ontvangen het boek “Verstikkende bureaucratie met wortel en tak uitroeien” door Guus Berkhout en Hans de Jongh, uitgeverij Aspect. De waarde is onbekend.",22-06-2023
Ontvangen een fles Sapinca organic root elixir vanwege een bijeenkomst Young professionals in de zorg georganiseerd door BPRA. De waarde is onbekend.,22-06-2023
Ontvangen een wensboompje (appel) vanwege presentatie aan Ledenraad Menzis. De waarde is onbekend.,16-06-2023
Gast van NVSHA bij ochtendprogramma ICEM (International Congress Emergency Medicine) in Amsterdam. De waarde is onbekend.,16-06-2023
Ontvangen van het Voedingscentrum het ‘Schijf van Vijf Kookboek’. De waarde is onbekend.,12-06-2023
Ontvangen een doosje met vier ‘domtorentjes’ (chocolade met crème) vanwege presentatie aan studenten Utrecht Law College. De waarde is onbekend.,08-06-2023
Ontvangen van Gerhard Bruggink/Axon wegens deelname aan panel over duurzaamheid in de zorg een fles Rosé. De waarde is onbekend.,26-05-2023
"Ontvangen tijdens een werkbezoek aan Zorgbelang Brabant/Zeeland in Goes, een thermo-dopper ter waarde van €29,95.",21-04-2023
Ontvangen tijdens een werkbezoek een koffiemok van 'Beter Dichtbij'. De waarde is onbekend.,14-04-2023
Ontvangen tijdens een werkbezoek aan Zuidwest Radio Therapeutisch Instituut een muts en een sjaal. De waarde is onbekend.,11-03-2023
Ontvangen tijdens een werkbezoek aan Tiofarma een boeket bloemen. De waarde is onbekend.,10-03-2023
"Ontvangen een boekenbon vanwege een presentatie voor Post Rotarians ter waarde van €30,-.",28-02-2023
Ontvangen tijdens werkbezoeken in Sneek en Bolsward een mand met Friese producten en een boeket bloemen. De waarde is onbekend.,24-02-2023
Geschenk,Datum
"Ontvangen van de Koninklijke Nederlandse Maatschappij ter bevordering der Pharmacie (KNMP) een fles rode wijn, vanwege presentatie over farmacogenetica. De waarde is onbekend.",15-02-2023
Ontvangen een boeket bloemen vanwege het openen van de tentoonstelling 'Herinneringen in Delftsblauw' in het Watersnoodmuseum. De waarde is onbekend.,04-02-2023
Ontvangen van Omroep Tholen een pen en een sleutelhanger met lampje. De waarde is onbekend.,27-01-2023
Ontvangen tijdens een bezoek aan GGZ-instelling Altrecht twee boeken: ‘Helpen is Moeilijk’ en ‘Sociaal Kapitaal: De identiteit van de sociaal psychiatrisch verpleegkundige’. De waarde is onbekend.,11-01-2023
Ontvangen van de commissaris van de Koning in Groningen het boek 'Een streepje voor' met foto’s van geopereerde hartpatiënten. De waarde is onbekend.,22-12-2022
Ontvangen van Aqua Minerals een circulair flesje bier Ontboezeming. De waarde is onbekend.,22-12-2022
Ontvangen van Elzeviers Weekblad het boek 'Handboek Minister'. De waarde is onbekend.,15-12-2022
"Ontvangen van apotheek A15 tijdens een werkbezoek een houten plank, stukje Bliekenstad kaas met klein potje mosterd, flesje Ogenbliekje kruidenbitter, busje met Gorcumse zoute bollen en blikje met Gorcumse bliekendrop. De waarde is",09-12-2022
onbekend.,
Ontvangen van ANBO het boek 'Vrolijk Verval' van Hedy D’Ancona. De waarde is onbekend.,07-12-2022
Ontvangen van CDA Utrechtse Heuvelrug naar aanleiding van een bijeenkomst een fles rode wijn. De waarde is onbekend.,23-11-2022
"Ontvangen tijdens een petitie aanbieding over ""Meer onderzoek naar (onverklaarde) gezondheidsklachten van vrouwen"" het boek 'Ik ben geen man'. De waarde is onbekend.",22-11-2022
Ontvangen van BPRA vanwege deelname aan gesprek met jonge zorgprofessionals een Sinterklaas chocoladeletter. De waarde is onbekend.,16-11-2022
Ontvangen van de Gemeente Gorinchem vanwege het geven van een gastles tijdens de Week van Respect bij IKC Merweplein chocolaatjes. De waarde is onbekend.,11-11-2022
Ontvangen van Your Surprise uit Zierikzee een gepersonaliseerde (naam) thermosfles. De waarde is onbekend.,07-11-2022
"Ontvangen van de provincie Zeeland bij viering 40 jaar Four Freedoms Award, een linnen tas met boek 40 jaar Four Freedoms Awards en blokkaars. De waarde is onbekend.",14-10-2022
Ontvangen van CDA Senioren Overijssel melkproducten en muesli vanwege presentatie. De waarde is onbekend.,07-10-2022
Ontvangen van Zorg Verzekeraars Nederland het boek 'Little escapes in Nederland' vanwege het geven van een workshop. De waarde is onbekend.,06-10-2022
"Ontvangen van de PVV het boek ""The Satanic Verses"" van Salman Rushdie. De waarde is onbekend.",05-10-2022
Ontvangen van de gemeente Tilburg voedselproducten als dank voor bijdrage aan een workshop. De waarde is onbekend.,05-10-2022
Ontvangen tijdens een werkbezoek aan KNMT het boek 'Tanden en misverstanden (Bizarre verhalen uit een tandartskamer)'. De waarde is onbekend.,16-09-2022
Ontvangen tijdens Profila werkbezoek een warmhouder koffie/thee. De waarde is onbekend.,24-08-2022
Ontvangen van de LHV een ‘Ik wil voor iedereen een huisarts’ mok met snoepjes. De waarde is onbekend.,01-07-2022
Ontvangen van Provincie Zeeland een paraplu. De waarde is onbekend.,27-06-2022
Ontvangen via de Landelijke Huisartsen Vereniging (LHV) het boek ‘Huisarts op recept’ door Marnix van der Leest. De waarde is onbekend.,27-06-2022
Ontvangen van Actiz het boek ‘Ouder worden 2040’. De waarde is onbekend.,13-06-2022
"Ontvangen het boek ‘Geheel meesters’ naar aanleiding van het verzorgen van de module ‘De nieuwe zorg’, Masterclass. De waarde is onbekend.",08-06-2022
Ontvangen tijdens een werkbezoek aan MiFood Brightlands Campus Greenport Venlo drie flesjes Joycie. De waarde is onbekend.,03-06-2022
Ontvangen van Uitgeverij Blauwburgwal het boek 'De linkse kerk'. De waarde is onbekend.,25-05-2022
Ontvangen van Provincie Zeeland ter gelegenheid van 365 dagen jubileum Tweede Kamer een ballpoint met Zeeuws knoopje. De waarde is onbekend.,31-03-2022
