"Aartsen, A.A. (Thierry) - VVD",
Bijgewoond het Goed Geld Gala op uitnodiging van de Nationale Postcodeloterij te Amsterdam. De waarde is onbekend.,15-02-2018
"Maatoug, S. (Senna) - GL-PvdA",
Geschenken,
Geschenk,Datum
"Ontvangen van wethouder Rik Thijs (GroenLinks, Gemeente Eindhoven) 1 kaart voor de wedstrijd PSV-Ajax en parkeerkaart, ontvangst Philips Stadion. De waarde is onbekend.",23-04-2023
"Ontvangen van Diervriendelijk Nederland en Vegan Today een doos met vriendelijke, plantaardige levensmiddelen. De waarde is onbekend.",06-09-2022
"Ontvangen van Noordhoff uitgevers de zesenvijftigste editie van de Grote Bosatlas ter waarde van € 69,95.",01-04-2022
"Ontvangen tijdens de Klimaat- & Diervriendelijke parlementaire BBQ een diervriendelijk voedselpakket ter waarde van €70,00.",01-07-2021
"Madlener, B. (Barry) - PVV",
Geschenken,
Geschenk,Datum
"Ontvangen van uitgeverij Noordhoff de 56e editie van de Grote Bosatlas met een waarde van €70,-.",20-04-2022
Ontvangen van Rijkswaterstaat tijdens een werkbezoek aan Goeree Overflakkee een ingebonden boek over de Delta Werken. De waarde is onbekend.,23-05-2016
Ontvangen een inhuldigingsmedaille Koning,19-12-2013
"Ontvangen van dhr. Timmermans, Minister van Buitenlandse Zaken, het boek ""De Radetzky Mars"" van Joseph Roth",19-12-2013
"Ontvangen van Boom uitgevers Amsterdam drie boeken: Montesquieu, over de geest van de wetten (waarde €64,50); Mill over de vrijheid (waarde €18,50) en Pascal Bruckner, Tirannie van het berouw (€23,90), Totale waarde €106,90.",30-09-2008
Ontvangen tijdens een werkbezoek in Zeeland een zak aardappelen,04-10-2007
"Maeijer, V. (Vicky) - PVV",
Geschenken,
Geschenk,Datum
Ontvangen de 56e editie van de Grote Bosatlas (Noordhoff). De waarde is onbekend.,05-04-2022
"Marijnissen, L.M.C. (Lilian) - SP",
Geschenken,
Geschenk,Datum
"Ontvangen van Ruud de Wild i.v.m. het programma ""ingelijst"" een schilderij. De waarde is onbekend.",15-02-2021
"Ontvangen van het radioprogramma NPO 1 De Taalstaat een onderscheiding voor het winnen van de titel Taalstaatmeester 2018. Het betreft een handgemaakte penning ter waarde van ongeveer €200,-.",29-12-2018
"Markuszower, G. (Gidi) - PVV",
Geschenken,
Geschenk,Datum
"Ontvangen van uitgeverij Noordhoff de 56e editie van de Grote Bosatlas met een waarde van €70,-.",13-04-2022
"Meijeren, G.F.C. (Gideon) van - FVD",
Geschenken,
Geschenk,Datum
Geen,
"Michon-Derkzen, I.J.M. (Ingrid) - VVD",
Geschenken,
Geschenk,Datum
"Ontvangen van Hester Bais het boek ‘’Worst Bank Scenario’’ ter waarde van €25,-.",13-03-2023
Ontvangen van Valegis Advocaten twee flessen wijn. De waarde is onbekend.,14-02-2023
"Ontvangen van Amsel Boeken het boek ""De Rioolrat""van Pieter Chenestre ter waarde van €21,95.",14-02-2023
"Ontvangen van dhr. S. Schimmelpenninck het boek ‘Sander en de brug’ van Sander Schimmelpenninck ter waarde van €15,-.",24-01-2023
Ontvangen van de voorzitter van de Tweede Kamer twee waxinelichtjeshouders in huisstijl Tweede Kamer. De waarde is onbekend.,17-01-2023
"Ontvangen van Elsevier het boek ‘Handboek Minister: De Lang geheimgehouden instructies aan bewindslieden"", ook wel het ‘blauwe boek’ genoemd van Joppe Gloerich. De waarde is onbekend.",22-12-2022
Ontvangen van de KNVB een voetbal. De waarde is onbekend.,11-12-2022
Ontvangen van KNVB een toegangskaartje voor de voetbalwedstrijd Almere City-ADO Den Haag. De waarde is onbekend.,11-12-2022
"Ontvangen van Rotterdam-The Hague Airport een bol.com cadeaubon ter waarde van € 25,-.",08-12-2022
Ontvangen van Meinesz Holla en partners een fles rode wijn. De waarde is onbekend.,08-12-2022
"Ontvangen van PVV-fractie het boek ‘The Satanic Verses’ ter waarde van € 11,99.",01-11-2022
"Ontvangen van de provincie Zeeland een fotoboek ""Zeeuws Meisje"" ter waarde van €39,95.",31-08-2022
Ontvangen van gemeente Alkmaar een Kaasmand. De waarde is onbekend.,19-08-2022
Ontvangen van de Provincie Zeeland een pen. De waarde is onbekend.,31-03-2022
"Ontvangen van Noordhoff uitgevers de zesenvijftigste editie van de Grote Bosatlas ter waarde van € 69,95.",31-03-2022
"Ontvangen van Teun Toebes het boek 'VerpleegThuis: Wat ik leer van mijn huisgenoten met dementie' ter waarde van €20,00.",13-12-2021
Ontvangen van de gemeente Elburg een geschenkenmand met fruitsap en chocolade. De waarde is onbekend.,13-09-2021
"Ontvangen van de VVD Zuid-Holland een fles wijn met een geschatte waarde van €10,-",17-06-2021
"Ontvangen van Vewin een Dopper waterfles met een geschatte waarde van €15,-.",22-04-2021
Geschenk,Datum
Ontvangen van onderwijspartners een aantal boeken. De waarde is onbekend.,22-04-2021
Ontvangen van de Nederlandse bierbrouwers een bierpakket . De waarde is onbekend.,22-04-2021
Ontvangen van de Gemeente Groningen een houten puzzel. De waarde is onbekend.,22-04-2021
Ontvangen van het Interprovinciaal Overleg (IPO) een vogelhuisje en chocolade eitjes. De waarde is onbekend.,22-04-2021
Ontvangen van de Provincie Noord-Holland een pakket met aantal producten. De waarde is onbekend.,22-04-2021
"Ontvangen van Pieter Omtzigt het boek ""Een nieuw sociaal contract"" met een geschatte waarde van €20,-.",22-04-2021
Ontvangen van de Provincie Groningen een draadloze telefoonoplader en telefoonhouder. De waarde is onbekend.,22-04-2021
"Minhas, F.B. (Fahid) - VVD",
Geschenken,
Geschenk,Datum
Ontvangen van stichting Voedingscentrum het kookboek 'Schrijf van Vijf'. De waarde is onbekend.,20-06-2023
Ontvangen van NS een kinderboek 'Van apenkop tot dwarsligger'. De waarde is onbekend.,07-06-2023
Ontvangen van VEWIN twee flessen prosecco. De waarde is onbekend.,31-05-2023
Ontvangen het boek ‘Worst Bank Scenario’ van Hester Bais. De wwarde is onbekend.,15-03-2023
Ontvangen van de provincie Zeeland een stropdas. De waarde is onbekend.,17-01-2023
Ontvangen van Aquaminerals het circulaire biertje ‘Ontboezeming’. De waarde is onbekend.,17-01-2023
Ontvangen van de Metropoolregio Amsterdam drie repen Tony Chocolonely. De waarde onbekend.,17-01-2023
Ontvangen van de Jonge Veranderaars na hun bezoek aan de Tweede Kamer het boek getiteld ‘Perron Europa’. De waarde is onbekend.,17-11-2022
Bijgewoond op uitnodiging van de VVD Rotterdam de wedstrijd Feyenoord – Midtjylland. De waarde is onbekend.,13-10-2022
"Ontvangen van Dhr. G. Wilders, het boek ""The Satanic Verses"" van Salman Rushdie. De waarde is onbekend.",06-10-2022
Ontvangen het boek ‘marktwerking in de publieke dienstverlening vloek of zegen?’. De waarde is onbekend.,15-09-2022
Ontvangen van de Raad voor het Openbaar Bestuur een Essaybundel ‘wetenschap en overheidsbeleid’. De waarde is onbekend.,08-09-2022
Ontvangen van de Pakistaanse Ambassade een Mango doos (uitgedeeld aan secretariaat). De waarde is onbekend.,08-09-2022
Ontvangen een aspergepakket van waterschap Limburg. De waarde is onbekend.,07-06-2022
Ontvangen Jaarboek 2020 ‘historische en heemkundige studies in en rond het Geuldal’ en het boekje ‘Valkenburg’ tevens van waterschap Limburg. De waarde is onbekend.,07-06-2022
"Deelgenomen aan het aspergediner. De waarde is onbekend,",20-04-2022
"Ontvangen van Noordhoff uitgevers de zesenvijftigste editie van de Grote Bosatlas ter waarde van € 69,95.",12-04-2022
"Ontvangen van organisatie Rombout Sociale Innovatie het boek “Basisfatsoen. Masterplan voor een wérkelijk sociale samenleving” van Barend Rombout ter waarde van €17,95.",07-04-2021
"Mohandis, M. (Mohammed) - GL-PvdA",
Geschenken,
Geschenk,Datum
"Ontvangen van de NPO het boek “Het verhaal van Nederland” ter waarde van €15,00. Voor eigen gebruik gehouden.",04-11-2022
"Deelgenomen aan het Correspondents Diner op uitnodiging van NPO ter waarde van €135,-. Voor eigen gebruik gehouden.",10-02-2016
"Ontvangen van NTR een vrijkaartje voor North Sea Jazz ter waarde van €85,- in het kader van een kijkje achter de schermen. Voor eigen gebruik gehouden.",06-01-2015
"Ontvangen van Radio 538 een oranje voetbalshirt ter waarde van €84,- in het kader van een werkbezoek. Voor eigen gebruik gehouden.",06-01-2015
"Ontvangen van Hogeschool de Kempel Helmond een VVV-bon ter waarde van €50,- voor een bijdrage aan een politieke dag van de school. Voor eigen gebruik gehouden.",21-11-2013
"Ontvangen van de SGP kiesvereniging Houten €70,- voor deelname aan een debat over het onderwijsbeleid. Gedoneerd aan stichting vluchteling.",21-11-2013
"Ontvangen van uitgeverij Atlas contact het boek ""Van deze kinderen ga je houden"" ter waarde van €21,95. Geschonken aan een medewerker.",21-11-2013
"Ontvangen van de Koninklijke Boekverkopersbond het boek ""Nederland"" van Charlotte Dematons ter waarde van €24,50.",14-11-2013
"Ontvangen van de Koninklijke Boekverkopersbond het boek ""Weird Things Customers Say in Bookshops"" van Jen Campbell ter waarde van €10,49.",14-11-2013
"Ontvangen van NOC NSF in het kader van de sportieve opening van het parlementaire jaar een Voetbalshirt, voetbalbroek en voetbalsokken. De waarde is onbekend en voor eigen gebruik gehouden.",24-10-2013
"Ontvangen van Stichting lezen en schrijven in het kader van de voorleesestafette het spel ""Woordzoeker"" ter waarde €27,99. Voor eigen gebruik gehouden.",24-10-2013
"Ontvangen van Buma-Stemra de CD ""Summer edition 2013"" van de Kids Top 20 ter waarde van €15,99. Voor eigen gebruik gehouden.",24-10-2013
Geschenk,Datum
"Ontvangen van uitgeverij Luitingh-Sijthoff het boek ""Een broze waarheid"" van auteur John le Carré in het kader van de politieke achtergrond van het boek. De waarde is €19,95 en voor eigen gebruik gehouden.",22-05-2013
"Aanwezig kennismaking Amsterdam Dance Event, dagkaart ter waarde van €95,- (alleen gebruik gemaakt van de borrel). Ontvangen een tas ter waarde van €69,95. Voor eigen gebruik gehouden.",17-10-2012
"Mulder, E. (Edgar) - PVV",
Geschenken,
Geschenk,Datum
"Ontvangen 12 zakjes bloembollen met een totale waarde van €60,-.",20-10-2022
Ontvangen van Noordhoff uitgevers de zesenvijftigste editie van de Grote Bosatlas. De waarde is onbekend.,05-04-2022
"Mutluer, S. (Songül) - GL-PvdA",
Geschenken,
Geschenk,Datum
"Ontvangen van de burgemeester van Alkmaar in het kader van gesprekken met burgemeesters, politie en OvJ over jonge doorgroeiers in de criminaliteit een diner en een kaart voor een voetbalwedstrijd. De waarde is onbekend. Voor eigen",07-02-2023
gebruik gehouden.,
Ontvangen foto’s n.a.v. fotoreportage voor een interview voor de Academie voor de rechtspraktijk. De waarde onbekend.,16-12-2022
"Ontvangen van Martin Bosma als cadeau bij de beëdiging het boek 'Schijn-Elite Van De Valsemunters' ter waarde van €89,-. Aan derden geschonken.",17-02-2022
"Nijboer, H. (Henk) - GL-PvdA",
Geschenken,
Geschenk,Datum
"Ontvangen van de gemeente Het Hogeland een diner en toegang tot de voorstelling 'Ripperda' van Zummerbuhne voor 2 personen a €75,- per persoon. Voor eigen gebruik.",19-10-2023
"Ontvangen van BUWOG (Oostenrijk) een serie brochures en boeken over woningbouw in Wenen. Een van deze boeken, het boek over 'Woningbouw in Wenen' heeft een geschatte waarde van €68,-. Van de overige geschenken is de waarde",09-09-2022
onbekend.,
"Ontvangen van de Koninklijke Boekverkopersbond het boek ""Nederland"" van Charlotte Dematons ter waarde van €24,50.",14-11-2013
"Ontvangen van de Koninklijke Boekverkopersbond het boek ""Weird Things Customers Say in Bookshops"" van Jen Campbell ter waarde van €10,49.",14-11-2013
"Ontvangen een boekenbon ter waarde van €20,- van het Ministerie van Financiën, als dank voor een ontvangst en rondleiding. Voor eigen gebruik gehouden.",01-11-2012
"Nispen, M. (Michiel) van - SP",
Geschenken,
Geschenk,Datum
"Ontvangen van Kees Verhoeven het boek “De democratie crasht” ter waarde van €22,99.",04-07-2023
"Ontvangen van de de auteur Saskia Wolters het boek ‘What the f#ck. Hoe het falen van instanties leidde tot de moord op mijn broer Joost’, ter waarde van €24,95.",27-06-2023
"Ontvangen van MOS (Maatschappelijke Organisaties in de Sport) bokshandschoenen ter waarde van €28,69.",24-05-2023
"Ontvangen van de NVSA (Nederlandse Vereniging voor Strafrecht Advocaten) de NVSA-Anker en Anker prijs, een bronzen beeldje. De waarde is onbekend.",09-11-2022
"Ontvangen van Thialf BV het boek ""Langebaan. ‘Het Nederlandse schaatsen in 75 legendarische ritten"" ter waarde van €45,-.",17-01-2022
"Ontvangen van het Verbond voor opheffing van het cannabisverbod het boek 'Weed of Wonder' ter waarde van €49,95.",30-06-2021
"Ontvangen van Daan Groenewoud het boek ‘Het stopzetten van KEI nader bezien. Een gordiaanse knoop?’ ter waarde van €39,50.",18-05-2021
"Ontvangen van Tobias van Gent het boek ‘Slag om de Schelde’ ter waarde van €49,95.",11-02-2021
"Ontvangen het boek 'Een kleine biografie van het straffen. Essays over herwaardering van schuld en boete' van Rinus Otte ter waarde van € 23,-.",12-02-2020
"Ontvangen het boek 'Postpakketjes van overzee. Gelegaliseerde kinderhandel in adoptie van kinderen uit Indonesië’ van Dewi Deijle ter waarde van € 18,50.",12-02-2020
"Ontvangen het boek van de auteur Irma Kokx: ‘ZVVEM, de paradox van een zwemdiploma. Bijna alles over leren zwemmen’ ter waarde van €23,95.",28-08-2019
"Ontvangen van de Vrije Universiteit Amsterdam voor het geven van een gastcollege aan studenten over de reclassering een boekenbon ter waarde van €50,-.",12-12-2018
"Ontvangen een boekenbon ter waarde van €75,- van Speeltuin Elckerlyc voor deelname aan en het houden van een toespraak op het symposium ter ere van het 25-jarig bestaan van Speeltuin Elckerlyc in Oss.",25-05-2018
"Ontvangen een mini-tafeltennistafel aangeboden door NOC*NSF en de NTTB (Nederlandse Tafeltennisbond) ter waarde van €115,-.",21-06-2017
Geschenk,Datum
"Ontvangen na een presentatie over de initiatiefwet bewegingsonderwijs op het congres van de KVLO (Koninklijke Vereniging voor Lichamelijke Opvoeding) een VVV-cadeaubon ter waarde van €50, alsmede een schaal, handgemaakt, door",20-05-2016
mensen met een beperking.,
"Omtzigt, P.H. (Pieter) - Omtzigt",
Geschenken,
Geschenk,Datum
"Ontvangen van het ANP een foto van verkenner Ollongren, die met haar dossier onder de arm, waarop open aantekeningen staan, in de auto stapt. De waarde is onbekend.",30-09-2022
Ontvangen van Esther Kokmeijer een kunstwerk bestaande uit vier kapotte porseleinen platen met de grondwet erop. De waarde is onbekend.,30-09-2022
Ontvangen 2 t-shirts en 2 hoodies van GeenStijl bij een optreden in het GeenStijl-café.,24-04-2020
"Ontvangen van de organisatoren van de Jansbeek lezing in Arnhem een boekenbon ter waarde van €80,- en avondeten.",10-02-2020
Deelgenomen aan het Diner Provincie Overijssel in Nieuwspoort. De waarde is onbekend.,20-11-2019
Bijgewoond de Military Boekelo met 2 personen op uitnodiging van de Gemeente Enschede. De waarde is onbekend.,12-10-2019
Bijgewoond het openluchtoptreden van het Orkest van het Oosten in De Lutte met 2 personen op uitnodiging van de Bloemenbeek. De waarde is onbekend.,08-09-2019
Bijgewoond de FBK-games op uitnodiging van de Gemeente Hengelo. De waarde is onbekend.,09-06-2019
"Ontvangen VVV-bon ter waarde van €75,-- van de Nederlandse Bond voor Pensioenbelangen voor deelname aan een forum.",12-05-2009
"Ontvangen van Boom uitgevers Amsterdam drie boeken: Montesquieu, over de geest van de wetten (waarde €64,50); Mill over de vrijheid (waarde €18,50) en Pascal Bruckner, Tirannie van het berouw (€23,90), Totale waarde €106,90.",30-09-2008
"Ouwehand, E. (Esther) - PvdD",
Geschenken,
Geschenk,Datum
"Ontvangen van de Diervriendelijke Parlementaire BBQ een vegan levensmiddelenpakket met een geschatte waarde van €50,-.",06-09-2022
"Ontvangen van Noordhoff Uitgever ""De Grote Bosatlas 56e editie"""" ter waarde van € 69,95.",29-03-2022
"Ontvangen een Amerikaans bankbiljet van 20 dollar en een Engels bankbiljet van 20 pounds (waarschijnlijk nep). En drie singeltjes met een totale waarde van € 25,-.",11-11-2020
"Ontvangen 4 toegangskaarten voor de opening van de tentoonstelling ""Hollanders van de Gouden Eeuw"" in de Hermitage Amsterdam. De kaarten zijn ter waarde van € 15,-- per stuk.",27-11-2014
"Ontvangen een doos met asperges. De geschatte waarde is €15,--.",25-04-2007
"Ontvangen van het Programma Kassa een fles wijn ter waarde van €7,50.",21-04-2007
"Ontvangen van ""De Berenkuil"" een bonbondoosje met een geschatte waarde van €10,--.",29-03-2007
"Ontvangen van Het Samenwerkingsverband Noord-Nederland een digitale klok met een geschatte waarde van €10,--.",27-03-2007
"Ontvangen van de KRO voor deelname aan het tv-programma Soeterbeeck een mp3-speler van 256 mB. Geschatte waarde is €15,--.",19-03-2007
Ontvangen van de Aninal Science Group een kunstwerk van een beschilderde koe. Waarde is onbekend.,08-03-2007
"Palland, H.M. (Hilde) - CDA",
Geschenken,
Geschenk,Datum
Ontvangen een Samenleesbijbel. De waarde is onbekend.,06-12-2022
"Ontvangen op uitnodiging van gedeputeerde Appelman van de provincie Flevoland twee toegangskaarten voor de Floriade Expo 2022 ter waarde van €58,-.",08-10-2022
"Ontvangen van BDO Advisory B.V. een bierpakket ter waarde van € 29,-.",28-04-2021
Aanwezig geweest op uitnodiging van de Gemeente Zeewolde bij het Flevopenningen Gala. De waarde is onbekend.,21-02-2020
"Ontvangen van Stichting Flevopenningen een goodiebag voor bezoekers van het Flevopenningen Gala, bestaande uit o.a. een handbagage reiskoffer, een bidon en een powerbank. De waarde is onbekend.",21-02-2020
Aanwezig geweest op uitnodiging van de gemeente Zeewolde bij de Bokkingrace. De waarde is onbekend.,30-08-2019
"Paternotte, J.M. (Jan) - D66",
Geschenken,
Geschenk,Datum
"Ontvangen van Dammie van Geest twee kaarten voor de voorstelling ‘Margreet Dolman geeft warmte en Dominee Gremdaat wijst de weg’ ter waarde van €50,-.",28-12-2022
"Ontvangen van Uitgeverij Noordhoff de 56e editie van De Grote Bosatlas ter waarde van €69,95.",06-04-2022
"Ontvangen van BNNVARA voor deelname aan S.P.E.L.show een deelnemersbijdrage ter waarde van €750,-. Het bedrag is geschonken aan het Wereld Natuur Fonds. Het prijzengeld van €3200,- is automatisch geschonken aan het Jeugd",11-06-2020
educatiefonds.,
"Ontvangen van dhr. William Millerson, Staten van Curaçao, een notitiehouder 'chrome plated' van El Casco. De waarde is onbekend.",28-06-2019
Ontvangen van de gemeente Sudwest Fryslan een vaartocht over het Sneekermeer op het 'Pommerantenboatsje' in het kader van de Hardzeildag. De waarde is onbekend.,08-08-2018
"Ontvangen van de Vereniging van Nederlandse Verkeersvliegers in het kader van een dag meeloopstage een ticket jumpseat: Ams-Londen-Ams ter waarde van €60,-.",03-08-2018
"Ontvangen van Easy Jet een lunch en een toegangskaart voor het programma Static Display, Farnborough Air show. De waarde is onbekend.",18-07-2018
"Ontvangen van Public Affairs bureau GKSV het lidmaatschap “Vriend van het Rijksmuseum” voor een jaar ter waarde van €50,-.",22-03-2018
"Ontvangen een vergoeding voor het dagvoorzitterschap Nationaal Toetscongres 2017 Bureau ICE ter waarde van €500,-. Het bedrag is direct gedoneerd door Bureau ICE aan landelijke oudervereniging voor ouders van kinderen met leer en",10-11-2017
ontwikkelingsproblematiek Balans.,
Ontvangen van College van B&W Eindhoven een kaart voor de voetbalwedstrijd PSV-Ajax. De waarde is onbekend.,23-04-2017
"Paulusma, W. (Wieke) - D66",
Geschenken,
Geschenk,Datum
"Ontvangen van de Provincie Drenthe 2 tickets voor de TT-Assen ter waarde van €175,-.",26-06-2022
"Peters, W.P.H.J. (René) - CDA",
Geschenken,
Geschenk,Datum
Ontvangen van de gemeente Breda toegangskaarten voor de voetbalwedstrijd NAC-PSV van donderdag 23 januari 2020. De waarde is onbekend.,14-01-2020
Ontvangen een toegangskaart van Rammstein van de gemeente Rotterdam. De waarde is onbekend.,25-06-2019
"Bijgewoond de voetbalwedstrijd PSV-Tottenham Hotspur, op uitnodiging van wethouder Yasin Torunoglu van Eindhoven. De waarde is onbekend.",24-10-2018
"Piri, K.P. (Kati) - GL-PvdA",
Geschenken,
Geschenk,Datum
"Ontvangen van de Taipei diplomatieke vertegenwoordiging in Nederland in het kader van een presentje voor de kerstdagen een fles Single Malt Whisky ter waarde van €49,99. Voor eigen gebruik gehouden.",17-01-2023
"Plas, C.A.M. (Caroline) van der - BBB",
Geschenken,
Geschenk,Datum
"Ontvangen van L. van Hees, Holwerd een handgemaakte sjaal, babydeken en een sieraad met een geschatte waarde van €100,-.",10-05-2023
"Ontvangen van Danielle van Herwijnen een leren tas ter waarde van €69,-.",30-03-2023
"Ontvangen een Boekenpakket SVDC advies in crisisbeheersing van van SVDC (Advies in crisisbeheersing) ter waarde van €65,12.",25-01-2023
"Ontvangen twee kaarten voor de show Paul de Leeuw '60? We zien wel' ter waarde van €53,-.",13-01-2023
"Ontvangen cadeaubonnen van Graan Cru Primeur- De Heikamp, Ruurlo. De waarde is €50,- en weggegeven aan burgers.",02-10-2021
"Ontvangen vispakket van Vishandel Klooster BV, Enkhuizen. De waarde is €100,-",18-06-2021
"Podt, A. (Anne-Marijke) - D66",
Geschenken,
Geschenk,Datum
Bijgewoond op uitnodiging van de IND (Immigratie en Naturalisatiedienst) de theatervoorstelling “Salomonsoordeel” met eten. De waarde is onbekend.,14-04-2022
Geschenk,Datum
"Ontvangen van Uitgeverij Noordhoff de 56e editie van De Grote Bosatlas ter waarde van €69,95.",06-04-2022
"Pouw-Verweij, N.J.F. (Nicki) - BBB",
Geschenken,
Geschenk,Datum
Geen,
"Raan, L. (Lammert) van - PvdD",
Geschenken,
Geschenk,Datum
"Ontvangen van de Diervriendelijke Parlementaire BBQ een vegan levensmiddelenpakket met een geschatte waarde van €50,-.",06-09-2022
"Ontvangen van Noordhoff Uitgever ""De Grote Bosatlas 56e editie"""" ter waarde van € 69,95.",29-03-2022
"Raemakers, R. (Rens) - D66",
Geschenken,
Geschenk,Datum
"Ontvangen van de KNVB 2 kaarten voor de damesvoetbal wedstrijd Nederland – Duitsland inclusief toegang tot het Huis van Oranje. De waarde is €100,-.",07-04-2023
Ontvangen van de Provincie Overijssel een uitnodiging voor een Wilddiner. De waarde is onbekend.,30-11-2022
"Ontvangen van Uitgeverij Noordhoff de 56e editie van De Grote Bosatlas ter waarde van €69,95.",06-04-2022
"Ontvangen van de Adviesraad Sociaal domein Leudal voor het houden van lezing een cadeaukaart van Podium ter waarde van €50,-.",07-10-2019
Ontvangen van Geelen B.V. te Neer een kaart voor de wedstrijd VVV Venlo – Ajax. De waarde is onbkend.,17-08-2019
"Ontvangen van de Gemeente Weert een VIP-accreditatie en een parkeerticket voor Bospop Weert, De waarde bedraagt €243,-.",13-07-2019
"Aanwezig geweest bij het Asperge diner te Nieuwspoort, uitgenodigd door College van Gedeputeerde Staten van Limburg. De waarde is onbekend.",18-05-2018
"Bijgewoond de finish van de Amstel Goldrace, aangeboden door de provincie Limburg ter waarde van €195,- per ticket.",15-04-2018
"Ontvangen van de Provincie Limburg een ticket voor Preuvenement Maastricht ter waarde van €35,-.",24-08-2017
"Ontvangen van de Gemeente Maastricht 2 kaarten voor een concert met een totale waarde van €186,80 en een walking diner voor twee personen in de hal van het stadhuis met een totale waarde van €100,-.",28-06-2017
"Rahimi, H. (Hawre) - VVD",
Geschenken,
Geschenk,Datum
Ontvangen het boek 'Worst bank scenario'. De waarde is onbekend.,14-03-2023
Ontvangen van Elsevier Weekblad het boek ‘Handboek minister’. De waarde is onbekend.,21-12-2022
Ontvangen van Noordhoff uitgevers de zesenvijftigste editie van de Grote Bosatlas. De waarde is onbekend.,05-04-2022
"Rajkowski, Q.M. (Queeny) - VVD",
Geschenken,
Geschenk,Datum
"Ontvangen van Thorbecke Academie NHL Stenden Hogeschool een pakket met o.a. thee, pepermunt, een pen, reismok en notitieboek. De waarde is onbekend.",16-05-2023
"Ontvangen van Existential Risk Observatory een bos bloemen en boekenbon. De waarde is circa €45,-.",13-04-2023
Ontvangen van Schuberg Philis een fles wijn en chocolaatjes. De waarde is onbekend.,30-03-2023
Ontvangen van de organisatie twee kaartjes voor 'Nacht van de militaire muziek 2' De waarde is onbekend.,18-03-2023
"Ontvangen van Elsevier Weekblad het boek ‘Handboek minister: de lang geheimgehouden instructies aan bewindslieden’, ook wel het 'blauwe boek' genoemd. De waarde is onbekend.",21-12-2022
Ontvangen van de van de KRO-NCRV een half jaarabonnement op Quest wegens deelname aan de Slimste mens. De waarde is onbekend.,01-12-2022
Deelgenomen aan het ECP Diner op uitnodiging van het ECP. De waarde is onbekend.,28-11-2022
Geschenk,Datum
Ontvangen van ESET haardhout. De waarde is onbekend.,24-11-2022
Ontvangen van Mars chocolaatjes. De waarde is onbekend.,11-11-2022
Ontvangen een uitnodiging voor het ECP Diner. De waarde is onbekend.,22-06-2022
"Ontvangen van Uitgeverij Noordhoff de Grote Bosatlas ter waarde van € 70,-.",06-04-2022
Ontvangen een uitnodiging voor het ECP Diner. De waarde is onbekend.,02-02-2022
"Ontvangen tijdens een bijeenkomst drie boeken (On Cyber; Jelle van Haaster, Cyber Warfare; Paul Ducheine en NL ARMS Netherlands Annual Review of Military Studies 2020; Frans Osinga) met een geschatte waarde van €100,-.",03-12-2021
"Ontvangen een vogelhuis ter waarde van circa €15,-.",17-03-2021
"Ontvangen een boeren welkomstpakket ter waarde van circa €20,-.",17-03-2021
"Richardson, S.M. (Simone) - VVD",
Geschenken,
Geschenk,Datum
Geen,
"Roon, R. (Raymond) de - PVV",
Geschenken,
Geschenk,Datum
"Ontvangen van uitgeverij Noordhoff de 56e editie van de Grote Bosatlas met een waarde van €70,-.",21-04-2022
