"Aartsen, A.A. (Thierry) - VVD",
Ontvangen een boek van Nolet Destilleerderij. De waarde is onbekend.,11-03-2022
Ontvangen kaarten voor een handbalwedstrijd. De waarde is onbekend.,05-03-2022
Ontvangen kaarten voor het Davis Cup Tennistoernooi. De waarde is onbekend.,04-03-2022
Ontvangen kaarten voor de voetbalwedstrijd AZ-Ajax. De waarde is onbekend.,03-03-2022
Ontvangen kaarten voor NK Indoor Atletiek. De waarde is onbekend.,27-02-2022
Ontvangen van Heroes Den Bosch kaarten voor het basketbalwedstrijd. De waarde is onbekend.,19-02-2022
Ontvangen kaarten voor de International Swimming League. De waarde is onbekend.,12-11-2021
Ontvangen kaarten voor het NK Afstanden Schaatsen in Thialf. De waarde is onbekend.,30-10-2021
Deelgenomen aan een lunch met Hague samen met twee medewerkers. De waarde is onbekend.,28-10-2021
Ontvangen van de KNVB kaarten voor de voetbalwedstrijd Nederland-Gibraltar. De waarde is onbekend.,11-10-2021
Ontvangen van het Nederlands Handbal Verbond kaarten voor het NK Handbal Nederland-Wit Rusland. De waarde is onbekend.,06-10-2021
Ontvangen van Tigsports een toegangskaart voor de Formule 1 Zandvoort. De waarde is onbekend.,05-09-2021
Ontvangen van Tigsports een toegangskaart voor de Formule 1 Zandvoort. De waarde is onbekend.,04-09-2021
Ontvangen van Tigsports een toegangskaart voor de Formule 1 Zandvoort. De waarde is onbekend.,02-09-2021
Ontvangen van Sportworx toegangskaarten voor King of the Court. De waarde is onbekend.,28-08-2021
Ontvangen van Sportworx toegangskaarten voor King of the Court. De waarde is onbekend.,26-08-2021
Ontvangen van UCI BMX World Championships 2021 een toegangskaart voor het WK BMX. De waarde is onbekend.,22-08-2021
Ontvangen van Tigsports toegang tot het Olympic Festival (vanaf 23-07-2021 t/m 8-8-2021). De waarde is onbekend.,23-07-2021
Ontvangen van het Nederlands Handbal verbond toegangskaarten Handbal. De waarde is onbekend.,04-07-2021
Ontvangen van de KNGU een toegangsticket voor het OKT turnen. De waarde is onbekend.,26-06-2021
Ontvangen van Sportworx een toegangsticket voor het OKT beachvolleybal. De waarde is onbekend.,23-06-2021
Ontvangen van de KNVB een uitnodiging voor de voetbalwedstrijd Nederland-Oostenrijk. De waarde is onbekend.,17-06-2021
"Ontvangen van hoogbegaafdheid SWV Midden Holland en SWV Aan den IJssel een boekenbon ter waarde van €50,-.",27-05-2021
Ontvangen van de Nederlandse Basketball Bond een toegangskaart voor Basketbal NL. De waarde is onbekend.,24-02-2020
Ontvangen van de Atletiekunie een toegangskaart Indoor Atletiek. De waarde is onbekend.,22-02-2020
Ontvangen van de KNSB een toegangskaart voor Shorttrack Dordrecht. De waarde is onbekend.,16-02-2020
Ontvangen van Donar een toegangskaart Basketbal. De waarde is onbekend.,15-02-2020
Ontvangen van Topsport community een ticket voor Topsportcommunity Live. De waarde is onbekend.,10-02-2020
Ontvangen van de Gemeente Amsterdam een toegangskaart voor Jumping Amsterdam. De waarde is onbekend.,24-01-2020
Ontvangen van de Nevobo een toegangskaart voor het OKT Volleybal dames. De waarde is onbekend.,12-01-2020
Ontvangen van de Nevobo een toegangskaart voor het OKT Volleybal dames. De waarde is onbekend.,11-01-2020
Ontvangen van de KNSB een toegangskaart voor het EK Schaatsen. De waarde is onbekend.,11-01-2020
Ontvangen van de Nevobo een toegangskaart voor het OKT Volleybal dames. De waarde is onbekend.,10-01-2020
"Ontvangen van de Nevobo een schilderij ter waarde van €750,- in bruikleen.",09-01-2020
Ontvangen van de Nevobo een toegangskaart voor het OKT Volleybal dames. De waarde is onbekend.,09-01-2020
Ontvangen van de Nevobo een toegangskaart voor het OKT Volleybal dames. De waarde is onbekend.,08-01-2020
Ontvangen van de KNSB een toegangskaart voor het NK Shorttrack. De waarde is onbekend.,04-01-2020
Ontvangen van de KNSB toegangskaarten voor het NK Schaatsen. De waarde is onbekend.,29-12-2019
Ontvangen van de KNSB toegangskaarten voor het NK Schaatsen. De waarde is onbekend.,27-12-2019
Ontvangen van de NOS en NOC*NSF een uitnodiging voor het Sportgala. De waarde is onbekend.,18-12-2019
Ontvangen van het Bestuur van AZ een toegangskaart voor de voetbalwedstrijd AZ-Ajax. De waarde is onbekend.,15-12-2019
Geschenk,Datum
Ontvangen van de KNZB een toegangskaart voor de SwimCup Amsterdam. De waarde is onbekend.,13-12-2019
"Ontvangen van Erasmus+ het boek ""Grote verwachtingen"" van Geert Mak ter waarde van €29,99.",28-11-2019
Ontvangen van de KNVB toegangskaarten voor de voetbalwedstrijd Nederland-Estland. De waarde is onbekend.,19-11-2019
Ontvangen van de Nederlandse Boksbond een uitnodiging voor het Boksgala. De waarde is onbekend.,17-11-2019
Ontvangen van de Gemeente Den Haag een uitnodiging voor de Krajicek Foundation Gala. De waarde is onbekend.,15-11-2019
Ontvangen van de KNZB een diner en een toegangskaart voor de heren waterpolowedstrijd. De waarde is onbekend.,12-11-2019
Ontvangen van de NKVB een toegangskaart voor het NK Lead. De waarde is onbekend.,09-11-2019
Ontvangen van ViaCommunio een mand met lekkernij. De waarde is onbekend.,04-11-2019
Ontvangen van Alkmaar Sport toegangskaarten voor de Wieler driedaags Alkmaar. De waarde is onbekend.,02-11-2019
Bijgewoond op uitnodiging van TripleDouble het benefitdiner voor de Gehandicaptensport. De waarde is onbekend.,29-10-2019
Ontvangen van de Provincie Noord-Holland toegangskaarten voor het Provincieconcert. De waarde is onbekend.,11-10-2019
Ontvangen van de KNVB een toegangskaart voor de wedstrijd Nederland - Noord-Ierland. De waarde is onbekend.,10-10-2019
Ontvangen van het Nederlands Handbal Verbond een toegangskaart voor de wedstrijd Nederland-Oostenrijk. De waarde is onbekend.,26-09-2019
"Ontvangen van Talentissimo het boek ""Hoogbegaafdheid"". De waarde is onbekend.",25-09-2019
Bijgewoond op uitnodiging van TIG Sports de KLM Open. De waarde is onbekend.,15-09-2019
Bijgewoond op uitnodiging van Nevobo het EK Volleybal. De waarde is onbekend.,13-09-2019
Ontvangen van de KNGU een toegangskaart voor het Vijflandentoernooi turnen. De waarde is onbekend.,07-09-2019
Ontvangen van het Yvonne van Gennip Talentfonds een uitnodiging voor het Feest voor Talent. De waarde is onbekend.,05-09-2019
Ontvangen van Nevobo een toegangskaart voor het OKT volleybal. De waarde is onbekend.,11-08-2019
Ontvangen van de Gemeente Alkmaar toegangskaarten voor het EK Wielrennen Alkmaar. De waarde is onbekend.,10-08-2019
Bijgewoond op uitnodiging van Jumbo-Visma de Tour de France. De waarde is onbekend.,10-07-2019
Bijgewoond op uitnodiging van Jumbo-Visma de Tour de France. De waarde is onbekend.,09-07-2019
Ontvangen van NBB een toegangskaart voor EK rolstoelbasketbal vrouwen. De waarde is onbekend.,01-07-2019
Ontvangen van de KNLTB toegangskaarten voor de Libema Open. De waarde is onbekend.,14-06-2019
Ontvangen van de Gouden Spike toegangskaarten voor de 48ste Gouden Spike. De waarde is onbekend.,08-06-2019
Ontvangen van de Nederlandse Boksbond een toegangskaart voor de Youfone Boksgala. De waarde is onbekend.,07-06-2019
Ontvangen van KNVB een toegangskaart voor de voetbalwedstrijd Nederland-Australië (vrouwen). De waarde is onbekend.,01-06-2019
Ontvangen van Nevobo toegangskaarten voor een volleybalwedstrijd. De waarde is onbekend.,30-05-2019
Ontvangen van Nevobo toegangskaarten voor een volleybalwedstrijd. De waarde is onbekend.,28-05-2019
Ontvangen van de KNLTB een toegangskaart voor Roland Garros. De waarde is onbekend.,26-05-2019
Ontvangen van Circuit Zandvoort een toegangskaart voor de Max Verstappen Racedagen. De waarde is onbekend.,19-05-2019
Ontvangen van BMX Papendal een toegangskaart voor de UCI BMX Supercross World Cup. De waarde is onbekend.,12-05-2019
Ontvangen van de Nederlandse Loterij een uitnodiging voor de afdrachtsgala van de Nederlandse Loterij. De waarde is onbekend.,09-05-2019
Ontvangen van Triple Double een toegangskaart voor een basketbalwedstrijd van New Heroes. De waarde is onbekend.,30-04-2019
Ontvangen van Hofstaten een uitnodiging voor het Aspergediner Nieuwspoort. De waarde is onbekend.,17-04-2019
Ontvangen van KNKV een toegangskaart voor de World Korfbal leaguefinale. De waarde is onbekend.,13-04-2019
Ontvangen van KNVB een toegangskaart voor de voetbalwedstrijd Nederland-Chili (vrouwen). De waarde is onbekend.,09-04-2019
Ontvangen van PO-raad en VO-raad een uitnodiging voor de Diner Pensant. De waarde is onbekend.,08-04-2019
Ontvangen van KNVB een toegangskaart voor de voetbalwedstrijd Nederland-Mexico (vrouwen). De waarde is onbekend.,05-04-2019
Ontvangen van Fonds Gehandicaptensport een toegangskaart voor de Premier League of Darts in Rotterdam. De waarde is onbekend.,28-03-2019
Ontvangen van KNVB een toegangskaart voor de voetbalwedstrijd Nederland-Duitsland. De waarde is onbekend.,24-03-2019
Ontvangen van KNVB een toegangskaart voor de voetbalwedstrijd Nederland-Wit-Rusland. De waarde is onbekend.,21-03-2019
Ontvangen van Taekwondo Bond Nederland een toegangskaart voor Dutch Open Taekwondo Championships. De waarde is onbekend.,10-03-2019
Ontvangen van Rugby Nederland toegangskaarten voor Rugby Heren. De waarde is onbekend.,09-03-2019
Ontvangen van KNSB toegangskaarten voor ISU WK Sprint. De waarde is onbekend.,24-02-2019
Ontvangen van KNSB toegangskaarten voor ISU WK Sprint. De waarde is onbekend.,23-02-2019
Geschenk,Datum
Ontvangen van KNZB toegangskaarten voor de waterpolowedstrijd Nederland-Griekenland. De waarde is onbekend.,19-02-2019
"Ontvangen van KNLTB toegangskaarten voor het ABN AMRO Tennistoernooi, inclusief lunch. De waarde is onbekend.",15-02-2019
"Ontvangen van gemeente Amsterdam, Provincie Noord-Holland en Jumping Amsterdam twee uitnodigingen voor Jumping Amsterdam in Business. De waarde is onbekend.",25-01-2019
Ontvangen een uitnodiging van de Boksbond voor het NK Boksen in Rotterdam. De waarde is onbekend.,20-01-2019
Ontvangen van de leerlingen van basisschool De Driemaster in Alkmaar het boek ‘Het verhaal van de Oorsprong’ van Kees Wagemaker. De waarde is onbekend.,18-01-2019
Ontvangen twee uitnodigingen van de KNSB voor het EK Shorttrack Dordrecht. De waarde is onbekend.,13-01-2019
Ontvangen een uitnodiging van Den Haag Topsport voor het DELA Beach Open. De waarde is onbekend.,06-01-2019
Ontvangen een uitnodiging van Den Haag Topsport voor het DELA Beach Open. De waarde is onbekend.,04-01-2019
Ontvangen een uitnodiging van KNGU voor het ‘A Touch of Gold’ Turngala. De waarde is onbekend.,29-12-2018
Ontvangen een uitnodiging van de NOS en NOC*NSF voor het NOC*NSF Sportgala 2018. De waarde is onbekend.,19-12-2018
Ontvangen een uitnodiging van TV Triffis Alkmaar voor de NK Trampolinespringen teams 2018. De waarde is onbekend.,08-12-2018
Ontvangen een uitnodiging van de Vereniging Ons Middelbaar Onderwijs voor het Diner Pensant. De waarde is onbekend.,20-11-2018
Ontvangen een uitnodiging van de Boksbond voor de World Port Boxing. De waarde is onbekend.,18-11-2018
Ontvangen een uitnodiging van de Judobond voor de Grand Prix Judo. De waarde is onbekend.,17-11-2018
Ontvangen twee uitnodigingen van de KNVB voor de voetbalwedstrijd Nederland-Frankrijk. De waarde is onbekend.,16-11-2018
Ontvangen een uitnodiging van de Koninklijke Nederlandse Jagersvereniging voor het wilddiner in Nieuwspoort. De waarde is onbekend.,14-11-2018
Ontvangen van de KNVB een uitnodiging voor de voetbalwedstrijd Nederland-Zwitserland (vrouwen). De waarde is onbekend.,09-11-2018
Ontvangen van de Vechtsportautoriteit een toegangskaart voor Glory 59 Amsterdam. De waarde is onbekend.,29-09-2018
Ontvangen van BrabantSport een toegangskaart voor FINA Swimming Worldcup. De waarde is onbekend.,28-09-2018
Ontvangen van het Nederlands Handbal Verbond een toegangskaart voor de handbalwedstrijd Japan-Nederland. De waarde is onbekend.,27-09-2018
Ontvangen van Provincie Gelderland een uitnodiging voor het Prinsjesprijsdiner. De waarde is onbekend.,13-09-2018
Ontvangen van de KNVB toegangskaarten voor de voetbalwedstrijd Nederland-Peru. De waarde is onbekend.,06-09-2018
Ontvangen van de Postcode Loterij een uitnodiging voor Voetballer van het Jaar Gala. De waarde is onbekend.,03-09-2018
Ontvangen van Golazo Sports twee toegangskaarten voor de Binckbank Tour. De waarde is onbekend.,14-08-2018
Ontvangen van de Koninklijke Nederlandse Biljartbond een toegangskaart voor het EK Poolbiljart. De waarde is onbekend.,31-07-2018
Ontvangen van de KNVB een toegangskaart voor het EK CP voetbal. De waarde is onbekend.,25-07-2018
Ontvangen van Nevobo twee toegangskaarten voor het EK Beachvolleybal. De waarde is onbekend.,22-07-2018
Ontvangen van Tig Sports twee toegangskaarten voor het EK Beachvolleybal. De waarde is onbekend.,20-07-2018
Ontvangen van de Koninklijke Nederlandse Gymnastiek Unie een toegangskaart voor Interland Turnen. De waarde is onbekend.,07-07-2018
Ontvangen van de NKBV een toegangskaart voor het NK Boulder. De waarde is onbekend.,07-07-2018
Ontvangen van KNHB een toegangskaart voor de Rabobank Hockey Champions Trophy. De waarde is onbekend.,30-06-2018
Ontvangen van NOC*NSF een toegangskaart voor de Volvo Ocean Race. De waarde is onbekend.,29-06-2018
Ontvangen van KNLTB toegangskaarten voor Libema Open. De waarde is onbekend.,15-06-2018
Ontvangen van Nevobo een toegangskaart voor de volleybalwedstrijd Nederland-Brazilië. De waarde is onbekend.,31-05-2018
Ontvangen van Circuit Zandvoort een toegangskaart voor de Max Verstappen Racedagen. De waarde is onbekend.,21-05-2018
Ontvangen van Nevobo een toegangskaart voor de volleybalwedstrijd Nederland-Japan. De waarde is onbekend.,17-05-2018
Ontvangen een uitnodiging van BMX Papendal voor de BMX WorldCup. De waarde is onbekend.,05-05-2018
Ontvangen een uitnodiging van de KNVB voor de bekerfinale AZ-Feyenoord. De waarde is onbekend.,22-04-2018
Ontvangen een uitnodiging van Fonds Gehandicaptensport voor de Premier League Darts 2018. De waarde is onbekend.,19-04-2018
"Ontvangen een uitnodiging van de Provincie Limburg voor de Amstel Gold Race ter waarde van €195,-.",15-04-2018
Ontvangen een uitnodiging van het KNKV voor de Korfbal Leaguefinale 2018. De waarde is onbekend.,07-04-2018
Ontvangen een uitnodiging van de KNVB voor de dames voetbalwedstrijd Nederland-Noord-Ierland. De waarde is onbekend.,06-04-2018
Ontvangen een uitnodiging van het NHV voor de handbal interland Nederland-Hongarije. De waarde is onbekend.,25-03-2018
Ontvangen een uitnodiging van de KNVB voor de voetbalwedstrijd Nederland-Engeland. De waarde is onbekend.,23-03-2018
Ontvangen een uitnodiging van de Stichting Dutch Trampoline Open voor de Dutch Trampoline Open. De waarde is onbekend.,18-03-2018
Ontvangen een uitnodiging van de Stichting Topsport Community voor het Topsport Community diner. De waarde is onbekend.,12-03-2018
Geschenk,Datum
Ontvangen een uitnodiging van de KNSB voor het WK Schaatsen. De waarde is onbekend.,10-03-2018
Ontvangen van AZ een toegangskaart voor de halve bekerfinale AZ-Twente. De waarde is onbekend.,28-02-2018
Ontvangen van de Nederlandse Tafeltennisbond een toegangskaart voor tafeltennis damesinterland. De waarde is onbekend.,27-02-2018
Ontvangen van NOC*NSF een toegangskaart Thuiskomst TeamNL. De waarde is onbekend.,26-02-2018
"Ontvangen van Guido de Wit advocaten het boek ‘De opleiding tot redenaar’ van Marcus Fabius Quintilianus ter waarde van €49,95.",22-02-2018
Ontvangen van Vriendenloterij een toegangskaart voor het Goed Geld Gala. De waarde is onbekend.,19-02-2018
Ontvangen van KNLTB twee toegangskaarten voor het ABN AMRO World Tennis Tournament. De waarde is onbekend.,17-02-2018
Ontvangen van gemeente Rotterdam een toegangskaart voor het ABN AMRO World Tennis Tournament. De waarde is onbekend.,16-02-2018
Ontvangen van Topsport Community een toegangskaart voorbeschouwing Olympische Spelen. De waarde is onbekend.,09-02-2018
Ontvangen van NOC*NSF & NTTB een Ipongtafel voor de VVD. De waarde is onbekend. Aan de VVD geschonken.,31-01-2018
Ontvangen van het Yvonne van Gennip Talent Fonds 1 vrijkaart voor Jumping Amsterdam. De waarde is onbekend.,27-01-2018
Ontvangen van Jumping Amsterdam 2 vrijkaarten voor Jumping Amsterdam. De waarde is onbekend.,26-01-2018
Ontvangen van NEVOBO 2 vrijkaarten voor Dela Beach open. De waarde is onbekend.,06-01-2018
Ontvangen van NEVOBO 1 vrijkaart voor Dela Beach open. De waarde is onbekend.,05-01-2018
Ontvangen van TIG Sports 2 vrijkaarten voor Dela Beach open. De waarde is onbekend.,04-01-2018
Ontvangen van KNSB twee toegangskaarten voor OKT Schaatsen. De waarde is onbekend.,30-12-2017
Ontvangen van KNGU twee toegangskaarten voor het ‘A Touch of Gold’ Turngala. De waarde is onbekend.,29-12-2017
Ontvangen van NOS en NOC*NSF een toegangskaart voor het NOC*NSF Sportgala. De waarde is onbekend.,19-12-2017
Ontvangen van de KNLTB twee toegangskaarten voor het NK Tennis. De waarde is onbekend.,17-12-2017
Ontvangen van gemeente Alkmaar twee toegangskaarten voor de Alkmaar sportgala. De waarde is onbekend.,15-12-2017
Ontvangen van Kindred Group een tafelplaats bij de Nationaal Gala Fonds Gehandicaptensport. De waarde is onbekend.,28-11-2017
Ontvangen van NHV een toegangskaart voor de interland Nederland-Italië (handbal). De waarde is onbekend.,23-11-2017
Ontvangen van Judobond Nederland een toegangskaart voor de World Grand Prix Judo. De waarde is onbekend.,19-11-2017
Ontvangen van Judobond Nederland twee toegangskaarten voor de World Grand Prix Judo. De waarde is onbekend.,17-11-2017
Ontvangen van de voorzitter van de Internationale Judo Federatie IJF een stropdas. De waarde is onbekend.,17-11-2017
Ontvangen van KNSB een toegangskaart voor de Worldcup Schaatsen. De waarde is onbekend.,12-11-2017
Ontvangen van de KNZB één kaart voor de waterpolowedstrijd Nederland-Kroatië. De waarde is onbekend.,10-01-2017
Ontvangen van de KNSB één kaart voor het EK schaatsen. De waarde is onbekend.,08-01-2017
Ontvangen van de KNLTB twee kaarten voor het NK tennis. De waarde is onbekend.,18-12-2016
Ontvangen van AZ twee kaarten voor de voetbalwedstrijd AZ-Feyenoord. De waarde is onbekend.,11-12-2016
Ontvangen van de KNGU één kaart voor het NK trampolinespringen. De waarde is onbekend.,10-12-2016
Ontvangen van de NKBV één kaart voor het NK Lead. De waarde is onbekend.,10-12-2016
Ontvangen van de Watersportverbond één kaart voor de Zeiler van het Jaargala. De waarde is onbekend.,17-11-2016
Ontvangen van de gemeente Apeldoorn twee kaarten voor de wereldbekerwedstrijden baanwielrennen. De waarde is onbekend.,13-11-2016
Ontvangen van Myrthe Schoot één kaart voor de volleybal wedstrijd Aachen-Dresden. De waarde is onbekend.,12-11-2016
Ontvangen van de Korfbalverbond twee kaarten voor het EK korfbal. De waarde is onbekend.,30-10-2016
Ontvangen van de KNLTB één kaart voor het film festival. De waarde is onbekend.,13-10-2016
Ontvangen van het Nederlandse Handbalverbond drie kaarten voor het Handbalvierlandentoernooi. De waarde is onbekend. 06-10-2016,06-10-2016
Ontvangen van TIG Sports één kaart voor de KLM Open. De waarde is onbekend. 08-09-2016,08-09-2016
Ontvangen van TIG Sports één kaart voor de Olympic Experience. De waarde is onbekend.,05-08-2016
Ontvangen van de NeVoBo twee kaarten voor de Nederland uitzwaaiwedstrijd. De waarde is onbekend. 26-07-2016,26-07-2016
"Ontvangen van het Handbal verbond twee kaarten voor Nederland-Montenegro ter waarde van €17,50 euro per kaart.",21-07-2016
"Ontvangen van TIG Sports, twee kaarten voor het EK atletiek. De waarde is onbekend.",10-07-2016
"Ontvangen van TIG Sports, drie kaarten voor het EK atletiek. De waarde is onbekend.",09-07-2016
"Ontvangen van NOC NSF, vier kaarten voor het EK atletiek. De waarde is onbekend.",08-07-2016
"Ontvangen van Ondernemend Alkmaar, twee kaarten voor het Gala Ondernemend Alkmaar. De waarde is onbekend.",04-07-2016
Geschenk,Datum
"Ontvangen van de KNMV, een kaart voor de TT in Assen. De waarde is onbekend.",26-06-2016
"Ontvangen van het Zandvoort circuit, een entree voor de Max Verstappen familie dagen. De waarde is onbekend.",05-06-2016
"Ontvangen van het Wildlands Adventurepark, drie keer een entree ter waarde van €30,- per stuk.",30-05-2016
"Ontvangen van de KVLO, VVV bonnen ter waarde van €50,- en een fruitschaal waarvan de waarde onbekend is.",20-05-2016
"Ontvangen van de Professional Darts Cooperation, twee kaarten voor de Premier League Darts in Ahoy. De waarde is onbekend.",12-05-2016
"Ontvangen van de NKBV, twee kaartjes voor het NK Boulder. De waarde is onbekend.",30-04-2016
"Ontvangen van de Korfbalverbond, een kaart voor de NK finale. De waarde is onbekend.",16-04-2016
"Ontvangen van de KNZB, twee kaarten voor de Swimcup in Eindhoven. De waarde is onbekend.",08-04-2016
"Ontvangen van Marjolein Bolhuis, directeur van de Stichting Spieren voor Spieren, een kaart voor het Spieren voor Spieren Gala. De waarde is onbekend.",02-04-2016
"Ontvangen van de NTTB twee kaarten voor het NK Tafeltennis ter waarde van ongeveer €20,-.",20-03-2016
"Ontvangen van de Taekwondo Bond twee kaarten voor het Dutch Open Taekwondo Championships ter waarde van €15,-.",13-03-2016
Ontvangen van de Nederlands Handbal Verbond een kaart voor Nederland-Spanje. De waarde is onbekend.,08-03-2016
Ontvangen van de organisatoren van de Jongeren Lezing Alkmaar twee VIP kaartjes voor het Alkmaar Culinair Plaza. De waarde is onbekend.,07-03-2016
"Ontvangen van de KNVB een kaart voor Nederland-Noorwegen ter waarde van ongeveer €30,-.",05-03-2016
Ontvangen van de KNVB een kaart voor Feyenoord-AZ. De waarde is onbekend.,03-03-2016
"Ontvangen van de KNVB drie kaarten voor Zwitserland-Nederland ter waarde van ongeveer €30,-.",02-03-2016
Ontvangen van de Atletiek Unie twee kaarten voor het AA Drink NK indoor. De waarde is onbekend.,27-02-2016
"Ontvangen van het Willem Bleau een fles wijn ter waarde van €10,-.",25-02-2016
"Ontvangen van de organisatie Streetfishing een vispakket (boeken en een vispas) ter waarde van ongeveer €50,-.",21-02-2016
"Ontvangen van Jong Management Nederland een fles wijn ter waarde van ongeveer €30,-.",16-02-2016
Ontvangen van KNSB een kaart voor de Worldcup shorttrack. De waarde is onbekend.,12-02-2016
"Ontvangen van Stichting Leeuw Anna Paulowna een entreekaart ter waarde van €10,-.",08-02-2016
"Ontvangen van de organisatoren van het politieke café in Schagen en Hollands Kroon een fles wijn ter waarde van ongeveer €10,-.",10-01-2016
"Ontvangen van KNSB een kaart voor het KPN NK schaatsen ter waarde van €25,-.",27-12-2015
"Ontvangen van de KNZB een kaart voor de Swimcup ter waarde van €8,-.",12-12-2015
"Ontvangen van de organisatoren van het politieke café in Zoetermeer twee flesjes bier ter waarde van ongeveer €10,-.",09-12-2015
"Ontvangen van de organisatoren van het politieke café in Haarlem een fles wijn ter waarde van ongeveer €10,-.",30-11-2015
"Ontvangen van de KNBV een kaart voor het NK Lead. De waarde is €15,-.",28-11-2015
"Ontvangen van de organisatoren van Dutch Design Week diverse cadeaus ter waarde van €40,-.",19-10-2015
Ontvangen van NeVoBo een kaart voor het EK volleybal. De waarde is onbekend.,03-10-2015
Ontvangen van de Stichting Olympisch Stadion een kaart voor de Flame Games. De waarde is onbekend.,29-09-2015
Ontvangen van NeVoBo een kaart voor het EK volleybal. De waarde is onbekend.,27-09-2015
"Ontvangen van de organisatoren van het politieke café in Purmerend een fles wijn ter waarde van ongeveer €10,-.",23-09-2015
"Ontvangen van de organisatoren van de opening van het congres Sportpsychologie diverse cadeaus ter waarde van ongeveer €50,-.",13-09-2015
"Ontvangen van de organisatoren van het ondernemersdiner in Amstelveen chocolade bonbons ter waarde van €20,-.",01-09-2015
"Ontvangen van de organisatoren van het politieke café in Sydney, Australia een fles wijn ter waarde van ongeveer €10,-.",27-07-2015
Ontvangen van de KNHB twee kaarten voor het WK hockey. De waarde is onbekend. Een kaart aan een derde geschonken.,07-07-2015
Ontvangen van NOC*NSF een kaart voor WK beachvolleybal. De waarde is onbekend.,29-06-2015
"Ontvangen van de organisatoren van het politieke café in Limburg een fles wijn ter waarde van ongeveer €10,-.",06-05-2015
"Ontvangen van de organisatoren van het politieke café in Brabant een fles wijn ter waarde van ongeveer €10,-.",17-04-2015
"Ontvangen van de organisatoren van het politieke café in Hoorn een fles wijn ter waarde van ongeveer €10,-.",16-04-2015
"Ontvangen van de organisatoren van het politieke café in Overijssel een fles wijn ter waarde van ongeveer €10,-.",06-03-2015
Ontvangen van KNSB een kaart voor WK schaatsen. De waarde is onbekend.,13-02-2015
"Ontvangen van de organisatoren van het politieke café in Rotterdam een fles wijn ter waarde van ongeveer €15,-.",09-02-2015
"Ontvangen van het wintercircus Sijm Heiloo een entreekaart ter waarde van €10,-.",23-12-2014
"Ontvangen van de organisatoren van het politieke café in Stompetoren een fles wijn ter waarde van ongeveer €10,-.",24-10-2014
Geschenk,Datum
"Ontvangen van de Efteling een entreekaart ter waarde van €34,-.",17-10-2014
"Ontvangen van de organisatoren van het politieke café in Alkmaar een fles wijn ter waarde van ongeveer €15,-.",15-10-2014
"Ontvangen van de organisatoren van het politieke café in Alkmaar een kaasberrie ter waarde van €15,-.",10-10-2014
Ontvangen van de vereniging Triffis een entreekaart voor het trampolinespring evenement. De waarde is onbekend.,20-09-2014
Ontvangen van Hoge Veluwe een entreekaart voor de Hoge Veluwe Natura 2000. De waarde is onbekend.,19-09-2014
Ontvangen van NOC*NSF een kaartje voor het WK roeien. De waarde is onbekend.,28-08-2014
"Ontvangen van Diergaarde Blijdorp een entreekaart voor Diergaarde Blijdorp ter waarde van €20,-.",22-08-2014
