"Aartsen, A.A. (Thierry) - VVD",
Ontvangen van Heracles Almelo een voetbalshirt van voetbalclub Heracles met daarop het nummer 39. De waarde is onbekend.,06-10-2023
Ontvangen van FruitDelta Rivierenland een fruitboompje. De waarde is onbekend.,02-10-2023
"Bikker, M.H. (Mirjam) - CU",
Geschenken,
Geschenk,Datum
"Ontvangen van de Stichting Synthesis het boek ‘Politieke polarisatie in Nederland’ ter waarde van € 19,90.",29-06-2023
Ontvangen een mand streekproducten van de ChristenUnie Oldebroek. De waarde is onbekend.,16-06-2023
Ontvangen van The Dutch Group of Friends of a Free Iran het boek ‘Dictatorship & Revolution – Iran a contemporary history’. De waarde is onbekend. (,30-05-2023
"Ontvangen van De Gezonde Generatie het boek ‘Gelijk goed beginnen – succesvol bouwen aan de basis voor gezonde generaties’ ter waarde van € 31,50.",23-05-2023
"Ontvangen van De Gezonde Generatie het boek ‘De eerste 1000 dagen – het fundamentele belang van een goed begin vanuit biologisch, medisch en maatschappelijk perspectief’ ter waarde van € 29,95.",23-05-2023
Ontvangen van de KNVB een goodiebag. De waarde is onbekend.,17-01-2023
"Ontvangen van Thialf het boek ‘Langebaan, Het Nederlandse schaatsen in 75 legendarische ritten’ ter waarde van ongeveer €45,-.",22-11-2022
Ontvangen van Uitgeverij Noordhoff een Grote Bosatlas. De waarde is onbekend.,07-04-2022
"Bisschop, R. (Roelof) - SGP",
Geschenken,
Geschenk,Datum
"Ontvangen van uitgeverij Noordhoff de 56e editie van de Grote Bosatlas ter waarde van €70,-.",01-04-2022
"Ontvangen voor het houden van een lezing SSNR in Veenendaal €100,-.",28-09-2019
"Ontvangen voor het houden van een lezing SSNR op Driestar College Gouda €120,-.",12-01-2019
"Ontvangen twee toegangskaarten t.b.v. Weihnachtsoratorium Nederlands Kamerkoor in Naarden ter waarde van €65,- per kaart.",21-12-2018
"Ontvangen voor het houden van een lezing voor Calvijnschool, Ederveen (ouderavond) €200,-.",16-04-2018
"Ontvangen voor het houden van een lezing voor COGG een boek ter waarde van ca. €80,-.",29-03-2017
"Ontvangen voor het houden van een lezing bij Van Lodensteincollege €90,-.",23-02-2017
"Ontvangen in het kader van Valentijn een stofzuiger ter waarde van €205,- van Klop Innovations. De stofzuiger wordt geveild voor het goede doel.",14-02-2017
"Ontvangen voor het houden van een lezing bij Jeugdvereniging GGiN Barneveld €100,-.",28-01-2017
"Ontvangen voor het houden van lezingen voor Stichting Studie Nadere Reformatie €250,-.",21-01-2017
"Ontvangen voor het houden van een lezing bij Driestar Educatief €200,-.",21-10-2016
"Ontvangen voor het houden van een lezing bij de Inspectiekring in Utrecht €75,-.",23-11-2015
"Ontvangen voor het houden van een lezing voor Stichting Studie Nadere Reformatie €100,-.",26-09-2015
"Ontvangen voor het verzorgen van een lezing tijdens de jaaropening Eben Haëzerschool te Drachten €200,-.",19-08-2015
"Ontvangen voor het verzorgen van een lezing voor Vereniging voor het verstrekken van basisonderwijs op gereformeerde grondslag te Ermelo €125,-",29-06-2015
"Ontvangen voor het verzorgen van een lezing voor een conferentie Reformatorisch Samenwerkingsverband Voortgezet Onderwijs, Hoornbeeck, Samenwerking Christelijke Jeugdzorg e.a., Amersfoort €200,-.",13-02-2015
"Ontvangen voor het houden van een spreekbeurt voor de SGP in Ridderkerk €150,-",06-10-2014
"Ontvangen voor het houden van een lezing bij de Jaarvergadering Van Lodensteincollege, Amersfoort €100,-.",10-06-2014
"Ontvangen voor het houden van een lezing tijdens de studiedag Antisemitisme GG €100,-.",30-05-2014
"Ontvangen voor het houden van een lezing bij de Jaarvergadering Jhr. W. Versluijsschool, Aagtekerke €225,- (incl. reis- en verblijfskosten)",14-04-2014
"Ontvangen voor het houden van een spreekbeurt voor de SGP Kampen €100,-",03-03-2014
"Ontvangen voor het houden van een spreekbeurt voor de SGP Apeldoorn €100,-.",25-02-2014
"Ontvangen voor het houden van een spreekbeurt voor de SGP Twenterand €160,-.",21-02-2014
"Ontvangen voor het houden van een spreekbeurt voor de SGP Geldermalsen € 100,-.",10-02-2014
Geschenk Datum
"Ontvangen voor het houden van een spreekbeurt voor de Jeugdvereniging OGG Loenen € 100,-. 08-02-2014"
"Ontvangen voor deelname aan een debat op het Van Lodensteincollege te Amersfoort € 100,-. 06-02-2014"
"Ontvangen voor het houden van een lezing bij Jeugdvereniging Gereformeerde Gemeente in Nederland te Opheusden € 150,- 18-01-2014"
"Ontvangen voor het houden van een spreekbeurt voor de SGP Scherpenzeel € 90,- 13-12-2013"
"Ontvangen voor het houden van een spreekbeurt op de Bezinningsavonden Zeeland te Goes € 140,- 06-04-2013"
"Ontvangen voor het houden van een spreekbeurt bij SGP Breukelen € 100,-. 18-02-2013"
"Ontvangen voor het houden van een spreekbeurt bij SGP Nederbetuwe € 100,-. 08-02-2013"
"Ontvangen voor het houden van een spreekbeurt bij de Kiesvereniging SGP te Ederveen € 85,-. 21-01-2013"
"Ontvangen voor het houden van een spreekbeurt te Lunteren € 140,-. 14-01-2013"
"Ontvangen voor het houden van een spreekbeurt te Echteld € 50,-. 11-01-2013"
"Ontvangen voor het houden van twee lezingen op 10 en 24 november 2012 voor Stichting Studie der Nadere Reformatie, Gouda € 95,- (na aftrek van reiskosten). 10-12-2012"
"Ontvangen voor het houden van een spreekbeurt voor de SGP te Borsele € 125,- (na aftrek van reiskosten). 07-12-2012"
"Bontenbal, H. (Henri) - CDA"
Geschenken
Geschenk Datum
"Ontvangen van Mc Energy uit Ridderkerk 2 flessen gin merk Verdarano ter waarde van €26,95 per stuk. De totale waarde bedraagt 53,90 euro. 18-06-2021"
"Bosma, M. (Martin) - PVV"
Geschenken
Geschenk Datum
"Ontvangen van Kees Verhoeven het boek “De democratie crasht” ter waarde van €22,99. 04-07-2023"
"Ontvangen van Boom uitgevers Amsterdam drie boeken: Montesquieu, over de geest van de wetten (waarde €64,50); Mill over de vrijheid (waarde €18,50) en Pascal Bruckner, Tirannie van het berouw (€23,90), Totale waarde €106,90. 30-09-2008"
"Boswijk, D.G. (Derk) - CDA"
Geschenken
Geschenk Datum
"Ontvangen een boekenbon als dank voor zijn optreden in de Singelkerk op verzoek van de Doopsgezinde kerk in Amsterdam ter waarde van €50,-. 08-05-2023"
"Bouchallikh, K. (Kauthar) - GL-PvdA"
Geschenken
Geschenk Datum
"Ontvangen van W. Green Team een tas ""Freitag F553 LOU"" ter waarde van € 160,-. 11-08-2023"
"Ontvangen van Mounir Toub een pakket met een totaalwaarde van ca. € 107,50 – bestaande uit: drie kookboeken; 'Chef Toub: Vega Arabisch' (€ 27,50), 'Chef Toub: Lekker Arabisch' (€ 27,50), 'Chef Toub: Snel Arabisch' (€ 27,50) en een aantal13-10-2022"
"ingrediënten voor recept uit 1 van de boeken met een waarde van ca. €25,-."
"Ontvangen van Diervriendelijk Nederland en Vegan Today een doos met vriendelijke, plantaardige levensmiddelen. De waarde is onbekend. 06-09-2022"
"Ontvangen van Noordhoff uitgevers de zesenvijftigste editie van de Grote Bosatlas ter waarde van € 69,95. 01-04-2022"
"Boucke, R.M. (Raoul) - D66"
Geschenken
Geschenk Datum
"Ontvangen van Uitgeverij Noordhoff de 56e editie van De Grote Bosatlas ter waarde van €69,95. 06-04-2022"
"Boulakjar, F. (Faissal) - D66",
Geschenken,
Geschenk,Datum
Bijgewoond het Benefietdiner op uitnodiging van Fonds gehandicaptensport. De waarde is onbekend.,15-11-2022
Ontvangen van de KNVB kaarten voor een Europese wedstrijd van AZ Alkmaar inclusief drankjes en promo-materiaal en tevens werkbezoek over stadionveiligheid. De waarde is onbekend.,03-11-2022
"Ontvangen van Uitgeverij Noordhoff de 56e editie van De Grote Bosatlas ter waarde van €69,95.",06-04-2022
"Brekelmans, R.P. (Ruben) - VVD",
Geschenken,
Geschenk,Datum
"Ontvangen van de Atlantische Commissie, het boek “Poverty by America”. De waarde is €24,-.",30-10-2023
"Ontvangen van de Jonge Atlantici, het boek “A Woman’s Place - US counterterrorism since 9/11”. De waarde is €34,34 in de boekhandel.",23-10-2023
"Ontvangen van de JOVD Breda, een fles wijn. De waarde is onbekend.",19-10-2023
Ontvangen van de vertegenwoordiger van Taiwan een doosje thee en een doosje met koekjes. De waarde is onbekend.,25-09-2023
Ontvangen van de vertegenwoordiger van Taiwan een bos bloemen. De waarde is onbekend.,21-07-2023
"Ontvangen van de delegatie van de Koreaanse Nationale Assemblee, een decoratief doosje, met een geschatte waarde van €42,-.",03-07-2023
Ontvangen van VVD Westfriesland twee Westfriese krentenmikken als dank voor een gegeven lezing. De waarde is onbekend.,01-07-2023
Ontvangen van de ambassade van Canada ter gelegenheid van Canada Day een “Canada in a Box” doos met Canadese patisserie. De waarde is onbekend.,29-06-2023
Ontvangen van de vertegenwoordiger van Taiwan een speldje met de vlaggen van Nederland en Taiwan. De waarde is onbekend.,29-06-2023
"Ontvangen het boek “Politieke polarisatie in Nederland” van Paul Dekker ter waarde van €19,90.",29-06-2023
Ontvangen van de VVD Maastricht twee mokken als dank voor een gegeven lezing. De waarde is onbekend.,23-06-2023
"Ontvangen van Dhr. Barreveld het boek “Pieter Stuyvesant – Het brein achter onze rol in de slavenhandel” van Dirk-Jan Barreveld met een geschatte waarde van €23,99.",20-06-2023
Ontvangen van de vertegenwoordiger van Taiwan een doosje thee en een doosje chocolade. De waarde is onbekend.,29-03-2023
"Ontvangen het boek “Worst Bank Scenario” van Hester Bias en Wink Sabée met een geschatte waarde van €25,-.",14-03-2023
"Ontvangen van de ambassadeur van Moldavië een fles rode wijn met een geschatte waarde van €8,-.",09-03-2023
"Ontvangen van de JOVD Amsterdam als dank voor een gegeven lezing, het boek “From Russia with Blood” van Heidi Blake. De waarde is onbekend.",09-03-2023
"Ontvangen van de ambassadeur van Bulgarije een fles rode wijn met een geschatte waarde van €12,50.",07-03-2023
"Ontvangen van de Ambassadeur van India het boek “The India Way” van S. Jaishankar met een geschatte waarde van €30,- en het boek “India, exotic destination” van Tarun Chopra met een geschatte waarde van €25,-.",22-02-2023
Ontvangen van de Thorbecke tafel van sociëteit de Witte een fles witte wijn als dank voor een gegeven lezing. De waarde is onbekend.,22-02-2023
Ontvangen van de delegatie van ANTS NGO kleine gedenkwaardige cadeaus uit Oekraïne. De waarde is onbekend.,21-02-2023
"Ontvangen van VNO NCW Brabant Zeeland als dank voor een gegeven lezing, een fles wijn. De waarde is onbekend.",20-01-2023
"Ontvangen van de vertegenwoordiger van Taiwan een agenda van onbekende waarde en een fles whisky ter waarde van €42,95.",17-01-2023
Ontvangen van de ambassadeur van Bangladesh een agenda. De waarde is onbekend.,17-01-2023
Ontvangen van de ambassadeur van Japan een kalender. De waarde is onbekend.,17-01-2023
"Ontvangen van de ambassadeur van Griekenland een fles Mastiha likeur ter waarde van €20,95.",22-12-2022
Ontvangen van Mevr. Bergkamp twee waxinelichtjeshouders. De waarde is onbekend.,22-12-2022
"Ontvangen van de ambassade van Armenië een fles witte wijn ter waarde van €9,95.",20-12-2022
Ontvangen van Aqua Minerals een flesje bier. De waarde is onbekend.,20-12-2022
"Ontvangen het boek ‘Handboek Minister’ van uitgeverij Elsevier Boeken ter waarde €14,95.",13-12-2022
Ontvangen van de Ambassadeur van Bangladesh twee doosjes thee. De waarde is onbekend.,30-11-2022
"Ontvangen van de JOVD Baronie van Breda en het Cadettenkorps als dank voor een gegeven lezing, een fles wijn en manchetknopen. De waarde is onbekend.",22-11-2022
"Ontvangen van de Ambassadeur van Bangladesh het boek ""De Onvoltooide Memoires"" van Sheikh Mujibur Rahman met een geschatte waarde van €22,- en het boek ""Bangladesh and the Netherlands, The water story: celebrating 50 years of",28-09-2022
"cooperation"". De waarde is onbekend.",
"Ontvangen van Dhr. G. Wilders, het boek ""The Satanic Verses"" van Salman Rushdie met een geschatte waarde van €13,-.",21-09-2022
"Ontvangen van de VVD Den Haag als dank voor een gegeven lezing een flesje Jenever met een geschatte waarde van €10,-.",08-09-2022
Geschenk,Datum
"Ontvangen van de vertegenwoordiger van Taiwan, een doosje thee. De waarde is onbekend.",30-08-2022
"Ontvangen van de Werkgroep Europa van het VVD Thematisch Netwerk Internationaal als dank voor een gegeven lezing het boek 'De Churchill Factor' van Boris Johnson met een geschatte waarde van €10,-.",23-08-2022
"Ontvangen van de vertegenwoordiger van Taiwan, een bos bloemen. De waarde is onbekend.",16-07-2022
"Ontvangen van de Raad voor Bestuur het boek ‘Wetenschap en Overheidsbeleid - een spanningsvolle relatie’ met een geschatte waarde van €25,-.",12-07-2022
Ontvangen van de Ambassadeur van Frankrijk een mand met Franse specialiteiten. De waarde is onbekend.,12-07-2022
"Ontvangen van de Ambassadeur van Nieuw Zeeland een fles wijn met een geschatte waarde van €10,-.",07-07-2022
Bijgewoond het Corps Diplomatique diner. De waarde is onbekend.,22-06-2022
Ontvangen van Uitgeverij Noordhoff de zesenvijftigste editie van de Grote Bosatlas. De waarde is onbekend.,30-03-2022
"Ontvangen van de Ambassadeur van de Republiek Noord Macedonië een fles wijn ter waarde van ongeveer €10,-.",09-02-2022
Ontvangen van de ambassade van de Volksrepubliek China een kalender voor 2022. De waarde is onbekend.,20-01-2022
"Ontvangen het boek ""Moraal"" van Jonathan Sacks met een geschatte waarde van €27,50.",20-01-2022
Ontvangen van de Ambassadeur van de Republiek Moldavië een fles wijn. De waarde is onbekend.,19-01-2022
"Ontvangen van de vertegenwoordiger van Taiwan een plant van onbekende waarde, een agenda van onbekende waarde en een fles whisky ter waarde van €48,50.",11-01-2022
"Ontvangen van de ambassade van Armenië een fles witte wijn ter waarde van €9,95.",11-01-2022
Ontvangen van de ambassadeur van Bangladesh een agenda. De waarde is onbekend.,11-01-2022
"Ontvangen van het Sloveense voorzitterschap van de Raad van de EU een receptenboekje, twee potjes zout, een reep chocolade en bloemzaadjes. De waarde is onbekend.",11-01-2022
Ontvangen van Dhr. Tseng een Taiwanees porseleinen bordje. De waarde is onbekend.,09-12-2021
Ontvangen van de Ambassadeur van België een doosje Belgische chocolade t.g.v. Koningsdag in België. De waarde is onbekend.,15-11-2021
"Ontvangen van de vertegenwoordiger van Taiwan een doosje thee met onbekende waarde, een agenda voor 2022 met onbekende waarde en het boek “Formosa, voorgoed verloren” van Joyce Bergvelt ter waarde van €29,99.",08-11-2021
Ontvangen van de Ambassadeur van Nieuw Zeeland een leren visitekaartjeshouder. De waarde is onbekend.,08-11-2021
"Ontvangen van de Ambassadeur van de Volksrepubliek China een doosje ""Mooncakes"". De waarde is onbekend.",29-09-2021
Ontvangen van de Ambassadeur van de Republiek Indonesië een sjaal en een kookboek. De waarde is onbekend.,13-08-2021
Ontvangen van de Ambassadeur van de Republiek Korea een doosje thee. De waarde is onbekend.,11-08-2021
"Ontvangen het boek ""Stress is een keuze"" met een geschatte waarde van €25,-.",01-07-2021
"Ontvangen van de Ambassadeur van de Republiek Azerbaijan, een potje granaatappelconfituur en een flesje granaatappelsaus. De waarde is onbekend.",23-06-2021
"Ontvangen van Vewin een Dopper waterfles met een geschatte waarde van €15,-.",22-04-2021
Ontvangen van het Interprovinciaal Overleg (IPO) een vogelhuisje en Tony’s Chocolonely’s chocolade eitjes. De waarde is onbekend.,22-04-2021
Ontvangen van de Nederlandse bierbrouwers een bierpakket. De waarde is onbekend.,22-04-2021
Ontvangen van de Provincie Groningen een draadloze telefoonoplader en telefoonhouder. De waarde is onbekend.,22-04-2021
"Ontvangen van Pieter Omtzigt het boek ""Een nieuw sociaal contract"" met een geschatte waarde van €20,-.",22-04-2021
"Breugel, C. (Carline) van - D66",
Geschenken,
Geschenk,Datum
Geen,
"Brink, G. (Bart) van den - CDA",
Geschenken,
Geschenk,Datum
Deelgenomen op uitnodiging van de gemeente Maastricht aan een diner gevolgd door een openluchtconcert van Andre Rieu. De waarde is onbekend.,20-07-2023
"Bromet, L. (Laura) - GL-PvdA",
Geschenken,
Geschenk,Datum
"Ontvangen van de UvA i.v.m. gastspreker tijdens de Opening Academisch Jaar Afdeling Neerlandistiek een boekenbon ter waarde van €50,-.",16-09-2022
Geschenk,Datum
"Ontvangen tijdens een werkbezoek met de vaste commissie voor Binnenlandse Zaken aan Wenen het boek 'Architecture in Austria in the 20th and 21st centuries' ter waarde van €68,-.",09-09-2022
"Ontvangen van Diervriendelijk Nederland en Vegan Today een doos met vriendelijke, plantaardige levensmiddelen. De waarde is onbekend.",06-09-2022
"Ontvangen van Noordhoff uitgevers de zesenvijftigste editie van de Grote Bosatlas ter waarde van € 69,95.",01-04-2022
"Ontvangen een jaarlidmaatschap en een diner van De Kring ter waarde van € 400,-.",05-11-2019
"Ontvangen van Jean-Marc van Tol het boek 'Musch' ter waarde van € 29,95.",02-10-2019
"Deelgenomen aan het Waddendiner, op uitnodiging van de Provincie Noord-Holland. De waarde is onbekend.",25-06-2019
"Ontvangen van de Provincie Noord-Holland als dank voor haar werkzaamheden als (in)formateur tijdens de formatie een weekendje weg voor twee personen ter waarde van €400,-.",12-06-2019
"Ontvangen een afscheidsetentje (waarde onbekend) van de Raad van Toezicht van Landschap Noord-Holland en een weekendje weg ter waarde van €500,-.",19-12-2018
"Deelgenomen aan Exclusief Digidiner, op uitnodiging van Vodafone Ziggo. De waarde is onbekend.",03-07-2018
"Bushoff, T.J. (Julian) - GL-PvdA",
Geschenken,
Geschenk,Datum
Geen,
"Campen, A.A.H. (Thom) van - VVD",
Geschenken,
Geschenk,Datum
Ontvangen van FNLI twee symbolische bomen. De waarde is onbekend.,26-10-2023
Ontvangen van Natuurmonumenten een houten borrelplank. De waarde is onbekend.,10-10-2023
Ontvangen van de Graanrepubliek een fles jonge jenever. De waarde is onbekend.,23-06-2023
Ontvangen van de Graanrepubliek een tasje met lokaal geproduceerde producten. De waarde is onbekend.,23-06-2023
Ontvangen van Royal Avebe een tasje met producten. De waarde is onbekend.,23-06-2023
"Ontvangen van Nationale Parken Bureau het boek ‘van Nature’ van Marcel van Ool en Marieke Schatteleijn, ter waarde van € 40,-.",14-12-2022
Ontvangen van Uitgeverij Noordhoff de zesenvijftigste editie van de Grote Bosatlas. De waarde is onbekend.,30-03-2022
Ontvangen van de LTO Academie een beeldje van Cow Parade. De waarde is onbekend.,11-11-2021
Ontvangen van M50 Middelgrote Gemeenten een tasje streekproducten ‘Laat ons niet in de Streek’. De waarde is onbekend.,27-09-2021
Ontvangen van Producten Organisatie Varkenshouderij (POV) een promotieklok tijdens een werkbezoek aan een varkenshouderij. De waarde is onbekend.,27-09-2021
Ontvangen tijdens een werkbezoek aan de Wadden een streektas van de Waddenvereniging. De waarde is onbekend.,27-09-2021
Ontvangen tijdens een werkbezoek aan Aeres Hogeschool Dronten en Agrofoodcluster Emmeloord een flevolands streekproductenpakket. De waarde is onbekend.,27-09-2021
Ontvangen van de Nederlandse land- en tuinbouwsector een kamerplant. De waarde is onbekend.,22-09-2021
"Ontvangen tijdens de Klimaat- & Diervriendelijke parlementaire BBQ een voedselpakket ter waarde van €70,-.",01-07-2021
"Ceder, D.G.M. (Don) - CU",
Geschenken,
Geschenk,Datum
"Ontvangen het boek ‘21 geheimen van een strategische dialoog’ ter waarde van €24,95.",04-04-2023
"Ontvangen van Elsevier Weekblad het boek 'Handboek Minister' ter waarde van €14,95.",04-04-2023
Ontvangen van Uitgeverij Noordhoff een Grote Bosatlas. De waarde is onbekend.,07-04-2022
"Dassen, L.A.J.M. (Laurens) - Volt",
Geschenken,
Geschenk,Datum
"Ontvangen van de BVPA een bol.com-bon voor medewerking aan een paneldiscussie ter waarde van € 35,-. Gedoneerd aan de fractieboekenkast.",22-06-2023
Geschenk,Datum
Ontvangen van De Ondernemer / DPG Media 2 flessen organic wijn (Neleman) en een koffiemok. De waarde is onbekend.,14-03-2023
"Ontvangen van Herman Poos het boek 'Er ontstaat een ander Nederland' ter waarde van € 37,50.",22-01-2023
"Ontvangen van de gemeente Eemsdelta het boek ""Pronkjewail"". De waarde is onbekend",16-01-2023
"Ontvangen van Rob Huibers zijn boek 'Een stralend Verleden' ter waarde van € 39,95.",13-10-2022
Ontvangen van Neptune Energy een veiligheidspak (incl. jas en schoenen) ten behoeve van offshore werkbezoek. De Waarde onbekend.,10-09-2022
"Ontvangen van Noordhoff uitgevers de zesenvijftigste editie van de Grote Bosatlas ter waarde van € 69,95.",01-04-2022
Ontvangen van de ambassadeur van Bangladesh een agenda en kalender. De waarde is onbekend.,24-12-2021
"Ontvangen van de vertegenwoordiger van Taiwan een agenda van onbekende waarde en een fles whisky ter waarde van €48,50.",24-12-2021
Ontvangen van de Koninklijke Vereniging Bloemist Winkeliers een vaas en bloemen. De waarde is onbekend.,23-11-2021
"Ontvangen van de Ambassadeur van Portugal 2x een Europese vlag met een waarde van ca. € 100,- in totaal",07-06-2021
"Dekker-Abdulaziz, H. (Hind) - D66",
Geschenken,
Geschenk,Datum
"Ontvangen van Uitgeverij Noordhoff de 56e editie van De Grote Bosatlas ter waarde van €69,95.",06-04-2022
"Dijck, A.P.C. (Tony) van - PVV",
Geschenken,
Geschenk,Datum
"Ontvangen van uitgeverij Noordhoff de 56e editie van de Grote Bosatlas met een waarde van €70,-.",20-04-2022
"Ontvangen van Boom uitgevers Amsterdam drie boeken: Montesquieu, over de geest van de wetten (waarde €64,50); Mill over de vrijheid (waarde €18,50) en Pascal Bruckner, Tirannie van het berouw (€23,90), Totale waarde €106,90.",30-09-2008
"Dijk, I. (Inge) van - CDA",
Geschenken,
Geschenk,Datum
"Ontvangen van Ajax twee kaarten voor de voetbalwedstrijd Ajax – NEC ter waarde van € 134,-.",05-03-2023
"Dijk, J.J. (Jasper) van - SP",
Geschenken,
Geschenk,Datum
Geen,
"Dijk, J.P. (Jimmy) - SP",
Geschenken,
Geschenk,Datum
Geen,
"Drost, N. (Nico) - CU",
Geschenken,
Geschenk,Datum
"Ontvangen van Groot Nieuws Radio een DAB+ radio ter waarde van €50,-.",21-05-2019
"Eerdmans, B.J. (Joost) - JA21",
Geschenken,
Geschenk,Datum
"Ontvangen van Uitgeverij Noordhoff een Grote Bosatlas, ter waarde van €70. (hij heeft deze weggegeven op de fractie)",31-03-2022
"Ontvangen €50,-- onkostenvergoeding op 22 mei 2006 op uitnodiging van de SGP-jongeren deelgenomen aan een debat genaamd ”Vier jaar na Fortuyn” samen met SGP-Kamerlid Van der Staay te Lekkerkerk.",22-05-2006
Ontvangen van de Stichting Ahmadiyya (Lahore) Islam een Koran,03-04-2006
"Een nieuwe uitgave van de complete Statenbijbel uit 1637 als geschenk van de Gereformeerde Bijbelstichting ter waarde van €60,--. Voor eigen gebruik gehouden.",03-04-2006
Op uitnodiging van de KNVB het bijwonen van de voetbalwedstrijd Feyenoord-Roda J.C. en een werklunch in het kader van voetbalcriminaliteit.,22-01-2006
"VVV-bonnen ter waarde van €75,-- van de Stichting Passionate als dank voor bijdrage aan debatavond Bret Easton Ellis in Hotel New York te Rotterdam.",09-03-2005
"El Yassini, Z. (Zohair) - VVD",
Geschenken,
Geschenk,Datum
Ontvangen van Elsevier Weekblad het boek ‘Handboek minister’. De waarde is onbekend.,21-12-2022
"Ontvangen van Noordhoff uitgevers de zesenvijftigste editie van de Grote Bosatlas ter waarde van € 69,95.",05-04-2022
Bijgewoond met de voorzitter van de MBO-raad de voetbalwedstrijd Ajax-Feyenoord. De waarde is onbekend.,20-03-2022
"Ontvangen van de provincie Limburg een entreeticket voor TEFAF ter waarde van €23,50. euro.",09-03-2020
"Ontvangen van de lokale fractie een borrel ter waarde van €20,-.",09-03-2020
Ontvangen één kaartje voor het concert Rammstein van de gemeente Rotterdam. De waarde is onbekend.,25-06-2019
Bijgewoond op uitnodiging van de gemeente Rotterdam het concert van Marco Borsato. De waarde is onbekend.,01-06-2019
"Ontvangen van het Museum Boijmans van Beuningen in Rotterdam twee puzzels ter waarde van €30,- per puzzel.",22-02-2019
Deelgenomen aan de wedstrijdlunch op uitnodiging van Worldskills Nederland ter gelegenheid van de vakwedstrijd ‘kok’ van Skills The Finals. De waarde is onbekend.,17-03-2018
Bijgewoond op uitnodiging van Worldskills Nederland de vakwedstrijden binnen het vmbo en mbo tijdens Skills The Finals. De waarde is onbekend.,17-03-2018
Deelgenomen aan de wedstrijdlunch op uitnodiging van Worldskills Nederland ter gelegenheid van de vakwedstrijd ‘kok’ van Skills The Finals. De waarde is onbekend.,16-03-2018
Bijgewoond op uitnodiging van Worldskills Nederland de vakwedstrijden binnen het vmbo en mbo tijdens Skills The Finals. De waarde is onbekend.,16-03-2018
"Ontvangen een uitnodiging als tafelgast bij het Haags Rode Kruis Gala, aangeboden door We Pay People. De waarde is onbekend.",11-11-2017
"Ellemeet, C.E. (Corinne) - GL-PvdA",
Geschenken,
Geschenk,Datum
"Ontvangen van Noordhoff uitgevers de zesenvijftigste editie van de Grote Bosatlas ter waarde van € 69,95.",01-04-2022
Ontvangen van het Nationaal Ballet twee kaartjes voor de première van Het Zwanenmeer. Voor eigen gebruik gehouden en de waarde is onbekend.,16-03-2019
"Ontvangen van het Nederlands Danstheater twee kaartjes voor de première Saisonnier ter waarde van €85,-. Voor eigen gebruik gehouden.",27-09-2018
Ontvangen van het Nationaal Ballet/Nationale Opera&Ballet een kaartje voor de première In the Future door de Junior Company. Voor eigen gebruik gehouden en de waarde is onbekend.,10-03-2018
Ontvangen van het Fonds Podiumkunsten twee kaartjes voor de uitreiking van de Nederlandse Muziekprijs. Voor eigen gebruik gehouden en de waarde is onbekend.,27-01-2018
